{"case_id": "cnc1_bins_template", "status": "fail", "result": {"primary": "CNC", "secondary": [], "eligible_processes": ["CNC", "CNC_TURNING", "AM", "SHEET_METAL", "CASTING", "FORGING", "EXTRUSION", "MIM"], "gated_out": ["COMPRESSION_MOLDING", "INJECTION_MOLDING", "THERMOFORMING"], "cad_lite_status": "ok", "extrusion_lite_status": "ok", "extrusion_likelihood_level": "low", "sheet_metal_likelihood_level": "med", "sheet_metal_likelihood_source": "cad_lite", "findings": [{"rule_id": "PASS1", "severity": "LOW", "process": null, "title": "Low feature variety (favorable for cycle time and tooling)"}, {"rule_id": "PASS2", "severity": "LOW", "process": null, "title": "Low accessibility risk (good tool access)"}, {"rule_id": "CAST1", "severity": "MEDIUM", "process": "CASTING", "title": "Low volume + casting (tooling risk)"}, {"rule_id": "FORG1", "severity": "MEDIUM", "process": "FORGING", "title": "Low volume + forging (tooling risk)"}, {"rule_id": "MIM1", "severity": "HIGH", "process": "MIM", "title": "Low volume + MIM (tooling ROI risk)"}], "top_priorities": ["PASS1", "PASS2"], "duration_ms": 244.49, "report": "# CNC Design Review + DFM Report\n\n## Input summary\n\n- Manufacturing process: CNC\n\n- Material: Steel\n- Production volume: Small batch\n- Load type: Static\n- Tolerance criticality: Medium\n\n- Part size: Medium\n- Min internal radius: Medium\n- Min wall thickness: Medium\n- Hole depth class: None\n- Pocket aspect class: OK\n- Feature variety: Low\n- Accessibility risk: Low\n- Has clamping faces: True\n\n\n## Process recommendation\n\n- Primary: **CNC**\n\n- Secondary: None\n\n- Less suitable (given current inputs): AM, CASTING, FORGING, EXTRUSION, MIM\n\n- Not applicable (hard gated): INJECTION_MOLDING (polymer process), THERMOFORMING (polymer process), COMPRESSION_MOLDING (polymer process)\n\n- Tradeoffs:\n\n  - Tooling lead time vs unit cost: IM/Sheet metal need tooling; CNC/AM suit low volume.\n\n  - Tolerance and finish: Define critical interfaces; plan post-machining or inspection where needed.\n\n  - Risk drivers: Warpage (IM/AM), supports (AM), setups (CNC/Sheet metal) affect feasibility.\n\n  - Volume sensitivity: IM and sheet metal favor production runs; CNC/AM suit proto and small batch.\n\n  - Documentation: 2D drawing and scale confirmation improve tolerance and process selection.\n\n\n\n## Manufacturing confidence inputs\n\n- CAD uploaded: yes\n\n- CAD analysis status: none\n\n- CAD evidence used in rules: no\n\n- CAD Lite analysis: ok\n\n- Extrusion Lite analysis: ok\n\n- Extrusion likelihood: low (source=extrusion_lite)\n\n- Sheet metal likelihood: med (source=cad_lite)\n\n_Confidence inputs not provided._\n\n\n\n## Top priorities\n\n- [LOW] Low feature variety (favorable for cycle time and tooling) (PASS1)\n\n- [LOW] Low accessibility risk (good tool access) (PASS2)\n\n\n\n## Findings (HIGH)\n\n- **Low volume + MIM (tooling ROI risk)** (MIM1) \u2014 MIM has high upfront tooling cost; unit cost only becomes favorable at production volumes.\n  - Recommendation: Consider CNC or AM for low volumes; MIM best for stable designs at production scale.\n\n## Findings (MEDIUM)\n\n- **Low volume + casting (tooling risk)** (CAST1) \u2014 Casting has significant tooling cost; economics favor production runs.\n  - Recommendation: Consider CNC or AM for low volumes; casting best at production scale.\n- **Low volume + forging (tooling risk)** (FORG1) \u2014 Forging has significant die cost; economics favor production runs.\n  - Recommendation: Consider CNC or AM for low volumes; forging best at production scale.\n\n## Findings (LOW)\n\n- **Low feature variety (favorable for cycle time and tooling)** (PASS1) \u2014 Low complexity reduces cycle time and tooling risk.\n  - Recommendation: No change needed.\n- **Low accessibility risk (good tool access)** (PASS2) \u2014 Good tool access reduces setup and machining risk.\n  - Recommendation: No change needed.\n\n## Action Checklist\n\n- [ ] Address HIGH and MEDIUM findings before release.\n- [ ] Apply recommended design changes for critical features.\n- [ ] Re-verify tolerances and interfaces after changes.\n\n## Assumptions\n\n- Inputs and part summary reflect current design intent.\n- Manufacturing process and material choices are as specified.\n\n## Usage (tokens & cost)\n\n_Usage not available._\n\n\n## LLM usage by node\n\n_Not available._\n\n\n## Agent confidence & limitations\n\n_Not available._\n", "trace": "Run started\nInputs validated\nProcess selection node entered\nprocess_selection: eligible_processes=['AM', 'CASTING', 'CNC', 'CNC_TURNING', 'EXTRUSION', 'FORGING', 'MIM', 'SHEET_METAL']\nprocess_selection: gated_out=[('INJECTION_MOLDING', 'polymer process'), ('THERMOFORMING', 'polymer process'), ('COMPRESSION_MOLDING', 'polymer process')]\nPSI: user_text_len=0 preview=\"\"\nprocess_selection: cad_lite status=ok t_est=13.4597 av_ratio=0.1486 t_over_min_dim=0.1869\nprocess_selection: sheet_metal_likelihood=med (source=cad_lite)\nprocess_selection: extrusion_likelihood=low (coeff_var=0.759286 axis=X)\nprocess_selection: scorer_path=legacy_bins cad_status=none\nPSI: score_diff=2 (primary=CNC=5, second=SHEET_METAL=3)\nProcess selection computed: primary=CNC user_selected=CNC\nprocess_selection: cad_uploaded=y evidence_available=n\nrules: cad_uploaded=y cad_status=none evidence_keys=[]\nreport: process_recommendation present=True primary=CNC", "error": null, "error_type": null, "state_has_error": false, "case_id": "cnc1_bins_template"}}
