{"case_id": "sm1_bins_steel_small", "status": "fail", "result": {"primary": "SHEET_METAL", "secondary": ["CNC"], "eligible_processes": ["CNC", "CNC_TURNING", "AM", "SHEET_METAL", "CASTING", "FORGING", "EXTRUSION", "MIM"], "gated_out": ["COMPRESSION_MOLDING", "INJECTION_MOLDING", "THERMOFORMING"], "cad_lite_status": "ok", "sheet_metal_likelihood_level": "high", "sheet_metal_likelihood_source": "cad_lite", "findings": [{"rule_id": "PASS1", "severity": "LOW", "process": null, "title": "Low feature variety (favorable for cycle time and tooling)"}, {"rule_id": "PASS2", "severity": "LOW", "process": null, "title": "Low accessibility risk (good tool access)"}, {"rule_id": "CAST1", "severity": "MEDIUM", "process": "CASTING", "title": "Low volume + casting (tooling risk)"}, {"rule_id": "FORG1", "severity": "MEDIUM", "process": "FORGING", "title": "Low volume + forging (tooling risk)"}, {"rule_id": "MIM1", "severity": "HIGH", "process": "MIM", "title": "Low volume + MIM (tooling ROI risk)"}, {"rule_id": "PSI1", "severity": "MEDIUM", "process": null, "title": "Selected process differs from recommended process"}], "top_priorities": ["PSI1", "PASS1", "PASS2"], "duration_ms": 217.27, "report": "# CNC Design Review + DFM Report\n\n## Input summary\n\n- Manufacturing process: CNC\n\n- Material: Steel\n- Production volume: Small batch\n- Load type: Static\n- Tolerance criticality: Medium\n\n- Part size: Medium\n- Min internal radius: Medium\n- Min wall thickness: Medium\n- Hole depth class: None\n- Pocket aspect class: OK\n- Feature variety: Low\n- Accessibility risk: Low\n- Has clamping faces: True\n\n\n## Process recommendation\n\n- Primary: **SHEET_METAL**\n\n- Secondary: CNC\n\n- Less suitable (given current inputs): AM, CASTING, FORGING, EXTRUSION, MIM\n\n- Not applicable (hard gated): INJECTION_MOLDING (polymer process), THERMOFORMING (polymer process), COMPRESSION_MOLDING (polymer process)\n\n- Tradeoffs:\n\n  - Tooling lead time vs unit cost: IM/Sheet metal need tooling; CNC/AM suit low volume.\n\n  - Tolerance and finish: Define critical interfaces; plan post-machining or inspection where needed.\n\n  - Risk drivers: Warpage (IM/AM), supports (AM), setups (CNC/Sheet metal) affect feasibility.\n\n  - Volume sensitivity: IM and sheet metal favor production runs; CNC/AM suit proto and small batch.\n\n  - Documentation: 2D drawing and scale confirmation improve tolerance and process selection.\n\n\n\n## Manufacturing confidence inputs\n\n- CAD uploaded: yes\n\n- CAD analysis status: none\n\n- CAD evidence used in rules: no\n\n- CAD Lite analysis: ok\n\n- Sheet metal likelihood: high (source=cad_lite)\n\n_Confidence inputs not provided._\n\n\n\n## Top priorities\n\n- [MEDIUM] Selected process differs from recommended process (PSI1)\n\n- [LOW] Low feature variety (favorable for cycle time and tooling) (PASS1)\n\n- [LOW] Low accessibility risk (good tool access) (PASS2)\n\n\n\n## Findings (HIGH)\n\n- **Low volume + MIM (tooling ROI risk)** (MIM1) \u2014 MIM has high upfront tooling cost; unit cost only becomes favorable at production volumes.\n  - Recommendation: Consider CNC or AM for low volumes; MIM best for stable designs at production scale.\n\n## Findings (MEDIUM)\n\n- **Low volume + casting (tooling risk)** (CAST1) \u2014 Casting has significant tooling cost; economics favor production runs.\n  - Recommendation: Consider CNC or AM for low volumes; casting best at production scale.\n- **Low volume + forging (tooling risk)** (FORG1) \u2014 Forging has significant die cost; economics favor production runs.\n  - Recommendation: Consider CNC or AM for low volumes; forging best at production scale.\n- **Selected process differs from recommended process** (PSI1) \u2014 Process selection intelligence recommends SHEET_METAL (score advantage: 3 points) over selected CNC. This may indicate suboptimal process choice for material, volume, or geometry.\n  - Recommendation: Consider SHEET_METAL, CNC as alternatives. Evaluate tradeoffs: tooling lead time vs unit cost, tolerance/finish requirements, and volume sensitivity.\n\n## Findings (LOW)\n\n- **Low feature variety (favorable for cycle time and tooling)** (PASS1) \u2014 Low complexity reduces cycle time and tooling risk.\n  - Recommendation: No change needed.\n- **Low accessibility risk (good tool access)** (PASS2) \u2014 Good tool access reduces setup and machining risk.\n  - Recommendation: No change needed.\n\n## Action Checklist\n\n- [ ] Address HIGH and MEDIUM findings before release.\n- [ ] Apply recommended design changes for critical features.\n- [ ] Re-verify tolerances and interfaces after changes.\n\n## Assumptions\n\n- Inputs and part summary reflect current design intent.\n- Manufacturing process and material choices are as specified.\n\n## Usage (tokens & cost)\n\n_Usage not available._\n\n\n## LLM usage by node\n\n_Not available._\n\n\n## Agent confidence & limitations\n\n_Not available._\n", "trace": "Run started\nInputs validated\nProcess selection node entered\nprocess_selection: eligible_processes=['AM', 'CASTING', 'CNC', 'CNC_TURNING', 'EXTRUSION', 'FORGING', 'MIM', 'SHEET_METAL']\nprocess_selection: gated_out=[('INJECTION_MOLDING', 'polymer process'), ('THERMOFORMING', 'polymer process'), ('COMPRESSION_MOLDING', 'polymer process')]\nPSI: user_text_len=0 preview=\"\"\nprocess_selection: cad_lite status=ok t_est=1.4457 av_ratio=1.3834 t_over_min_dim=0.0195\nprocess_selection: sheet_metal_likelihood=high (source=cad_lite)\nprocess_selection: scorer_path=legacy_bins cad_status=none\nPSI: score_diff=3 (primary=SHEET_METAL=6, second=CNC=3)\nProcess selection computed: primary=SHEET_METAL user_selected=CNC\nprocess_selection: cad_uploaded=y evidence_available=n\nProcess selection mismatch: user_selected=CNC but primary=SHEET_METAL\nProcess selection warning added: selected=CNC, recommended=SHEET_METAL\nrules: cad_uploaded=y cad_status=none evidence_keys=[]\nreport: process_recommendation present=True primary=SHEET_METAL", "error": null, "case_id": "sm1_bins_steel_small"}}
{"case_id": "sm2_bins_steel_small", "status": "fail", "result": {"primary": "CNC", "secondary": [], "eligible_processes": ["CNC", "CNC_TURNING", "AM", "SHEET_METAL", "CASTING", "FORGING", "EXTRUSION", "MIM"], "gated_out": ["COMPRESSION_MOLDING", "INJECTION_MOLDING", "THERMOFORMING"], "cad_lite_status": "failed", "sheet_metal_likelihood_level": "low", "sheet_metal_likelihood_source": "none", "findings": [{"rule_id": "PASS1", "severity": "LOW", "process": null, "title": "Low feature variety (favorable for cycle time and tooling)"}, {"rule_id": "PASS2", "severity": "LOW", "process": null, "title": "Low accessibility risk (good tool access)"}, {"rule_id": "CAST1", "severity": "MEDIUM", "process": "CASTING", "title": "Low volume + casting (tooling risk)"}, {"rule_id": "FORG1", "severity": "MEDIUM", "process": "FORGING", "title": "Low volume + forging (tooling risk)"}, {"rule_id": "MIM1", "severity": "HIGH", "process": "MIM", "title": "Low volume + MIM (tooling ROI risk)"}], "top_priorities": ["PASS1", "PASS2"], "duration_ms": 81.52, "report": "# CNC Design Review + DFM Report\n\n## Input summary\n\n- Manufacturing process: CNC\n\n- Material: Steel\n- Production volume: Small batch\n- Load type: Static\n- Tolerance criticality: Medium\n\n- Part size: Medium\n- Min internal radius: Medium\n- Min wall thickness: Medium\n- Hole depth class: None\n- Pocket aspect class: OK\n- Feature variety: Low\n- Accessibility risk: Low\n- Has clamping faces: True\n\n\n## Process recommendation\n\n- Primary: **CNC**\n\n- Secondary: None\n\n- Less suitable (given current inputs): AM, SHEET_METAL, CASTING, FORGING, EXTRUSION, MIM\n\n- Not applicable (hard gated): INJECTION_MOLDING (polymer process), THERMOFORMING (polymer process), COMPRESSION_MOLDING (polymer process)\n\n- Tradeoffs:\n\n  - Tooling lead time vs unit cost: IM/Sheet metal need tooling; CNC/AM suit low volume.\n\n  - Tolerance and finish: Define critical interfaces; plan post-machining or inspection where needed.\n\n  - Risk drivers: Warpage (IM/AM), supports (AM), setups (CNC/Sheet metal) affect feasibility.\n\n  - Volume sensitivity: IM and sheet metal favor production runs; CNC/AM suit proto and small batch.\n\n  - Documentation: 2D drawing and scale confirmation improve tolerance and process selection.\n\n\n\n## Manufacturing confidence inputs\n\n- CAD uploaded: yes\n\n- CAD analysis status: none\n\n- CAD evidence used in rules: no\n\n- CAD Lite analysis: failed\n\n- Sheet metal likelihood: low (source=none)\n\n_Confidence inputs not provided._\n\n\n\n## Top priorities\n\n- [LOW] Low feature variety (favorable for cycle time and tooling) (PASS1)\n\n- [LOW] Low accessibility risk (good tool access) (PASS2)\n\n\n\n## Findings (HIGH)\n\n- **Low volume + MIM (tooling ROI risk)** (MIM1) \u2014 MIM has high upfront tooling cost; unit cost only becomes favorable at production volumes.\n  - Recommendation: Consider CNC or AM for low volumes; MIM best for stable designs at production scale.\n\n## Findings (MEDIUM)\n\n- **Low volume + casting (tooling risk)** (CAST1) \u2014 Casting has significant tooling cost; economics favor production runs.\n  - Recommendation: Consider CNC or AM for low volumes; casting best at production scale.\n- **Low volume + forging (tooling risk)** (FORG1) \u2014 Forging has significant die cost; economics favor production runs.\n  - Recommendation: Consider CNC or AM for low volumes; forging best at production scale.\n\n## Findings (LOW)\n\n- **Low feature variety (favorable for cycle time and tooling)** (PASS1) \u2014 Low complexity reduces cycle time and tooling risk.\n  - Recommendation: No change needed.\n- **Low accessibility risk (good tool access)** (PASS2) \u2014 Good tool access reduces setup and machining risk.\n  - Recommendation: No change needed.\n\n## Action Checklist\n\n- [ ] Address HIGH and MEDIUM findings before release.\n- [ ] Apply recommended design changes for critical features.\n- [ ] Re-verify tolerances and interfaces after changes.\n\n## Assumptions\n\n- Inputs and part summary reflect current design intent.\n- Manufacturing process and material choices are as specified.\n\n## Usage (tokens & cost)\n\n_Usage not available._\n\n\n## LLM usage by node\n\n_Not available._\n\n\n## Agent confidence & limitations\n\n_Not available._\n", "trace": "Run started\nInputs validated\nProcess selection node entered\nprocess_selection: eligible_processes=['AM', 'CASTING', 'CNC', 'CNC_TURNING', 'EXTRUSION', 'FORGING', 'MIM', 'SHEET_METAL']\nprocess_selection: gated_out=[('INJECTION_MOLDING', 'polymer process'), ('THERMOFORMING', 'polymer process'), ('COMPRESSION_MOLDING', 'polymer process')]\nPSI: user_text_len=0 preview=\"\"\nprocess_selection: cad_lite status=failed\nprocess_selection: sheet_metal_likelihood=low (source=none)\nprocess_selection: scorer_path=legacy_bins cad_status=none\nPSI: score_diff=4 (primary=CNC=5, second=CNC_TURNING=1)\nProcess selection computed: primary=CNC user_selected=CNC\nprocess_selection: cad_uploaded=y evidence_available=n\nrules: cad_uploaded=y cad_status=none evidence_keys=[]\nreport: process_recommendation present=True primary=CNC", "error": null, "case_id": "sm2_bins_steel_small"}}
{"case_id": "sm3_bins_steel_small", "status": "fail", "result": {"primary": "SHEET_METAL", "secondary": ["CNC"], "eligible_processes": ["CNC", "CNC_TURNING", "AM", "SHEET_METAL", "CASTING", "FORGING", "EXTRUSION", "MIM"], "gated_out": ["COMPRESSION_MOLDING", "INJECTION_MOLDING", "THERMOFORMING"], "cad_lite_status": "ok", "sheet_metal_likelihood_level": "high", "sheet_metal_likelihood_source": "cad_lite", "findings": [{"rule_id": "PASS1", "severity": "LOW", "process": null, "title": "Low feature variety (favorable for cycle time and tooling)"}, {"rule_id": "PASS2", "severity": "LOW", "process": null, "title": "Low accessibility risk (good tool access)"}, {"rule_id": "CAST1", "severity": "MEDIUM", "process": "CASTING", "title": "Low volume + casting (tooling risk)"}, {"rule_id": "FORG1", "severity": "MEDIUM", "process": "FORGING", "title": "Low volume + forging (tooling risk)"}, {"rule_id": "MIM1", "severity": "HIGH", "process": "MIM", "title": "Low volume + MIM (tooling ROI risk)"}, {"rule_id": "PSI1", "severity": "MEDIUM", "process": null, "title": "Selected process differs from recommended process"}], "top_priorities": ["PSI1", "PASS1", "PASS2"], "duration_ms": 85.25, "report": "# CNC Design Review + DFM Report\n\n## Input summary\n\n- Manufacturing process: CNC\n\n- Material: Steel\n- Production volume: Small batch\n- Load type: Static\n- Tolerance criticality: Medium\n\n- Part size: Medium\n- Min internal radius: Medium\n- Min wall thickness: Medium\n- Hole depth class: None\n- Pocket aspect class: OK\n- Feature variety: Low\n- Accessibility risk: Low\n- Has clamping faces: True\n\n\n## Process recommendation\n\n- Primary: **SHEET_METAL**\n\n- Secondary: CNC\n\n- Less suitable (given current inputs): AM, CASTING, FORGING, EXTRUSION, MIM\n\n- Not applicable (hard gated): INJECTION_MOLDING (polymer process), THERMOFORMING (polymer process), COMPRESSION_MOLDING (polymer process)\n\n- Tradeoffs:\n\n  - Tooling lead time vs unit cost: IM/Sheet metal need tooling; CNC/AM suit low volume.\n\n  - Tolerance and finish: Define critical interfaces; plan post-machining or inspection where needed.\n\n  - Risk drivers: Warpage (IM/AM), supports (AM), setups (CNC/Sheet metal) affect feasibility.\n\n  - Volume sensitivity: IM and sheet metal favor production runs; CNC/AM suit proto and small batch.\n\n  - Documentation: 2D drawing and scale confirmation improve tolerance and process selection.\n\n\n\n## Manufacturing confidence inputs\n\n- CAD uploaded: yes\n\n- CAD analysis status: none\n\n- CAD evidence used in rules: no\n\n- CAD Lite analysis: ok\n\n- Sheet metal likelihood: high (source=cad_lite)\n\n_Confidence inputs not provided._\n\n\n\n## Top priorities\n\n- [MEDIUM] Selected process differs from recommended process (PSI1)\n\n- [LOW] Low feature variety (favorable for cycle time and tooling) (PASS1)\n\n- [LOW] Low accessibility risk (good tool access) (PASS2)\n\n\n\n## Findings (HIGH)\n\n- **Low volume + MIM (tooling ROI risk)** (MIM1) \u2014 MIM has high upfront tooling cost; unit cost only becomes favorable at production volumes.\n  - Recommendation: Consider CNC or AM for low volumes; MIM best for stable designs at production scale.\n\n## Findings (MEDIUM)\n\n- **Low volume + casting (tooling risk)** (CAST1) \u2014 Casting has significant tooling cost; economics favor production runs.\n  - Recommendation: Consider CNC or AM for low volumes; casting best at production scale.\n- **Low volume + forging (tooling risk)** (FORG1) \u2014 Forging has significant die cost; economics favor production runs.\n  - Recommendation: Consider CNC or AM for low volumes; forging best at production scale.\n- **Selected process differs from recommended process** (PSI1) \u2014 Process selection intelligence recommends SHEET_METAL (score advantage: 3 points) over selected CNC. This may indicate suboptimal process choice for material, volume, or geometry.\n  - Recommendation: Consider SHEET_METAL, CNC as alternatives. Evaluate tradeoffs: tooling lead time vs unit cost, tolerance/finish requirements, and volume sensitivity.\n\n## Findings (LOW)\n\n- **Low feature variety (favorable for cycle time and tooling)** (PASS1) \u2014 Low complexity reduces cycle time and tooling risk.\n  - Recommendation: No change needed.\n- **Low accessibility risk (good tool access)** (PASS2) \u2014 Good tool access reduces setup and machining risk.\n  - Recommendation: No change needed.\n\n## Action Checklist\n\n- [ ] Address HIGH and MEDIUM findings before release.\n- [ ] Apply recommended design changes for critical features.\n- [ ] Re-verify tolerances and interfaces after changes.\n\n## Assumptions\n\n- Inputs and part summary reflect current design intent.\n- Manufacturing process and material choices are as specified.\n\n## Usage (tokens & cost)\n\n_Usage not available._\n\n\n## LLM usage by node\n\n_Not available._\n\n\n## Agent confidence & limitations\n\n_Not available._\n", "trace": "Run started\nInputs validated\nProcess selection node entered\nprocess_selection: eligible_processes=['AM', 'CASTING', 'CNC', 'CNC_TURNING', 'EXTRUSION', 'FORGING', 'MIM', 'SHEET_METAL']\nprocess_selection: gated_out=[('INJECTION_MOLDING', 'polymer process'), ('THERMOFORMING', 'polymer process'), ('COMPRESSION_MOLDING', 'polymer process')]\nPSI: user_text_len=0 preview=\"\"\nprocess_selection: cad_lite status=ok t_est=2.9112 av_ratio=0.687 t_over_min_dim=0.0178\nprocess_selection: sheet_metal_likelihood=high (source=cad_lite)\nprocess_selection: scorer_path=legacy_bins cad_status=none\nPSI: score_diff=3 (primary=SHEET_METAL=6, second=CNC=3)\nProcess selection computed: primary=SHEET_METAL user_selected=CNC\nprocess_selection: cad_uploaded=y evidence_available=n\nProcess selection mismatch: user_selected=CNC but primary=SHEET_METAL\nProcess selection warning added: selected=CNC, recommended=SHEET_METAL\nrules: cad_uploaded=y cad_status=none evidence_keys=[]\nreport: process_recommendation present=True primary=SHEET_METAL", "error": null, "case_id": "sm3_bins_steel_small"}}
{"case_id": "sm4_bins_steel_small", "status": "fail", "result": {"primary": "SHEET_METAL", "secondary": ["CNC"], "eligible_processes": ["CNC", "CNC_TURNING", "AM", "SHEET_METAL", "CASTING", "FORGING", "EXTRUSION", "MIM"], "gated_out": ["COMPRESSION_MOLDING", "INJECTION_MOLDING", "THERMOFORMING"], "cad_lite_status": "ok", "sheet_metal_likelihood_level": "high", "sheet_metal_likelihood_source": "cad_lite", "findings": [{"rule_id": "PASS1", "severity": "LOW", "process": null, "title": "Low feature variety (favorable for cycle time and tooling)"}, {"rule_id": "PASS2", "severity": "LOW", "process": null, "title": "Low accessibility risk (good tool access)"}, {"rule_id": "CAST1", "severity": "MEDIUM", "process": "CASTING", "title": "Low volume + casting (tooling risk)"}, {"rule_id": "FORG1", "severity": "MEDIUM", "process": "FORGING", "title": "Low volume + forging (tooling risk)"}, {"rule_id": "MIM1", "severity": "HIGH", "process": "MIM", "title": "Low volume + MIM (tooling ROI risk)"}, {"rule_id": "PSI1", "severity": "MEDIUM", "process": null, "title": "Selected process differs from recommended process"}], "top_priorities": ["PSI1", "PASS1", "PASS2"], "duration_ms": 84.09, "report": "# CNC Design Review + DFM Report\n\n## Input summary\n\n- Manufacturing process: CNC\n\n- Material: Steel\n- Production volume: Small batch\n- Load type: Static\n- Tolerance criticality: Medium\n\n- Part size: Medium\n- Min internal radius: Medium\n- Min wall thickness: Medium\n- Hole depth class: None\n- Pocket aspect class: OK\n- Feature variety: Low\n- Accessibility risk: Low\n- Has clamping faces: True\n\n\n## Process recommendation\n\n- Primary: **SHEET_METAL**\n\n- Secondary: CNC\n\n- Less suitable (given current inputs): AM, CASTING, FORGING, EXTRUSION, MIM\n\n- Not applicable (hard gated): INJECTION_MOLDING (polymer process), THERMOFORMING (polymer process), COMPRESSION_MOLDING (polymer process)\n\n- Tradeoffs:\n\n  - Tooling lead time vs unit cost: IM/Sheet metal need tooling; CNC/AM suit low volume.\n\n  - Tolerance and finish: Define critical interfaces; plan post-machining or inspection where needed.\n\n  - Risk drivers: Warpage (IM/AM), supports (AM), setups (CNC/Sheet metal) affect feasibility.\n\n  - Volume sensitivity: IM and sheet metal favor production runs; CNC/AM suit proto and small batch.\n\n  - Documentation: 2D drawing and scale confirmation improve tolerance and process selection.\n\n\n\n## Manufacturing confidence inputs\n\n- CAD uploaded: yes\n\n- CAD analysis status: none\n\n- CAD evidence used in rules: no\n\n- CAD Lite analysis: ok\n\n- Sheet metal likelihood: high (source=cad_lite)\n\n_Confidence inputs not provided._\n\n\n\n## Top priorities\n\n- [MEDIUM] Selected process differs from recommended process (PSI1)\n\n- [LOW] Low feature variety (favorable for cycle time and tooling) (PASS1)\n\n- [LOW] Low accessibility risk (good tool access) (PASS2)\n\n\n\n## Findings (HIGH)\n\n- **Low volume + MIM (tooling ROI risk)** (MIM1) \u2014 MIM has high upfront tooling cost; unit cost only becomes favorable at production volumes.\n  - Recommendation: Consider CNC or AM for low volumes; MIM best for stable designs at production scale.\n\n## Findings (MEDIUM)\n\n- **Low volume + casting (tooling risk)** (CAST1) \u2014 Casting has significant tooling cost; economics favor production runs.\n  - Recommendation: Consider CNC or AM for low volumes; casting best at production scale.\n- **Low volume + forging (tooling risk)** (FORG1) \u2014 Forging has significant die cost; economics favor production runs.\n  - Recommendation: Consider CNC or AM for low volumes; forging best at production scale.\n- **Selected process differs from recommended process** (PSI1) \u2014 Process selection intelligence recommends SHEET_METAL (score advantage: 3 points) over selected CNC. This may indicate suboptimal process choice for material, volume, or geometry.\n  - Recommendation: Consider SHEET_METAL, CNC as alternatives. Evaluate tradeoffs: tooling lead time vs unit cost, tolerance/finish requirements, and volume sensitivity.\n\n## Findings (LOW)\n\n- **Low feature variety (favorable for cycle time and tooling)** (PASS1) \u2014 Low complexity reduces cycle time and tooling risk.\n  - Recommendation: No change needed.\n- **Low accessibility risk (good tool access)** (PASS2) \u2014 Good tool access reduces setup and machining risk.\n  - Recommendation: No change needed.\n\n## Action Checklist\n\n- [ ] Address HIGH and MEDIUM findings before release.\n- [ ] Apply recommended design changes for critical features.\n- [ ] Re-verify tolerances and interfaces after changes.\n\n## Assumptions\n\n- Inputs and part summary reflect current design intent.\n- Manufacturing process and material choices are as specified.\n\n## Usage (tokens & cost)\n\n_Usage not available._\n\n\n## LLM usage by node\n\n_Not available._\n\n\n## Agent confidence & limitations\n\n_Not available._\n", "trace": "Run started\nInputs validated\nProcess selection node entered\nprocess_selection: eligible_processes=['AM', 'CASTING', 'CNC', 'CNC_TURNING', 'EXTRUSION', 'FORGING', 'MIM', 'SHEET_METAL']\nprocess_selection: gated_out=[('INJECTION_MOLDING', 'polymer process'), ('THERMOFORMING', 'polymer process'), ('COMPRESSION_MOLDING', 'polymer process')]\nPSI: user_text_len=0 preview=\"\"\nprocess_selection: cad_lite status=ok t_est=1.1021 av_ratio=1.8147 t_over_min_dim=0.0367\nprocess_selection: sheet_metal_likelihood=high (source=cad_lite)\nprocess_selection: scorer_path=legacy_bins cad_status=none\nPSI: score_diff=3 (primary=SHEET_METAL=6, second=CNC=3)\nProcess selection computed: primary=SHEET_METAL user_selected=CNC\nprocess_selection: cad_uploaded=y evidence_available=n\nProcess selection mismatch: user_selected=CNC but primary=SHEET_METAL\nProcess selection warning added: selected=CNC, recommended=SHEET_METAL\nrules: cad_uploaded=y cad_status=none evidence_keys=[]\nreport: process_recommendation present=True primary=SHEET_METAL", "error": null, "case_id": "sm4_bins_steel_small"}}
{"case_id": "cnc1_bins_steel_small", "status": "pass", "result": {"primary": "CNC", "secondary": [], "eligible_processes": ["CNC", "CNC_TURNING", "AM", "SHEET_METAL", "CASTING", "FORGING", "EXTRUSION", "MIM"], "gated_out": ["COMPRESSION_MOLDING", "INJECTION_MOLDING", "THERMOFORMING"], "cad_lite_status": "ok", "sheet_metal_likelihood_level": "med", "sheet_metal_likelihood_source": "cad_lite", "findings": [{"rule_id": "PASS1", "severity": "LOW", "process": null, "title": "Low feature variety (favorable for cycle time and tooling)"}, {"rule_id": "PASS2", "severity": "LOW", "process": null, "title": "Low accessibility risk (good tool access)"}, {"rule_id": "CAST1", "severity": "MEDIUM", "process": "CASTING", "title": "Low volume + casting (tooling risk)"}, {"rule_id": "FORG1", "severity": "MEDIUM", "process": "FORGING", "title": "Low volume + forging (tooling risk)"}, {"rule_id": "MIM1", "severity": "HIGH", "process": "MIM", "title": "Low volume + MIM (tooling ROI risk)"}], "top_priorities": ["PASS1", "PASS2"], "duration_ms": 86.36, "report": "# CNC Design Review + DFM Report\n\n## Input summary\n\n- Manufacturing process: CNC\n\n- Material: Steel\n- Production volume: Small batch\n- Load type: Static\n- Tolerance criticality: Medium\n\n- Part size: Medium\n- Min internal radius: Medium\n- Min wall thickness: Medium\n- Hole depth class: None\n- Pocket aspect class: OK\n- Feature variety: Low\n- Accessibility risk: Low\n- Has clamping faces: True\n\n\n## Process recommendation\n\n- Primary: **CNC**\n\n- Secondary: None\n\n- Less suitable (given current inputs): AM, CASTING, FORGING, EXTRUSION, MIM\n\n- Not applicable (hard gated): INJECTION_MOLDING (polymer process), THERMOFORMING (polymer process), COMPRESSION_MOLDING (polymer process)\n\n- Tradeoffs:\n\n  - Tooling lead time vs unit cost: IM/Sheet metal need tooling; CNC/AM suit low volume.\n\n  - Tolerance and finish: Define critical interfaces; plan post-machining or inspection where needed.\n\n  - Risk drivers: Warpage (IM/AM), supports (AM), setups (CNC/Sheet metal) affect feasibility.\n\n  - Volume sensitivity: IM and sheet metal favor production runs; CNC/AM suit proto and small batch.\n\n  - Documentation: 2D drawing and scale confirmation improve tolerance and process selection.\n\n\n\n## Manufacturing confidence inputs\n\n- CAD uploaded: yes\n\n- CAD analysis status: none\n\n- CAD evidence used in rules: no\n\n- CAD Lite analysis: ok\n\n- Sheet metal likelihood: med (source=cad_lite)\n\n_Confidence inputs not provided._\n\n\n\n## Top priorities\n\n- [LOW] Low feature variety (favorable for cycle time and tooling) (PASS1)\n\n- [LOW] Low accessibility risk (good tool access) (PASS2)\n\n\n\n## Findings (HIGH)\n\n- **Low volume + MIM (tooling ROI risk)** (MIM1) \u2014 MIM has high upfront tooling cost; unit cost only becomes favorable at production volumes.\n  - Recommendation: Consider CNC or AM for low volumes; MIM best for stable designs at production scale.\n\n## Findings (MEDIUM)\n\n- **Low volume + casting (tooling risk)** (CAST1) \u2014 Casting has significant tooling cost; economics favor production runs.\n  - Recommendation: Consider CNC or AM for low volumes; casting best at production scale.\n- **Low volume + forging (tooling risk)** (FORG1) \u2014 Forging has significant die cost; economics favor production runs.\n  - Recommendation: Consider CNC or AM for low volumes; forging best at production scale.\n\n## Findings (LOW)\n\n- **Low feature variety (favorable for cycle time and tooling)** (PASS1) \u2014 Low complexity reduces cycle time and tooling risk.\n  - Recommendation: No change needed.\n- **Low accessibility risk (good tool access)** (PASS2) \u2014 Good tool access reduces setup and machining risk.\n  - Recommendation: No change needed.\n\n## Action Checklist\n\n- [ ] Address HIGH and MEDIUM findings before release.\n- [ ] Apply recommended design changes for critical features.\n- [ ] Re-verify tolerances and interfaces after changes.\n\n## Assumptions\n\n- Inputs and part summary reflect current design intent.\n- Manufacturing process and material choices are as specified.\n\n## Usage (tokens & cost)\n\n_Usage not available._\n\n\n## LLM usage by node\n\n_Not available._\n\n\n## Agent confidence & limitations\n\n_Not available._\n", "trace": "Run started\nInputs validated\nProcess selection node entered\nprocess_selection: eligible_processes=['AM', 'CASTING', 'CNC', 'CNC_TURNING', 'EXTRUSION', 'FORGING', 'MIM', 'SHEET_METAL']\nprocess_selection: gated_out=[('INJECTION_MOLDING', 'polymer process'), ('THERMOFORMING', 'polymer process'), ('COMPRESSION_MOLDING', 'polymer process')]\nPSI: user_text_len=0 preview=\"\"\nprocess_selection: cad_lite status=ok t_est=13.4597 av_ratio=0.1486 t_over_min_dim=0.1869\nprocess_selection: sheet_metal_likelihood=med (source=cad_lite)\nprocess_selection: scorer_path=legacy_bins cad_status=none\nPSI: score_diff=2 (primary=CNC=5, second=SHEET_METAL=3)\nProcess selection computed: primary=CNC user_selected=CNC\nprocess_selection: cad_uploaded=y evidence_available=n\nrules: cad_uploaded=y cad_status=none evidence_keys=[]\nreport: process_recommendation present=True primary=CNC", "error": null, "case_id": "cnc1_bins_steel_small"}}
{"case_id": "cnc2_bins_steel_small", "status": "fail", "result": {"primary": "SHEET_METAL", "secondary": ["CNC"], "eligible_processes": ["CNC", "CNC_TURNING", "AM", "SHEET_METAL", "CASTING", "FORGING", "EXTRUSION", "MIM"], "gated_out": ["COMPRESSION_MOLDING", "INJECTION_MOLDING", "THERMOFORMING"], "cad_lite_status": "ok", "sheet_metal_likelihood_level": "high", "sheet_metal_likelihood_source": "cad_lite", "findings": [{"rule_id": "PASS1", "severity": "LOW", "process": null, "title": "Low feature variety (favorable for cycle time and tooling)"}, {"rule_id": "PASS2", "severity": "LOW", "process": null, "title": "Low accessibility risk (good tool access)"}, {"rule_id": "CAST1", "severity": "MEDIUM", "process": "CASTING", "title": "Low volume + casting (tooling risk)"}, {"rule_id": "FORG1", "severity": "MEDIUM", "process": "FORGING", "title": "Low volume + forging (tooling risk)"}, {"rule_id": "MIM1", "severity": "HIGH", "process": "MIM", "title": "Low volume + MIM (tooling ROI risk)"}, {"rule_id": "PSI1", "severity": "MEDIUM", "process": null, "title": "Selected process differs from recommended process"}], "top_priorities": ["PSI1", "PASS1", "PASS2"], "duration_ms": 85.19, "report": "# CNC Design Review + DFM Report\n\n## Input summary\n\n- Manufacturing process: CNC\n\n- Material: Steel\n- Production volume: Small batch\n- Load type: Static\n- Tolerance criticality: Medium\n\n- Part size: Medium\n- Min internal radius: Medium\n- Min wall thickness: Medium\n- Hole depth class: None\n- Pocket aspect class: OK\n- Feature variety: Low\n- Accessibility risk: Low\n- Has clamping faces: True\n\n\n## Process recommendation\n\n- Primary: **SHEET_METAL**\n\n- Secondary: CNC\n\n- Less suitable (given current inputs): AM, CASTING, FORGING, EXTRUSION, MIM\n\n- Not applicable (hard gated): INJECTION_MOLDING (polymer process), THERMOFORMING (polymer process), COMPRESSION_MOLDING (polymer process)\n\n- Tradeoffs:\n\n  - Tooling lead time vs unit cost: IM/Sheet metal need tooling; CNC/AM suit low volume.\n\n  - Tolerance and finish: Define critical interfaces; plan post-machining or inspection where needed.\n\n  - Risk drivers: Warpage (IM/AM), supports (AM), setups (CNC/Sheet metal) affect feasibility.\n\n  - Volume sensitivity: IM and sheet metal favor production runs; CNC/AM suit proto and small batch.\n\n  - Documentation: 2D drawing and scale confirmation improve tolerance and process selection.\n\n\n\n## Manufacturing confidence inputs\n\n- CAD uploaded: yes\n\n- CAD analysis status: none\n\n- CAD evidence used in rules: no\n\n- CAD Lite analysis: ok\n\n- Sheet metal likelihood: high (source=cad_lite)\n\n_Confidence inputs not provided._\n\n\n\n## Top priorities\n\n- [MEDIUM] Selected process differs from recommended process (PSI1)\n\n- [LOW] Low feature variety (favorable for cycle time and tooling) (PASS1)\n\n- [LOW] Low accessibility risk (good tool access) (PASS2)\n\n\n\n## Findings (HIGH)\n\n- **Low volume + MIM (tooling ROI risk)** (MIM1) \u2014 MIM has high upfront tooling cost; unit cost only becomes favorable at production volumes.\n  - Recommendation: Consider CNC or AM for low volumes; MIM best for stable designs at production scale.\n\n## Findings (MEDIUM)\n\n- **Low volume + casting (tooling risk)** (CAST1) \u2014 Casting has significant tooling cost; economics favor production runs.\n  - Recommendation: Consider CNC or AM for low volumes; casting best at production scale.\n- **Low volume + forging (tooling risk)** (FORG1) \u2014 Forging has significant die cost; economics favor production runs.\n  - Recommendation: Consider CNC or AM for low volumes; forging best at production scale.\n- **Selected process differs from recommended process** (PSI1) \u2014 Process selection intelligence recommends SHEET_METAL (score advantage: 3 points) over selected CNC. This may indicate suboptimal process choice for material, volume, or geometry.\n  - Recommendation: Consider SHEET_METAL, CNC as alternatives. Evaluate tradeoffs: tooling lead time vs unit cost, tolerance/finish requirements, and volume sensitivity.\n\n## Findings (LOW)\n\n- **Low feature variety (favorable for cycle time and tooling)** (PASS1) \u2014 Low complexity reduces cycle time and tooling risk.\n  - Recommendation: No change needed.\n- **Low accessibility risk (good tool access)** (PASS2) \u2014 Good tool access reduces setup and machining risk.\n  - Recommendation: No change needed.\n\n## Action Checklist\n\n- [ ] Address HIGH and MEDIUM findings before release.\n- [ ] Apply recommended design changes for critical features.\n- [ ] Re-verify tolerances and interfaces after changes.\n\n## Assumptions\n\n- Inputs and part summary reflect current design intent.\n- Manufacturing process and material choices are as specified.\n\n## Usage (tokens & cost)\n\n_Usage not available._\n\n\n## LLM usage by node\n\n_Not available._\n\n\n## Agent confidence & limitations\n\n_Not available._\n", "trace": "Run started\nInputs validated\nProcess selection node entered\nprocess_selection: eligible_processes=['AM', 'CASTING', 'CNC', 'CNC_TURNING', 'EXTRUSION', 'FORGING', 'MIM', 'SHEET_METAL']\nprocess_selection: gated_out=[('INJECTION_MOLDING', 'polymer process'), ('THERMOFORMING', 'polymer process'), ('COMPRESSION_MOLDING', 'polymer process')]\nPSI: user_text_len=0 preview=\"\"\nprocess_selection: cad_lite status=ok t_est=8.5037 av_ratio=0.2352 t_over_min_dim=0.0945\nprocess_selection: sheet_metal_likelihood=high (source=cad_lite)\nprocess_selection: scorer_path=legacy_bins cad_status=none\nPSI: score_diff=3 (primary=SHEET_METAL=6, second=CNC=3)\nProcess selection computed: primary=SHEET_METAL user_selected=CNC\nprocess_selection: cad_uploaded=y evidence_available=n\nProcess selection mismatch: user_selected=CNC but primary=SHEET_METAL\nProcess selection warning added: selected=CNC, recommended=SHEET_METAL\nrules: cad_uploaded=y cad_status=none evidence_keys=[]\nreport: process_recommendation present=True primary=SHEET_METAL", "error": null, "case_id": "cnc2_bins_steel_small"}}
{"case_id": "cnc3_bins_steel_small", "status": "pass", "result": {"primary": "CNC", "secondary": [], "eligible_processes": ["CNC", "CNC_TURNING", "AM", "SHEET_METAL", "CASTING", "FORGING", "EXTRUSION", "MIM"], "gated_out": ["COMPRESSION_MOLDING", "INJECTION_MOLDING", "THERMOFORMING"], "cad_lite_status": "ok", "sheet_metal_likelihood_level": "med", "sheet_metal_likelihood_source": "cad_lite", "findings": [{"rule_id": "PASS1", "severity": "LOW", "process": null, "title": "Low feature variety (favorable for cycle time and tooling)"}, {"rule_id": "PASS2", "severity": "LOW", "process": null, "title": "Low accessibility risk (good tool access)"}, {"rule_id": "CAST1", "severity": "MEDIUM", "process": "CASTING", "title": "Low volume + casting (tooling risk)"}, {"rule_id": "FORG1", "severity": "MEDIUM", "process": "FORGING", "title": "Low volume + forging (tooling risk)"}, {"rule_id": "MIM1", "severity": "HIGH", "process": "MIM", "title": "Low volume + MIM (tooling ROI risk)"}], "top_priorities": ["PASS1", "PASS2"], "duration_ms": 83.51, "report": "# CNC Design Review + DFM Report\n\n## Input summary\n\n- Manufacturing process: CNC\n\n- Material: Steel\n- Production volume: Small batch\n- Load type: Static\n- Tolerance criticality: Medium\n\n- Part size: Medium\n- Min internal radius: Medium\n- Min wall thickness: Medium\n- Hole depth class: None\n- Pocket aspect class: OK\n- Feature variety: Low\n- Accessibility risk: Low\n- Has clamping faces: True\n\n\n## Process recommendation\n\n- Primary: **CNC**\n\n- Secondary: None\n\n- Less suitable (given current inputs): AM, CASTING, FORGING, EXTRUSION, MIM\n\n- Not applicable (hard gated): INJECTION_MOLDING (polymer process), THERMOFORMING (polymer process), COMPRESSION_MOLDING (polymer process)\n\n- Tradeoffs:\n\n  - Tooling lead time vs unit cost: IM/Sheet metal need tooling; CNC/AM suit low volume.\n\n  - Tolerance and finish: Define critical interfaces; plan post-machining or inspection where needed.\n\n  - Risk drivers: Warpage (IM/AM), supports (AM), setups (CNC/Sheet metal) affect feasibility.\n\n  - Volume sensitivity: IM and sheet metal favor production runs; CNC/AM suit proto and small batch.\n\n  - Documentation: 2D drawing and scale confirmation improve tolerance and process selection.\n\n\n\n## Manufacturing confidence inputs\n\n- CAD uploaded: yes\n\n- CAD analysis status: none\n\n- CAD evidence used in rules: no\n\n- CAD Lite analysis: ok\n\n- Sheet metal likelihood: med (source=cad_lite)\n\n_Confidence inputs not provided._\n\n\n\n## Top priorities\n\n- [LOW] Low feature variety (favorable for cycle time and tooling) (PASS1)\n\n- [LOW] Low accessibility risk (good tool access) (PASS2)\n\n\n\n## Findings (HIGH)\n\n- **Low volume + MIM (tooling ROI risk)** (MIM1) \u2014 MIM has high upfront tooling cost; unit cost only becomes favorable at production volumes.\n  - Recommendation: Consider CNC or AM for low volumes; MIM best for stable designs at production scale.\n\n## Findings (MEDIUM)\n\n- **Low volume + casting (tooling risk)** (CAST1) \u2014 Casting has significant tooling cost; economics favor production runs.\n  - Recommendation: Consider CNC or AM for low volumes; casting best at production scale.\n- **Low volume + forging (tooling risk)** (FORG1) \u2014 Forging has significant die cost; economics favor production runs.\n  - Recommendation: Consider CNC or AM for low volumes; forging best at production scale.\n\n## Findings (LOW)\n\n- **Low feature variety (favorable for cycle time and tooling)** (PASS1) \u2014 Low complexity reduces cycle time and tooling risk.\n  - Recommendation: No change needed.\n- **Low accessibility risk (good tool access)** (PASS2) \u2014 Good tool access reduces setup and machining risk.\n  - Recommendation: No change needed.\n\n## Action Checklist\n\n- [ ] Address HIGH and MEDIUM findings before release.\n- [ ] Apply recommended design changes for critical features.\n- [ ] Re-verify tolerances and interfaces after changes.\n\n## Assumptions\n\n- Inputs and part summary reflect current design intent.\n- Manufacturing process and material choices are as specified.\n\n## Usage (tokens & cost)\n\n_Usage not available._\n\n\n## LLM usage by node\n\n_Not available._\n\n\n## Agent confidence & limitations\n\n_Not available._\n", "trace": "Run started\nInputs validated\nProcess selection node entered\nprocess_selection: eligible_processes=['AM', 'CASTING', 'CNC', 'CNC_TURNING', 'EXTRUSION', 'FORGING', 'MIM', 'SHEET_METAL']\nprocess_selection: gated_out=[('INJECTION_MOLDING', 'polymer process'), ('THERMOFORMING', 'polymer process'), ('COMPRESSION_MOLDING', 'polymer process')]\nPSI: user_text_len=0 preview=\"\"\nprocess_selection: cad_lite status=ok t_est=5.2318 av_ratio=0.3823 t_over_min_dim=0.2754\nprocess_selection: sheet_metal_likelihood=med (source=cad_lite)\nprocess_selection: scorer_path=legacy_bins cad_status=none\nPSI: score_diff=2 (primary=CNC=5, second=SHEET_METAL=3)\nProcess selection computed: primary=CNC user_selected=CNC\nprocess_selection: cad_uploaded=y evidence_available=n\nrules: cad_uploaded=y cad_status=none evidence_keys=[]\nreport: process_recommendation present=True primary=CNC", "error": null, "case_id": "cnc3_bins_steel_small"}}
{"case_id": "cnc4_bins_steel_small", "status": "pass", "result": {"primary": "CNC", "secondary": [], "eligible_processes": ["CNC", "CNC_TURNING", "AM", "SHEET_METAL", "CASTING", "FORGING", "EXTRUSION", "MIM"], "gated_out": ["COMPRESSION_MOLDING", "INJECTION_MOLDING", "THERMOFORMING"], "cad_lite_status": "failed", "sheet_metal_likelihood_level": "low", "sheet_metal_likelihood_source": "none", "findings": [{"rule_id": "PASS1", "severity": "LOW", "process": null, "title": "Low feature variety (favorable for cycle time and tooling)"}, {"rule_id": "PASS2", "severity": "LOW", "process": null, "title": "Low accessibility risk (good tool access)"}, {"rule_id": "CAST1", "severity": "MEDIUM", "process": "CASTING", "title": "Low volume + casting (tooling risk)"}, {"rule_id": "FORG1", "severity": "MEDIUM", "process": "FORGING", "title": "Low volume + forging (tooling risk)"}, {"rule_id": "MIM1", "severity": "HIGH", "process": "MIM", "title": "Low volume + MIM (tooling ROI risk)"}], "top_priorities": ["PASS1", "PASS2"], "duration_ms": 83.41, "report": "# CNC Design Review + DFM Report\n\n## Input summary\n\n- Manufacturing process: CNC\n\n- Material: Steel\n- Production volume: Small batch\n- Load type: Static\n- Tolerance criticality: Medium\n\n- Part size: Medium\n- Min internal radius: Medium\n- Min wall thickness: Medium\n- Hole depth class: None\n- Pocket aspect class: OK\n- Feature variety: Low\n- Accessibility risk: Low\n- Has clamping faces: True\n\n\n## Process recommendation\n\n- Primary: **CNC**\n\n- Secondary: None\n\n- Less suitable (given current inputs): AM, SHEET_METAL, CASTING, FORGING, EXTRUSION, MIM\n\n- Not applicable (hard gated): INJECTION_MOLDING (polymer process), THERMOFORMING (polymer process), COMPRESSION_MOLDING (polymer process)\n\n- Tradeoffs:\n\n  - Tooling lead time vs unit cost: IM/Sheet metal need tooling; CNC/AM suit low volume.\n\n  - Tolerance and finish: Define critical interfaces; plan post-machining or inspection where needed.\n\n  - Risk drivers: Warpage (IM/AM), supports (AM), setups (CNC/Sheet metal) affect feasibility.\n\n  - Volume sensitivity: IM and sheet metal favor production runs; CNC/AM suit proto and small batch.\n\n  - Documentation: 2D drawing and scale confirmation improve tolerance and process selection.\n\n\n\n## Manufacturing confidence inputs\n\n- CAD uploaded: yes\n\n- CAD analysis status: none\n\n- CAD evidence used in rules: no\n\n- CAD Lite analysis: failed\n\n- Sheet metal likelihood: low (source=none)\n\n_Confidence inputs not provided._\n\n\n\n## Top priorities\n\n- [LOW] Low feature variety (favorable for cycle time and tooling) (PASS1)\n\n- [LOW] Low accessibility risk (good tool access) (PASS2)\n\n\n\n## Findings (HIGH)\n\n- **Low volume + MIM (tooling ROI risk)** (MIM1) \u2014 MIM has high upfront tooling cost; unit cost only becomes favorable at production volumes.\n  - Recommendation: Consider CNC or AM for low volumes; MIM best for stable designs at production scale.\n\n## Findings (MEDIUM)\n\n- **Low volume + casting (tooling risk)** (CAST1) \u2014 Casting has significant tooling cost; economics favor production runs.\n  - Recommendation: Consider CNC or AM for low volumes; casting best at production scale.\n- **Low volume + forging (tooling risk)** (FORG1) \u2014 Forging has significant die cost; economics favor production runs.\n  - Recommendation: Consider CNC or AM for low volumes; forging best at production scale.\n\n## Findings (LOW)\n\n- **Low feature variety (favorable for cycle time and tooling)** (PASS1) \u2014 Low complexity reduces cycle time and tooling risk.\n  - Recommendation: No change needed.\n- **Low accessibility risk (good tool access)** (PASS2) \u2014 Good tool access reduces setup and machining risk.\n  - Recommendation: No change needed.\n\n## Action Checklist\n\n- [ ] Address HIGH and MEDIUM findings before release.\n- [ ] Apply recommended design changes for critical features.\n- [ ] Re-verify tolerances and interfaces after changes.\n\n## Assumptions\n\n- Inputs and part summary reflect current design intent.\n- Manufacturing process and material choices are as specified.\n\n## Usage (tokens & cost)\n\n_Usage not available._\n\n\n## LLM usage by node\n\n_Not available._\n\n\n## Agent confidence & limitations\n\n_Not available._\n", "trace": "Run started\nInputs validated\nProcess selection node entered\nprocess_selection: eligible_processes=['AM', 'CASTING', 'CNC', 'CNC_TURNING', 'EXTRUSION', 'FORGING', 'MIM', 'SHEET_METAL']\nprocess_selection: gated_out=[('INJECTION_MOLDING', 'polymer process'), ('THERMOFORMING', 'polymer process'), ('COMPRESSION_MOLDING', 'polymer process')]\nPSI: user_text_len=0 preview=\"\"\nprocess_selection: cad_lite status=failed\nprocess_selection: sheet_metal_likelihood=low (source=none)\nprocess_selection: scorer_path=legacy_bins cad_status=none\nPSI: score_diff=4 (primary=CNC=5, second=CNC_TURNING=1)\nProcess selection computed: primary=CNC user_selected=CNC\nprocess_selection: cad_uploaded=y evidence_available=n\nrules: cad_uploaded=y cad_status=none evidence_keys=[]\nreport: process_recommendation present=True primary=CNC", "error": null, "case_id": "cnc4_bins_steel_small"}}
{"case_id": "turning1_bins_steel", "status": "pass", "result": {"primary": "CNC", "secondary": ["AM"], "eligible_processes": ["CNC", "CNC_TURNING", "AM", "SHEET_METAL", "CASTING", "FORGING", "EXTRUSION", "MIM"], "gated_out": ["COMPRESSION_MOLDING", "INJECTION_MOLDING", "THERMOFORMING"], "cad_lite_status": "ok", "sheet_metal_likelihood_level": "med", "sheet_metal_likelihood_source": "cad_lite", "findings": [{"rule_id": "PASS1", "severity": "LOW", "process": null, "title": "Low feature variety (favorable for cycle time and tooling)"}, {"rule_id": "PASS2", "severity": "LOW", "process": null, "title": "Low accessibility risk (good tool access)"}, {"rule_id": "CAST1", "severity": "MEDIUM", "process": "CASTING", "title": "Low volume + casting (tooling risk)"}, {"rule_id": "FORG1", "severity": "MEDIUM", "process": "FORGING", "title": "Low volume + forging (tooling risk)"}, {"rule_id": "MIM1", "severity": "HIGH", "process": "MIM", "title": "Low volume + MIM (tooling ROI risk)"}], "top_priorities": ["PASS1", "PASS2"], "duration_ms": 87.29, "report": "# CNC Design Review + DFM Report\n\n## Input summary\n\n- Manufacturing process: CNC\n\n- Material: Steel\n- Production volume: Proto\n- Load type: Static\n- Tolerance criticality: Medium\n\n- Part size: Medium\n- Min internal radius: Medium\n- Min wall thickness: Medium\n- Hole depth class: None\n- Pocket aspect class: OK\n- Feature variety: Low\n- Accessibility risk: Low\n- Has clamping faces: True\n\n\n## Process recommendation\n\n- Primary: **CNC**\n\n- Secondary: AM\n\n- Less suitable (given current inputs): CASTING, FORGING, EXTRUSION, MIM\n\n- Not applicable (hard gated): INJECTION_MOLDING (polymer process), THERMOFORMING (polymer process), COMPRESSION_MOLDING (polymer process)\n\n- Tradeoffs:\n\n  - Tooling lead time vs unit cost: IM/Sheet metal need tooling; CNC/AM suit low volume.\n\n  - Tolerance and finish: Define critical interfaces; plan post-machining or inspection where needed.\n\n  - Risk drivers: Warpage (IM/AM), supports (AM), setups (CNC/Sheet metal) affect feasibility.\n\n  - Volume sensitivity: IM and sheet metal favor production runs; CNC/AM suit proto and small batch.\n\n  - Documentation: 2D drawing and scale confirmation improve tolerance and process selection.\n\n\n\n## Manufacturing confidence inputs\n\n- CAD uploaded: yes\n\n- CAD analysis status: none\n\n- CAD evidence used in rules: no\n\n- CAD Lite analysis: ok\n\n- Sheet metal likelihood: med (source=cad_lite)\n\n_Confidence inputs not provided._\n\n\n\n## Top priorities\n\n- [LOW] Low feature variety (favorable for cycle time and tooling) (PASS1)\n\n- [LOW] Low accessibility risk (good tool access) (PASS2)\n\n\n\n## Findings (HIGH)\n\n- **Low volume + MIM (tooling ROI risk)** (MIM1) \u2014 MIM has high upfront tooling cost; unit cost only becomes favorable at production volumes.\n  - Recommendation: Consider CNC or AM for low volumes; MIM best for stable designs at production scale.\n\n## Findings (MEDIUM)\n\n- **Low volume + casting (tooling risk)** (CAST1) \u2014 Casting has significant tooling cost; economics favor production runs.\n  - Recommendation: Consider CNC or AM for low volumes; casting best at production scale.\n- **Low volume + forging (tooling risk)** (FORG1) \u2014 Forging has significant die cost; economics favor production runs.\n  - Recommendation: Consider CNC or AM for low volumes; forging best at production scale.\n\n## Findings (LOW)\n\n- **Low feature variety (favorable for cycle time and tooling)** (PASS1) \u2014 Low complexity reduces cycle time and tooling risk.\n  - Recommendation: No change needed.\n- **Low accessibility risk (good tool access)** (PASS2) \u2014 Good tool access reduces setup and machining risk.\n  - Recommendation: No change needed.\n\n## Action Checklist\n\n- [ ] Address HIGH and MEDIUM findings before release.\n- [ ] Apply recommended design changes for critical features.\n- [ ] Re-verify tolerances and interfaces after changes.\n\n## Assumptions\n\n- Inputs and part summary reflect current design intent.\n- Manufacturing process and material choices are as specified.\n\n## Usage (tokens & cost)\n\n_Usage not available._\n\n\n## LLM usage by node\n\n_Not available._\n\n\n## Agent confidence & limitations\n\n_Not available._\n", "trace": "Run started\nInputs validated\nProcess selection node entered\nprocess_selection: eligible_processes=['AM', 'CASTING', 'CNC', 'CNC_TURNING', 'EXTRUSION', 'FORGING', 'MIM', 'SHEET_METAL']\nprocess_selection: gated_out=[('INJECTION_MOLDING', 'polymer process'), ('THERMOFORMING', 'polymer process'), ('COMPRESSION_MOLDING', 'polymer process')]\nPSI: user_text_len=0 preview=\"\"\nprocess_selection: cad_lite status=ok t_est=6.9762 av_ratio=0.2867 t_over_min_dim=0.2325\nprocess_selection: sheet_metal_likelihood=med (source=cad_lite)\nprocess_selection: scorer_path=legacy_bins cad_status=none\nPSI: score_diff=2 (primary=CNC=5, second=SHEET_METAL=3)\nProcess selection computed: primary=CNC user_selected=CNC\nprocess_selection: cad_uploaded=y evidence_available=n\nrules: cad_uploaded=y cad_status=none evidence_keys=[]\nreport: process_recommendation present=True primary=CNC", "error": null, "case_id": "turning1_bins_steel"}}
{"case_id": "turning2_bins_steel", "status": "pass", "result": {"primary": "CNC", "secondary": ["AM"], "eligible_processes": ["CNC", "CNC_TURNING", "AM", "SHEET_METAL", "CASTING", "FORGING", "EXTRUSION", "MIM"], "gated_out": ["COMPRESSION_MOLDING", "INJECTION_MOLDING", "THERMOFORMING"], "cad_lite_status": "failed", "sheet_metal_likelihood_level": "low", "sheet_metal_likelihood_source": "none", "findings": [{"rule_id": "PASS1", "severity": "LOW", "process": null, "title": "Low feature variety (favorable for cycle time and tooling)"}, {"rule_id": "PASS2", "severity": "LOW", "process": null, "title": "Low accessibility risk (good tool access)"}, {"rule_id": "CAST1", "severity": "MEDIUM", "process": "CASTING", "title": "Low volume + casting (tooling risk)"}, {"rule_id": "FORG1", "severity": "MEDIUM", "process": "FORGING", "title": "Low volume + forging (tooling risk)"}, {"rule_id": "MIM1", "severity": "HIGH", "process": "MIM", "title": "Low volume + MIM (tooling ROI risk)"}], "top_priorities": ["PASS1", "PASS2"], "duration_ms": 88.38, "report": "# CNC Design Review + DFM Report\n\n## Input summary\n\n- Manufacturing process: CNC\n\n- Material: Steel\n- Production volume: Proto\n- Load type: Static\n- Tolerance criticality: Medium\n\n- Part size: Medium\n- Min internal radius: Medium\n- Min wall thickness: Medium\n- Hole depth class: None\n- Pocket aspect class: OK\n- Feature variety: Low\n- Accessibility risk: Low\n- Has clamping faces: True\n\n\n## Process recommendation\n\n- Primary: **CNC**\n\n- Secondary: AM\n\n- Less suitable (given current inputs): SHEET_METAL, CASTING, FORGING, EXTRUSION, MIM\n\n- Not applicable (hard gated): INJECTION_MOLDING (polymer process), THERMOFORMING (polymer process), COMPRESSION_MOLDING (polymer process)\n\n- Tradeoffs:\n\n  - Tooling lead time vs unit cost: IM/Sheet metal need tooling; CNC/AM suit low volume.\n\n  - Tolerance and finish: Define critical interfaces; plan post-machining or inspection where needed.\n\n  - Risk drivers: Warpage (IM/AM), supports (AM), setups (CNC/Sheet metal) affect feasibility.\n\n  - Volume sensitivity: IM and sheet metal favor production runs; CNC/AM suit proto and small batch.\n\n  - Documentation: 2D drawing and scale confirmation improve tolerance and process selection.\n\n\n\n## Manufacturing confidence inputs\n\n- CAD uploaded: yes\n\n- CAD analysis status: none\n\n- CAD evidence used in rules: no\n\n- CAD Lite analysis: failed\n\n- Sheet metal likelihood: low (source=none)\n\n_Confidence inputs not provided._\n\n\n\n## Top priorities\n\n- [LOW] Low feature variety (favorable for cycle time and tooling) (PASS1)\n\n- [LOW] Low accessibility risk (good tool access) (PASS2)\n\n\n\n## Findings (HIGH)\n\n- **Low volume + MIM (tooling ROI risk)** (MIM1) \u2014 MIM has high upfront tooling cost; unit cost only becomes favorable at production volumes.\n  - Recommendation: Consider CNC or AM for low volumes; MIM best for stable designs at production scale.\n\n## Findings (MEDIUM)\n\n- **Low volume + casting (tooling risk)** (CAST1) \u2014 Casting has significant tooling cost; economics favor production runs.\n  - Recommendation: Consider CNC or AM for low volumes; casting best at production scale.\n- **Low volume + forging (tooling risk)** (FORG1) \u2014 Forging has significant die cost; economics favor production runs.\n  - Recommendation: Consider CNC or AM for low volumes; forging best at production scale.\n\n## Findings (LOW)\n\n- **Low feature variety (favorable for cycle time and tooling)** (PASS1) \u2014 Low complexity reduces cycle time and tooling risk.\n  - Recommendation: No change needed.\n- **Low accessibility risk (good tool access)** (PASS2) \u2014 Good tool access reduces setup and machining risk.\n  - Recommendation: No change needed.\n\n## Action Checklist\n\n- [ ] Address HIGH and MEDIUM findings before release.\n- [ ] Apply recommended design changes for critical features.\n- [ ] Re-verify tolerances and interfaces after changes.\n\n## Assumptions\n\n- Inputs and part summary reflect current design intent.\n- Manufacturing process and material choices are as specified.\n\n## Usage (tokens & cost)\n\n_Usage not available._\n\n\n## LLM usage by node\n\n_Not available._\n\n\n## Agent confidence & limitations\n\n_Not available._\n", "trace": "Run started\nInputs validated\nProcess selection node entered\nprocess_selection: eligible_processes=['AM', 'CASTING', 'CNC', 'CNC_TURNING', 'EXTRUSION', 'FORGING', 'MIM', 'SHEET_METAL']\nprocess_selection: gated_out=[('INJECTION_MOLDING', 'polymer process'), ('THERMOFORMING', 'polymer process'), ('COMPRESSION_MOLDING', 'polymer process')]\nPSI: user_text_len=0 preview=\"\"\nprocess_selection: cad_lite status=failed\nprocess_selection: sheet_metal_likelihood=low (source=none)\nprocess_selection: scorer_path=legacy_bins cad_status=none\nPSI: score_diff=3 (primary=CNC=5, second=AM=2)\nProcess selection computed: primary=CNC user_selected=CNC\nprocess_selection: cad_uploaded=y evidence_available=n\nrules: cad_uploaded=y cad_status=none evidence_keys=[]\nreport: process_recommendation present=True primary=CNC", "error": null, "case_id": "turning2_bins_steel"}}
{"case_id": "turning3_bins_steel", "status": "pass", "result": {"primary": "CNC", "secondary": ["AM"], "eligible_processes": ["CNC", "CNC_TURNING", "AM", "SHEET_METAL", "CASTING", "FORGING", "EXTRUSION", "MIM"], "gated_out": ["COMPRESSION_MOLDING", "INJECTION_MOLDING", "THERMOFORMING"], "cad_lite_status": "failed", "sheet_metal_likelihood_level": "low", "sheet_metal_likelihood_source": "none", "findings": [{"rule_id": "PASS1", "severity": "LOW", "process": null, "title": "Low feature variety (favorable for cycle time and tooling)"}, {"rule_id": "PASS2", "severity": "LOW", "process": null, "title": "Low accessibility risk (good tool access)"}, {"rule_id": "CAST1", "severity": "MEDIUM", "process": "CASTING", "title": "Low volume + casting (tooling risk)"}, {"rule_id": "FORG1", "severity": "MEDIUM", "process": "FORGING", "title": "Low volume + forging (tooling risk)"}, {"rule_id": "MIM1", "severity": "HIGH", "process": "MIM", "title": "Low volume + MIM (tooling ROI risk)"}], "top_priorities": ["PASS1", "PASS2"], "duration_ms": 95.24, "report": "# CNC Design Review + DFM Report\n\n## Input summary\n\n- Manufacturing process: CNC\n\n- Material: Steel\n- Production volume: Proto\n- Load type: Static\n- Tolerance criticality: Medium\n\n- Part size: Medium\n- Min internal radius: Medium\n- Min wall thickness: Medium\n- Hole depth class: None\n- Pocket aspect class: OK\n- Feature variety: Low\n- Accessibility risk: Low\n- Has clamping faces: True\n\n\n## Process recommendation\n\n- Primary: **CNC**\n\n- Secondary: AM\n\n- Less suitable (given current inputs): SHEET_METAL, CASTING, FORGING, EXTRUSION, MIM\n\n- Not applicable (hard gated): INJECTION_MOLDING (polymer process), THERMOFORMING (polymer process), COMPRESSION_MOLDING (polymer process)\n\n- Tradeoffs:\n\n  - Tooling lead time vs unit cost: IM/Sheet metal need tooling; CNC/AM suit low volume.\n\n  - Tolerance and finish: Define critical interfaces; plan post-machining or inspection where needed.\n\n  - Risk drivers: Warpage (IM/AM), supports (AM), setups (CNC/Sheet metal) affect feasibility.\n\n  - Volume sensitivity: IM and sheet metal favor production runs; CNC/AM suit proto and small batch.\n\n  - Documentation: 2D drawing and scale confirmation improve tolerance and process selection.\n\n\n\n## Manufacturing confidence inputs\n\n- CAD uploaded: yes\n\n- CAD analysis status: none\n\n- CAD evidence used in rules: no\n\n- CAD Lite analysis: failed\n\n- Sheet metal likelihood: low (source=none)\n\n_Confidence inputs not provided._\n\n\n\n## Top priorities\n\n- [LOW] Low feature variety (favorable for cycle time and tooling) (PASS1)\n\n- [LOW] Low accessibility risk (good tool access) (PASS2)\n\n\n\n## Findings (HIGH)\n\n- **Low volume + MIM (tooling ROI risk)** (MIM1) \u2014 MIM has high upfront tooling cost; unit cost only becomes favorable at production volumes.\n  - Recommendation: Consider CNC or AM for low volumes; MIM best for stable designs at production scale.\n\n## Findings (MEDIUM)\n\n- **Low volume + casting (tooling risk)** (CAST1) \u2014 Casting has significant tooling cost; economics favor production runs.\n  - Recommendation: Consider CNC or AM for low volumes; casting best at production scale.\n- **Low volume + forging (tooling risk)** (FORG1) \u2014 Forging has significant die cost; economics favor production runs.\n  - Recommendation: Consider CNC or AM for low volumes; forging best at production scale.\n\n## Findings (LOW)\n\n- **Low feature variety (favorable for cycle time and tooling)** (PASS1) \u2014 Low complexity reduces cycle time and tooling risk.\n  - Recommendation: No change needed.\n- **Low accessibility risk (good tool access)** (PASS2) \u2014 Good tool access reduces setup and machining risk.\n  - Recommendation: No change needed.\n\n## Action Checklist\n\n- [ ] Address HIGH and MEDIUM findings before release.\n- [ ] Apply recommended design changes for critical features.\n- [ ] Re-verify tolerances and interfaces after changes.\n\n## Assumptions\n\n- Inputs and part summary reflect current design intent.\n- Manufacturing process and material choices are as specified.\n\n## Usage (tokens & cost)\n\n_Usage not available._\n\n\n## LLM usage by node\n\n_Not available._\n\n\n## Agent confidence & limitations\n\n_Not available._\n", "trace": "Run started\nInputs validated\nProcess selection node entered\nprocess_selection: eligible_processes=['AM', 'CASTING', 'CNC', 'CNC_TURNING', 'EXTRUSION', 'FORGING', 'MIM', 'SHEET_METAL']\nprocess_selection: gated_out=[('INJECTION_MOLDING', 'polymer process'), ('THERMOFORMING', 'polymer process'), ('COMPRESSION_MOLDING', 'polymer process')]\nPSI: user_text_len=0 preview=\"\"\nprocess_selection: cad_lite status=failed\nprocess_selection: sheet_metal_likelihood=low (source=none)\nprocess_selection: scorer_path=legacy_bins cad_status=none\nPSI: score_diff=3 (primary=CNC=5, second=AM=2)\nProcess selection computed: primary=CNC user_selected=CNC\nprocess_selection: cad_uploaded=y evidence_available=n\nrules: cad_uploaded=y cad_status=none evidence_keys=[]\nreport: process_recommendation present=True primary=CNC", "error": null, "case_id": "turning3_bins_steel"}}
{"case_id": "extrusion1_bins_aluminum", "status": "error", "result": {"primary": null, "secondary": [], "eligible_processes": [], "gated_out": [], "cad_lite_status": "none", "sheet_metal_likelihood_level": null, "sheet_metal_likelihood_source": null, "findings": [], "top_priorities": [], "duration_ms": 93.45, "report": "", "trace": "Run started", "error": "node='run' type='ValidationError' message='inputs.production_volume invalid' retry_exhausted=False", "debug_state_keys": ["inputs", "part_summary", "rag_enabled", "confidence_inputs", "cad_metrics", "user_text", "description", "trace", "_summary_source", "part_summary_mode", "step_path", "part_metrics_provider", "error"], "debug_candidates": {"process_recommendation": null, "process_selection": null, "psi": null, "recommendation": null}, "case_id": "extrusion1_bins_aluminum"}}
{"case_id": "extrusion2_bins_aluminum", "status": "error", "result": {"primary": null, "secondary": [], "eligible_processes": [], "gated_out": [], "cad_lite_status": "none", "sheet_metal_likelihood_level": null, "sheet_metal_likelihood_source": null, "findings": [], "top_priorities": [], "duration_ms": 92.71, "report": "", "trace": "Run started", "error": "node='run' type='ValidationError' message='inputs.production_volume invalid' retry_exhausted=False", "debug_state_keys": ["inputs", "part_summary", "rag_enabled", "confidence_inputs", "cad_metrics", "user_text", "description", "trace", "_summary_source", "part_summary_mode", "step_path", "part_metrics_provider", "error"], "debug_candidates": {"process_recommendation": null, "process_selection": null, "psi": null, "recommendation": null}, "case_id": "extrusion2_bins_aluminum"}}
{"case_id": "extrusion3_bins_aluminum", "status": "error", "result": {"primary": null, "secondary": [], "eligible_processes": [], "gated_out": [], "cad_lite_status": "none", "sheet_metal_likelihood_level": null, "sheet_metal_likelihood_source": null, "findings": [], "top_priorities": [], "duration_ms": 82.52, "report": "", "trace": "Run started", "error": "node='run' type='ValidationError' message='inputs.production_volume invalid' retry_exhausted=False", "debug_state_keys": ["inputs", "part_summary", "rag_enabled", "confidence_inputs", "cad_metrics", "user_text", "description", "trace", "_summary_source", "part_summary_mode", "step_path", "part_metrics_provider", "error"], "debug_candidates": {"process_recommendation": null, "process_selection": null, "psi": null, "recommendation": null}, "case_id": "extrusion3_bins_aluminum"}}
{"case_id": "im1_bins_plastic_high", "status": "error", "result": {"primary": null, "secondary": [], "eligible_processes": [], "gated_out": [], "cad_lite_status": "none", "sheet_metal_likelihood_level": null, "sheet_metal_likelihood_source": null, "findings": [], "top_priorities": [], "duration_ms": 84.46, "report": "", "trace": "Run started", "error": "node='run' type='ValidationError' message='inputs.production_volume invalid' retry_exhausted=False", "debug_state_keys": ["inputs", "part_summary", "rag_enabled", "confidence_inputs", "cad_metrics", "user_text", "description", "trace", "_summary_source", "part_summary_mode", "step_path", "part_metrics_provider", "error"], "debug_candidates": {"process_recommendation": null, "process_selection": null, "psi": null, "recommendation": null}, "case_id": "im1_bins_plastic_high"}}
{"case_id": "im1_bins_plastic_small", "status": "pass", "result": {"primary": "CNC", "secondary": ["THERMOFORMING", "CNC_TURNING"], "eligible_processes": ["CNC", "CNC_TURNING", "AM", "SHEET_METAL", "INJECTION_MOLDING", "EXTRUSION", "THERMOFORMING", "COMPRESSION_MOLDING"], "gated_out": ["CASTING", "FORGING", "MIM"], "cad_lite_status": "failed", "sheet_metal_likelihood_level": "low", "sheet_metal_likelihood_source": "none", "findings": [{"rule_id": "PASS1", "severity": "LOW", "process": null, "title": "Low feature variety (favorable for cycle time and tooling)"}, {"rule_id": "PASS2", "severity": "LOW", "process": null, "title": "Low accessibility risk (good tool access)"}, {"rule_id": "IM1", "severity": "HIGH", "process": "INJECTION_MOLDING", "title": "Low volume + injection molding (tooling ROI risk)"}], "top_priorities": ["PASS1", "PASS2"], "duration_ms": 83.48, "report": "# CNC Design Review + DFM Report\n\n## Input summary\n\n- Manufacturing process: CNC\n\n- Material: Plastic\n- Production volume: Small batch\n- Load type: Static\n- Tolerance criticality: Medium\n\n- Part size: Medium\n- Min internal radius: Medium\n- Min wall thickness: Medium\n- Hole depth class: None\n- Pocket aspect class: OK\n- Feature variety: Low\n- Accessibility risk: Low\n- Has clamping faces: True\n\n\n## Process recommendation\n\n- Primary: **CNC**\n\n- Secondary: THERMOFORMING, CNC_TURNING\n\n- Less suitable (given current inputs): None\n\n- Not applicable (hard gated): CASTING (metal process), FORGING (metal process), MIM (metal process)\n\n- Tradeoffs:\n\n  - Tooling lead time vs unit cost: IM/Sheet metal need tooling; CNC/AM suit low volume.\n\n  - Tolerance and finish: Define critical interfaces; plan post-machining or inspection where needed.\n\n  - Risk drivers: Warpage (IM/AM), supports (AM), setups (CNC/Sheet metal) affect feasibility.\n\n  - Volume sensitivity: IM and sheet metal favor production runs; CNC/AM suit proto and small batch.\n\n  - Documentation: 2D drawing and scale confirmation improve tolerance and process selection.\n\n\n\n## Manufacturing confidence inputs\n\n- CAD uploaded: yes\n\n- CAD analysis status: none\n\n- CAD evidence used in rules: no\n\n- CAD Lite analysis: failed\n\n- Sheet metal likelihood: low (source=none)\n\n_Confidence inputs not provided._\n\n\n\n## Top priorities\n\n- [LOW] Low feature variety (favorable for cycle time and tooling) (PASS1)\n\n- [LOW] Low accessibility risk (good tool access) (PASS2)\n\n\n\n## Findings (HIGH)\n\n- **Low volume + injection molding (tooling ROI risk)** (IM1) \u2014 Injection molding has high upfront tooling cost; unit cost only becomes favorable at high volumes.\n  - Recommendation: Consider alternative processes (CNC, AM) for low volumes; injection molding best for stable designs at production scale.\n\n## Findings (MEDIUM)\n\n_None_\n\n## Findings (LOW)\n\n- **Low feature variety (favorable for cycle time and tooling)** (PASS1) \u2014 Low complexity reduces cycle time and tooling risk.\n  - Recommendation: No change needed.\n- **Low accessibility risk (good tool access)** (PASS2) \u2014 Good tool access reduces setup and machining risk.\n  - Recommendation: No change needed.\n\n## Action Checklist\n\n- [ ] Address HIGH and MEDIUM findings before release.\n- [ ] Apply recommended design changes for critical features.\n- [ ] Re-verify tolerances and interfaces after changes.\n\n## Assumptions\n\n- Inputs and part summary reflect current design intent.\n- Manufacturing process and material choices are as specified.\n\n## Usage (tokens & cost)\n\n_Usage not available._\n\n\n## LLM usage by node\n\n_Not available._\n\n\n## Agent confidence & limitations\n\n_Not available._\n", "trace": "Run started\nInputs validated\nProcess selection node entered\nprocess_selection: eligible_processes=['AM', 'CNC', 'CNC_TURNING', 'COMPRESSION_MOLDING', 'EXTRUSION', 'INJECTION_MOLDING', 'SHEET_METAL', 'THERMOFORMING']\nprocess_selection: gated_out=[('CASTING', 'metal process'), ('FORGING', 'metal process'), ('MIM', 'metal process')]\nPSI: user_text_len=0 preview=\"\"\nprocess_selection: cad_lite status=failed\nprocess_selection: sheet_metal_likelihood=low (source=none)\nprocess_selection: scorer_path=legacy_bins cad_status=none\nprocess_selection: bins_anchor applied selected=CNC margin=2 top_was=THERMOFORMING\nPSI: score_diff=0 (primary=CNC=2, second=CNC=2)\nPSI tie-break: prefer user-selected flexible process (CNC) when score_diff <= 1 (compatible, no strong mismatch)\nPSI: final score_diff=0 (after tie-break, primary changed from THERMOFORMING to CNC)\nProcess selection computed: primary=CNC user_selected=CNC\nprocess_selection: cad_uploaded=y evidence_available=n\nrules: cad_uploaded=y cad_status=none evidence_keys=[]\nreport: process_recommendation present=True primary=CNC", "error": null, "case_id": "im1_bins_plastic_small"}}
