{"case_id": "extrusion1_bins_aluminum", "status": "fail", "result": {"primary": "EXTRUSION", "secondary": ["MIM"], "eligible_processes": ["CNC", "CNC_TURNING", "AM", "SHEET_METAL", "CASTING", "FORGING", "EXTRUSION", "MIM"], "gated_out": ["COMPRESSION_MOLDING", "INJECTION_MOLDING", "THERMOFORMING"], "cad_lite_status": "ok", "sheet_metal_likelihood_level": "med", "sheet_metal_likelihood_source": "cad_lite", "findings": [{"rule_id": "PASS1", "severity": "LOW", "process": null, "title": "Low feature variety (favorable for cycle time and tooling)"}, {"rule_id": "PASS2", "severity": "LOW", "process": null, "title": "Low accessibility risk (good tool access)"}, {"rule_id": "HYBRID1", "severity": "MEDIUM", "process": null, "title": "Consider EXTRUSION + CNC finishing"}], "top_priorities": ["HYBRID1", "PASS1", "PASS2"], "duration_ms": 270.08, "report": "# CNC Design Review + DFM Report\n\n## Input summary\n\n- Manufacturing process: CNC\n\n- Material: Aluminum\n- Production volume: Production\n- Load type: Static\n- Tolerance criticality: Medium\n\n- Part size: Medium\n- Min internal radius: Medium\n- Min wall thickness: Medium\n- Hole depth class: None\n- Pocket aspect class: OK\n- Feature variety: Low\n- Accessibility risk: Low\n- Has clamping faces: True\n\n\n## Process recommendation\n\n- Primary: **EXTRUSION**\n\n- Secondary: MIM, CNC\n\n- Less suitable (given current inputs): AM, CASTING, FORGING\n\n- Not applicable (hard gated): INJECTION_MOLDING (polymer process), THERMOFORMING (polymer process), COMPRESSION_MOLDING (polymer process)\n\n- Secondary rationale:\n\n  - Production volume favors MIM economics\n\n- Tradeoffs:\n\n  - Tooling lead time vs unit cost: IM/Sheet metal need tooling; CNC/AM suit low volume.\n\n  - Tolerance and finish: Define critical interfaces; plan post-machining or inspection where needed.\n\n  - Risk drivers: Warpage (IM/AM), supports (AM), setups (CNC/Sheet metal) affect feasibility.\n\n  - Volume sensitivity: IM and sheet metal favor production runs; CNC/AM suit proto and small batch.\n\n  - Documentation: 2D drawing and scale confirmation improve tolerance and process selection.\n\n\n\n## Manufacturing confidence inputs\n\n- CAD uploaded: yes\n\n- CAD analysis status: none\n\n- CAD evidence used in rules: no\n\n- CAD Lite analysis: ok\n\n- Extrusion Lite analysis: ok\n\n- Extrusion likelihood: high (source=extrusion_lite)\n\n- Sheet metal likelihood: med (source=cad_lite)\n\n_Confidence inputs not provided._\n\n\n\n## Top priorities\n\n- [MEDIUM] Consider EXTRUSION + CNC finishing (HYBRID1)\n\n- [LOW] Low feature variety (favorable for cycle time and tooling) (PASS1)\n\n- [LOW] Low accessibility risk (good tool access) (PASS2)\n\n\n\n## Findings (HIGH)\n\n_None_\n\n## Findings (MEDIUM)\n\n- **Consider EXTRUSION + CNC finishing** (HYBRID1) \u2014 Process selection intelligence recommends EXTRUSION (score advantage: 4 points) for near-net shape and economics. User requirements indicate need for secondary finishing operations.\n  - Recommendation: Primary: EXTRUSION for near-net shape and economics at volume. Secondary: CNC for cut-to-length, drilling, tapping, and milling. Design for finishing: define machining datums and leave stock only where needed.\n\n## Findings (LOW)\n\n- **Low feature variety (favorable for cycle time and tooling)** (PASS1) \u2014 Low complexity reduces cycle time and tooling risk.\n  - Recommendation: No change needed.\n- **Low accessibility risk (good tool access)** (PASS2) \u2014 Good tool access reduces setup and machining risk.\n  - Recommendation: No change needed.\n\n## Action Checklist\n\n- [ ] Address HIGH and MEDIUM findings before release.\n- [ ] Apply recommended design changes for critical features.\n- [ ] Re-verify tolerances and interfaces after changes.\n\n## Assumptions\n\n- Inputs and part summary reflect current design intent.\n- Manufacturing process and material choices are as specified.\n\n## Usage (tokens & cost)\n\n_Usage not available._\n\n\n## LLM usage by node\n\n_Not available._\n\n\n## Agent confidence & limitations\n\n_Not available._\n", "trace": "Run started\nInputs validated\nProcess selection node entered\nprocess_selection: eligible_processes=['AM', 'CASTING', 'CNC', 'CNC_TURNING', 'EXTRUSION', 'FORGING', 'MIM', 'SHEET_METAL']\nprocess_selection: gated_out=[('INJECTION_MOLDING', 'polymer process'), ('THERMOFORMING', 'polymer process'), ('COMPRESSION_MOLDING', 'polymer process')]\nPSI: user_text_len=0 preview=\"\"\nprocess_selection: cad_lite status=ok t_est=2.8352 av_ratio=0.7054 t_over_min_dim=0.189\nprocess_selection: sheet_metal_likelihood=med (source=cad_lite)\nprocess_selection: extrusion_likelihood=high (coeff_var=0.0 axis=Y)\nprocess_selection: scorer_path=legacy_bins cad_status=none\nPSI: score_diff=2 (primary=EXTRUSION=6, second=MIM=4)\nProcess selection computed: primary=EXTRUSION user_selected=CNC\nprocess_selection: cad_uploaded=y evidence_available=n\nProcess selection mismatch: user_selected=CNC but primary=EXTRUSION\nHybrid offer added: EXTRUSION + CNC finishing\nrules: cad_uploaded=y cad_status=none evidence_keys=[]\nreport: process_recommendation present=True primary=EXTRUSION", "error": null, "error_type": null, "state_has_error": false, "case_id": "extrusion1_bins_aluminum"}}
