{"case_id": "al_01_aluminum_proto_cnc", "status": "updated", "result": {"primary": "CNC", "secondary": [], "eligible_processes": ["CNC", "CNC_TURNING", "AM", "SHEET_METAL", "CASTING", "FORGING", "EXTRUSION", "MIM"], "gated_out": ["COMPRESSION_MOLDING", "INJECTION_MOLDING", "THERMOFORMING"], "cad_lite_status": "none", "sheet_metal_likelihood_level": null, "sheet_metal_likelihood_source": null, "findings": [{"rule_id": "DR4", "severity": "MEDIUM", "process": null, "title": "Potential over-tolerancing for low volume"}, {"rule_id": "DFM8", "severity": "HIGH", "process": null, "title": "Tight tolerances for low volume (cost/lead-time risk)"}, {"rule_id": "CAST1", "severity": "MEDIUM", "process": "CASTING", "title": "Low volume + casting (tooling risk)"}, {"rule_id": "FORG1", "severity": "MEDIUM", "process": "FORGING", "title": "Low volume + forging (tooling risk)"}, {"rule_id": "MIM1", "severity": "HIGH", "process": "MIM", "title": "Low volume + MIM (tooling ROI risk)"}], "top_priorities": ["DFM8", "DR4"], "duration_ms": 56802.44, "report": "# CNC Design Review + DFM Report\n\n## Input summary\n\n- Manufacturing process: CNC\n\n- Material: Aluminum\n- Production volume: Proto\n- Load type: Static\n- Tolerance criticality: High\n\n- Part size: Small\n- Min internal radius: Medium\n- Min wall thickness: Medium\n- Hole depth class: None\n- Pocket aspect class: OK\n- Feature variety: Low\n- Accessibility risk: Low\n- Has clamping faces: True\n\n\n## Process recommendation\n\n- Primary: **CNC**\n\n- Secondary: None\n\n- Less suitable (given current inputs): AM, SHEET_METAL, CASTING, FORGING, EXTRUSION, MIM\n\n- Not applicable (hard gated): INJECTION_MOLDING (polymer process), THERMOFORMING (polymer process), COMPRESSION_MOLDING (polymer process)\n\n- Tradeoffs:\n\n  - Tooling lead time vs unit cost: IM/Sheet metal need tooling; CNC/AM suit low volume.\n\n  - Tolerance and finish: Define critical interfaces; plan post-machining or inspection where needed.\n\n  - Risk drivers: Warpage (IM/AM), supports (AM), setups (CNC/Sheet metal) affect feasibility.\n\n  - Volume sensitivity: IM and sheet metal favor production runs; CNC/AM suit proto and small batch.\n\n  - Documentation: 2D drawing and scale confirmation improve tolerance and process selection.\n\n\n\n## Manufacturing confidence inputs\n\n- CAD uploaded: no\n\n- CAD analysis status: none\n\n- CAD evidence used in rules: no\n\n- CAD Lite analysis: none\n\n_Confidence inputs not provided._\n\n\n\n## Top priorities\n\n- [HIGH] Tight tolerances for low volume (cost/lead-time risk) (DFM8)\n\n- [MEDIUM] Potential over-tolerancing for low volume (DR4)\n\n\n\n## Findings (HIGH)\n\n- **Tight tolerances for low volume (cost/lead-time risk)** (DFM8) \u2014 Tight tolerances increase cycle time, inspection burden, and scrap risk; for low volumes this is often unnecessary.\n  - Recommendation: Identify truly critical interfaces; relax non-critical dimensions; specify tighter tolerances only where function requires.\n- **Low volume + MIM (tooling ROI risk)** (MIM1) \u2014 MIM has high upfront tooling cost; unit cost only becomes favorable at production volumes.\n  - Recommendation: Consider CNC or AM for low volumes; MIM best for stable designs at production scale.\n\n## Findings (MEDIUM)\n\n- **Potential over-tolerancing for low volume** (DR4) \u2014 Tight tolerances increase cycle time, inspection effort, and scrap risk\u2014often unnecessary outside interfaces.\n  - Recommendation: Apply tight tolerances only to functional interfaces; relax non-critical features.\n- **Low volume + casting (tooling risk)** (CAST1) \u2014 Casting has significant tooling cost; economics favor production runs.\n  - Recommendation: Consider CNC or AM for low volumes; casting best at production scale.\n- **Low volume + forging (tooling risk)** (FORG1) \u2014 Forging has significant die cost; economics favor production runs.\n  - Recommendation: Consider CNC or AM for low volumes; forging best at production scale.\n\n## Findings (LOW)\n\n_None_\n\n## Action Checklist\n\n- [ ] Identify and mark functional interfaces and truly critical dimensions (fit, alignment, sealing, bearing surfaces) on the drawing; limit high tolerances to these features only.\n- [ ] Confirm Relax tolerances on non-functional features and replace with standard machining tolerance callouts or general notes to reduce cost and lead time.\n- [ ] Address For prototype production, prioritize CNC machining or additive manufacturing (AM) over casting, forging, or MIM; obtain comparative quotes for CNC vs AM for Aluminum material.\n- [ ] Confirm For every retained tight tolerance, add a one-line functional justification on the drawing; remove any tight tolerance lacking justification.\n- [ ] Confirm Engage potential vendors early to confirm achievable tolerances, lead times, and inspection methods for Aluminum prototypes; capture vendor feedback in a decision log.\n- [ ] Confirm Plan a DFM review for future volume scaling to reassess process choice and tooling ROI before committing to casting, forging, or MIM.\n\n## Assumptions\n\n- Full CAD models and a fully dimensioned drawing were not provided; critical interfaces have not been explicitly identified.\n- Current design contains multiple tight tolerances across features (potential over-tolerancing) as indicated in findings.\n- Prototype volume (\"Proto\") is too low to justify tooling investments for casting, forging, or MIM without a confirmed production forecast.\n- Inspection requirements, acceptance criteria, and vendor process capability data are not yet defined.\n\n## Usage (tokens & cost)\n\n- prompt_tokens: 646\n\n- completion_tokens: 921\n\n- total_tokens: 1567\n\n- total_cost_usd: 0.0020035\n\n\n_Note: Cost is reported by the callback and depends on model pricing; verify for production._\n\n\n## LLM usage by node\n\n- explain: attempts=1, cache_hit=False, prompt_tokens=646, completion_tokens=921, total_tokens=1567, total_cost_usd=0.0020035\n\n- rag: cache_hit=False, retrieved_k=5, sources_count=5\n\n- self_review: attempts=1, cache_hit=False\n\n\n## Sources used\n\n1. **cnc/cnc_tolerances_and_gdt.md**\n\n   # CNC: Tolerances and GD&T Cost Reality\n\nTolerance choices strongly affect cost, scrap rate, and inspection effort.\n\n## Typical Tolerance Baselines\n\n- General CNC tolerances: \u00b10.005\"\n- Tight tolerance...\n\n\n2. **cnc/cnc_lead_time_and_cost_scaling.md**\n\n   # CNC: Lead Time and Cost Scaling\n\nDesign choices directly influence manufacturing speed and cost.\n\n## Lead Time Drivers\n\n- Setup count\n- Tool changes\n- Programming complexity\n- Inspection requirement...\n\n\n3. **cnc/cnc_pockets_and_cavities.md**\n\n   # CNC: Pockets and Cavities (Tool Deflection & Access)\n\nDeep pockets increase tool deflection, chip evacuation issues, and breakage risk.\n\n## Depth vs Width\n\n- Excessively deep cavities are high risk\n...\n\n\n4. **cnc/cnc_material_behavior_and_machinability.md**\n\n   # CNC: Material Behavior and Machinability Differences\n\nMaterial properties strongly affect machining strategy and risk.\n\n## Hard vs Soft Materials\n\n- Hard materials increase tool wear and cycle time\n...\n\n\n5. **cnc/cnc_wall_thickness.md**\n\n   # CNC: Wall Thickness and Chatter Risk\n\nThin walls reduce rigidity and can cause vibration (chatter), loss of accuracy, and breakthrough.\n\n## Minimum Wall Thickness (Vendor Guidance)\n\n- Metals: \u2265 0.03...\n\n\n\n## Agent confidence & limitations\n\n- **Score:** 0.52\n\n- **High confidence:** RAG-supported cost/lead-time impact of unnecessarily tight tolerances; Prototype-volume recommendation to favor CNC or AM over casting/forging/MIM\n\n- **Medium confidence:** Need to identify and mark functional interfaces before relaxing non-critical tolerances; Action list (vendor engagement, justification notes) is appropriate for reducing tooling risk\n\n- **Low confidence:** Specific tolerance relaxation targets and manufacturability numbers without CAD or drawing data\n\n- **Limitations:** absence of CAD model; no fully dimensioned 2D drawing; no numeric tolerance dataset; no vendor capability or inspection criteria\n\n- **To improve:** Upload full CAD models (native or STEP) for geometry verification and numeric analysis.; Provide a fully dimensioned 2D drawing that identifies functional interfaces and current tolerances.; Annotate every retained tight tolerance with a one-line functional justification on the drawing.\n", "trace": "Run started\nInputs validated\nProcess selection node entered\nprocess_selection: gated_out process=INJECTION_MOLDING reason=polymer process\nprocess_selection: gated_out process=THERMOFORMING reason=polymer process\nprocess_selection: gated_out process=COMPRESSION_MOLDING reason=polymer process\nprocess_selection: eligible_processes=['AM', 'CASTING', 'CNC', 'CNC_TURNING', 'EXTRUSION', 'FORGING', 'MIM', 'SHEET_METAL']\nPSI: user_text_len=33 preview=\"tight tolerance critical features\"\nprocess_selection: scorer_path=legacy_bins cad_status=none\nPSI: score_diff=6 (primary=CNC=7, second=CNC_TURNING=1)\nProcess selection computed: primary=CNC user_selected=CNC\nprocess_selection: cad_uploaded=n evidence_available=n\nProcess selection: user_text keywords influenced scoring (CNC)\nRule triggered: Tight tolerances for low volume (cost/lead-time risk) \u2192 HIGH severity\nrules: cad_uploaded=n cad_status=none evidence_keys=[]\nGenerated explanation via openai\nexplain: cache_hit=False key=d0d1dec8 mode=bins provider=none\nexplain: polished checklist grammar and formatting\nAgent decision: enrich via RAG\nRAG triggered: HIGH severity findings\nEntered rag_node (process=CNC, top_k=5)\nRAG: rag_user_text_normalized=\nPSI debug: primary=CNC, user_selected=CNC, extrusion_offer=no, mim_offer=no, thermo_offer=no, comp_offer=no, am_offer=no, hybrid_offer=no, main_index_used=cnc, offer_index_used=none, hybrid_primary_index_used=none, hybrid_secondary_index_used=none\nRAG: main_retrieve_index=cnc, offer_retrieve_index=none\nRAG: main_index_used=cnc\nRAG: retrieving from local cnc index\nRAG: sources_breakdown main=5 offer=0 hybrid_primary=0 hybrid_secondary=0\nRAG completed: retrieved 5 snippets (main_index_used=cnc)\nExplanation regenerated after RAG (via openai)\nexplain: cache_hit=False key=98179aa4 mode=bins provider=none\nexplain: polished checklist grammar and formatting\nAgent decision: accept (RAG already used; proceeding)\nself_review: confidence_base=0.71 source=deterministic\nself_review: cad_uploaded=n cad_status=none\nPerformed self-critique and confidence scoring\nself_review: flag_adjustments=missing_cad-0.05, no_2d_drawing-0.04, no_numeric_tolerances-0.03, geometry_uncertain-0.02, unknown_shop_constraints-0.02\nself_review: adjusted_base=0.55 llm_delta=-0.03 final=0.52\nreport: process_recommendation present=True primary=CNC", "error": null, "case_id": "al_01_aluminum_proto_cnc"}}
{"case_id": "pl_01_plastic_production_im", "status": "updated", "result": {"primary": "INJECTION_MOLDING", "secondary": [], "eligible_processes": ["CNC", "CNC_TURNING", "AM", "SHEET_METAL", "INJECTION_MOLDING", "EXTRUSION", "THERMOFORMING", "COMPRESSION_MOLDING"], "gated_out": ["CASTING", "FORGING", "MIM"], "cad_lite_status": "none", "sheet_metal_likelihood_level": null, "sheet_metal_likelihood_source": null, "findings": [], "top_priorities": [], "duration_ms": 10884.25, "report": "# CNC Design Review + DFM Report\n\n## Input summary\n\n- Manufacturing process: INJECTION_MOLDING\n\n- Material: Plastic\n- Production volume: Production\n- Load type: Static\n- Tolerance criticality: Medium\n\n- Part size: Medium\n- Min internal radius: Medium\n- Min wall thickness: Medium\n- Hole depth class: None\n- Pocket aspect class: OK\n- Feature variety: Low\n- Accessibility risk: Low\n- Has clamping faces: True\n\n\n## Process recommendation\n\n- Primary: **INJECTION_MOLDING**\n\n- Secondary: None\n\n- Less suitable (given current inputs): CNC, AM, SHEET_METAL, EXTRUSION\n\n- Not applicable (hard gated): CASTING (metal process), FORGING (metal process), MIM (metal process)\n\n- Primary rationale:\n\n  - Production volume favors IM economics\n\n- Tradeoffs:\n\n  - Tooling lead time vs unit cost: IM/Sheet metal need tooling; CNC/AM suit low volume.\n\n  - Tolerance and finish: Define critical interfaces; plan post-machining or inspection where needed.\n\n  - Risk drivers: Warpage (IM/AM), supports (AM), setups (CNC/Sheet metal) affect feasibility.\n\n  - Volume sensitivity: IM and sheet metal favor production runs; CNC/AM suit proto and small batch.\n\n  - Documentation: 2D drawing and scale confirmation improve tolerance and process selection.\n\n\n\n## Manufacturing confidence inputs\n\n- CAD uploaded: no\n\n- CAD analysis status: none\n\n- CAD evidence used in rules: no\n\n- CAD Lite analysis: none\n\n_Confidence inputs not provided._\n\n\n\n## Top priorities\n\n_None_\n\n\n\n\n## Findings (HIGH)\n\n_None_\n\n## Findings (MEDIUM)\n\n_None_\n\n## Findings (LOW)\n\n_None_\n\n## Action Checklist\n\n- [ ] No major issues detected based on provided summary.\n\n## Assumptions\n\n- Injection molding process intent is confirmed.\n- Tooling exists or will be quoted based on design.\n- Resin grade selection is TBD or as specified.\n- Draft angles and wall thickness uniformity not validated without CAD review.\n\n## Usage (tokens & cost)\n\n_Usage not available._\n\n\n## LLM usage by node\n\n- self_review: attempts=1, cache_hit=False\n\n\n## Agent confidence & limitations\n\n- **Score:** 0.61\n\n- **High confidence:** Clamping=True and access=Low are explicitly provided; Material=Plastic is explicitly stated\n\n- **Medium confidence:** No major issues detected in the summary is plausible but requires verification\n\n- **Low confidence:** Absence of CAD increases geometric uncertainty; Hole_depth unspecified reduces manufacturability certainty\n\n- **Limitations:** No CAD model; No numeric tolerances; Hole depth unspecified; Shop constraints unknown\n\n- **To improve:** Upload CAD (STEP or IGES) for geometry-based analysis; Provide numeric tolerances for all critical features; Specify hole depth(s) and required surface finishes\n", "trace": "Run started\nInputs validated\nProcess selection node entered\nprocess_selection: gated_out process=CASTING reason=metal process\nprocess_selection: gated_out process=FORGING reason=metal process\nprocess_selection: gated_out process=MIM reason=metal process\nprocess_selection: eligible_processes=['AM', 'CNC', 'CNC_TURNING', 'COMPRESSION_MOLDING', 'EXTRUSION', 'INJECTION_MOLDING', 'SHEET_METAL', 'THERMOFORMING']\nPSI: user_text_len=0 preview=\"\"\nprocess_selection: scorer_path=legacy_bins cad_status=none\nPSI: score_diff=5 (primary=INJECTION_MOLDING=10, second=THERMOFORMING=5)\nProcess selection computed: primary=INJECTION_MOLDING user_selected=INJECTION_MOLDING\nprocess_selection: cad_uploaded=n evidence_available=n\nrules: cad_uploaded=n cad_status=none evidence_keys=[]\nexplain: skipping LLM explanation (no findings & RAG disabled)\nAgent decision: accept\nself_review: confidence_base=0.75 source=deterministic\nself_review: cad_uploaded=n cad_status=none\nPerformed self-critique and confidence scoring\nself_review: flag_adjustments=missing_cad-0.05, no_rag_sources-0.02, no_numeric_tolerances-0.03, geometry_uncertain-0.02, unknown_shop_constraints-0.02\nself_review: adjusted_base=0.61 llm_delta=+0.00 final=0.61\nreport: process_recommendation present=True primary=INJECTION_MOLDING", "error": null, "case_id": "pl_01_plastic_production_im"}}
{"case_id": "pl_02_plastic_small_not_im", "status": "updated", "result": {"primary": "CNC", "secondary": ["THERMOFORMING", "CNC_TURNING"], "eligible_processes": ["CNC", "CNC_TURNING", "AM", "SHEET_METAL", "INJECTION_MOLDING", "EXTRUSION", "THERMOFORMING", "COMPRESSION_MOLDING"], "gated_out": ["CASTING", "FORGING", "MIM"], "cad_lite_status": "none", "sheet_metal_likelihood_level": null, "sheet_metal_likelihood_source": null, "findings": [{"rule_id": "PASS1", "severity": "LOW", "process": null, "title": "Low feature variety (favorable for cycle time and tooling)"}, {"rule_id": "PASS2", "severity": "LOW", "process": null, "title": "Low accessibility risk (good tool access)"}, {"rule_id": "IM1", "severity": "HIGH", "process": "INJECTION_MOLDING", "title": "Low volume + injection molding (tooling ROI risk)"}], "top_priorities": ["PASS1", "PASS2"], "duration_ms": 38709.21, "report": "# CNC Design Review + DFM Report\n\n## Input summary\n\n- Manufacturing process: CNC\n\n- Material: Plastic\n- Production volume: Small batch\n- Load type: Static\n- Tolerance criticality: Medium\n\n- Part size: Medium\n- Min internal radius: Medium\n- Min wall thickness: Medium\n- Hole depth class: None\n- Pocket aspect class: OK\n- Feature variety: Low\n- Accessibility risk: Low\n- Has clamping faces: True\n\n\n## Process recommendation\n\n- Primary: **CNC**\n\n- Secondary: THERMOFORMING, CNC_TURNING\n\n- Less suitable (given current inputs): None\n\n- Not applicable (hard gated): CASTING (metal process), FORGING (metal process), MIM (metal process)\n\n- Tradeoffs:\n\n  - Tooling lead time vs unit cost: IM/Sheet metal need tooling; CNC/AM suit low volume.\n\n  - Tolerance and finish: Define critical interfaces; plan post-machining or inspection where needed.\n\n  - Risk drivers: Warpage (IM/AM), supports (AM), setups (CNC/Sheet metal) affect feasibility.\n\n  - Volume sensitivity: IM and sheet metal favor production runs; CNC/AM suit proto and small batch.\n\n  - Documentation: 2D drawing and scale confirmation improve tolerance and process selection.\n\n\n\n## Manufacturing confidence inputs\n\n- CAD uploaded: no\n\n- CAD analysis status: none\n\n- CAD evidence used in rules: no\n\n- CAD Lite analysis: none\n\n_Confidence inputs not provided._\n\n\n\n## Top priorities\n\n- [LOW] Low feature variety (favorable for cycle time and tooling) (PASS1)\n\n- [LOW] Low accessibility risk (good tool access) (PASS2)\n\n\n\n## Findings (HIGH)\n\n- **Low volume + injection molding (tooling ROI risk)** (IM1) \u2014 Injection molding has high upfront tooling cost; unit cost only becomes favorable at high volumes.\n  - Recommendation: Consider alternative processes (CNC, AM) for low volumes; injection molding best for stable designs at production scale.\n\n## Findings (MEDIUM)\n\n_None_\n\n## Findings (LOW)\n\n- **Low feature variety (favorable for cycle time and tooling)** (PASS1) \u2014 Low complexity reduces cycle time and tooling risk.\n  - Recommendation: No change needed.\n- **Low accessibility risk (good tool access)** (PASS2) \u2014 Good tool access reduces setup and machining risk.\n  - Recommendation: No change needed.\n\n## Action Checklist\n\n- [ ] Verify Quantify target production run and compute break-even for injection molding versus CNC/AM before committing to tooling.\n- [ ] Consider alternative processes (CNC, AM) for low volumes; injection molding best for stable designs at production scale.\n- [ ] Address Produce a small prototype batch via CNC or AM to validate fit, static-load performance, and any assembly interfaces prior to mold investment.\n- [ ] Verify No change needed for low feature variety and low accessibility risk.\n- [ ] Verify Estimate per-part unit cost and lead time for CNC and AM (small-batch) and compare to injection molding including tooling amortization.\n- [ ] Define a decision gate: if validated design and projected annual volume meet molding ROI, authorize mold design; otherwise continue with CNC/AM production.\n\n## Assumptions\n\n- Annual production volume threshold for molding ROI is not provided.\n- Detailed part geometry, wall thicknesses, and critical dimensions are not provided.\n- Surface finish, cosmetic requirements, and post-processing/secondary operations are not provided.\n- Target unit cost, lead time expectations, and preferred suppliers/capabilities are not provided.\n\n## Usage (tokens & cost)\n\n- prompt_tokens: 568\n\n- completion_tokens: 993\n\n- total_tokens: 1561\n\n- total_cost_usd: 0.0021279999999999997\n\n\n_Note: Cost is reported by the callback and depends on model pricing; verify for production._\n\n\n## LLM usage by node\n\n- explain: attempts=1, cache_hit=False, prompt_tokens=568, completion_tokens=993, total_tokens=1561, total_cost_usd=0.0021279999999999997\n\n- rag: cache_hit=False, retrieved_k=5, sources_count=5\n\n- self_review: attempts=1, cache_hit=False\n\n\n## Sources used\n\n1. **cnc/cnc_lead_time_and_cost_scaling.md**\n\n   # CNC: Lead Time and Cost Scaling\n\nDesign choices directly influence manufacturing speed and cost.\n\n## Lead Time Drivers\n\n- Setup count\n- Tool changes\n- Programming complexity\n- Inspection requirement...\n\n\n2. **cnc/cnc_tool_access_and_reach.md**\n\n   # CNC: Tool Access and Reach Constraints\n\nTool accessibility defines what features can be machined reliably.\n\n## Reach Limitations\n\n- Long-reach tools are less rigid\n- Increased stick-out amplifies ch...\n\n\n3. **cnc/cnc_axis_count_and_machine_selection.md**\n\n   # CNC: Axis Count and Machine Selection\n\nChoosing the right machine configuration affects cost and feasibility.\n\n## 3-Axis Machining\n\n- Lowest cost and most widely available\n- Limited to features acce...\n\n\n4. **cnc/cnc_material_behavior_and_machinability.md**\n\n   # CNC: Material Behavior and Machinability Differences\n\nMaterial properties strongly affect machining strategy and risk.\n\n## Hard vs Soft Materials\n\n- Hard materials increase tool wear and cycle time\n...\n\n\n5. **cnc/cnc_part_complexity_and_setups.md**\n\n   # CNC: Part Complexity and Setup Count\n\nComplexity is often driven by tool access, number of faces, and contoured geometry.\n\n## Cost Drivers\n\n- Multi-face machining increases setup time and cost\n- Con...\n\n\n\n## Agent confidence & limitations\n\n- **Score:** 0.56\n\n- **High confidence:** Low feature variety and good accessibility reduce cycle time and tooling complexity.; RAG materials on CNC tooling and access justify CNC/AM as viable small-batch alternatives.\n\n- **Medium confidence:** Injection molding ROI concern is likely given small-batch input but cannot be quantified without volume/cost targets.; Prototype via CNC/AM will likely validate fit and basic static-load performance.\n\n- **Low confidence:** Precise manufacturability, cycle time, and per-part cost estimates due to missing CAD and tolerances.; Specific tooling, fixturing, and secondary operations required are unknown.\n\n- **Limitations:** No CAD model; No numeric tolerances; No production volume threshold; No surface finish/secondary ops specs\n\n- **To improve:** Provide CAD (STEP/IGES) for geometry-specific manufacturability and cycle-time analysis.; Specify numeric tolerances and surface finish requirements for accurate costing.; Quantify target annual production volume and run assumptions for mold ROI calculations.\n", "trace": "Run started\nInputs validated\nProcess selection node entered\nprocess_selection: gated_out process=CASTING reason=metal process\nprocess_selection: gated_out process=FORGING reason=metal process\nprocess_selection: gated_out process=MIM reason=metal process\nprocess_selection: eligible_processes=['AM', 'CNC', 'CNC_TURNING', 'COMPRESSION_MOLDING', 'EXTRUSION', 'INJECTION_MOLDING', 'SHEET_METAL', 'THERMOFORMING']\nPSI: user_text_len=0 preview=\"\"\nprocess_selection: scorer_path=legacy_bins cad_status=none\nprocess_selection: bins_anchor applied selected=CNC margin=2 top_was=THERMOFORMING\nPSI: score_diff=0 (primary=CNC=2, second=CNC=2)\nPSI tie-break: prefer user-selected flexible process (CNC) when score_diff <= 1 (compatible, no strong mismatch)\nPSI: final score_diff=0 (after tie-break, primary changed from THERMOFORMING to CNC)\nProcess selection computed: primary=CNC user_selected=CNC\nprocess_selection: cad_uploaded=n evidence_available=n\nrules: cad_uploaded=n cad_status=none evidence_keys=[]\nGenerated explanation via openai\nexplain: cache_hit=False key=b3ad6d18 mode=bins provider=none\nexplain: using deterministic checklist completion after LLM output validation failure\nexplain: polished checklist grammar and formatting\nAgent decision: enrich via RAG\nRAG triggered: HIGH severity findings\nEntered rag_node (process=CNC, top_k=5)\nRAG: rag_user_text_normalized=\nPSI debug: primary=CNC, user_selected=CNC, extrusion_offer=no, mim_offer=no, thermo_offer=no, comp_offer=no, am_offer=no, hybrid_offer=no, main_index_used=cnc, offer_index_used=none, hybrid_primary_index_used=none, hybrid_secondary_index_used=none\nRAG: main_retrieve_index=cnc, offer_retrieve_index=none\nRAG: main_index_used=cnc\nRAG: retrieving from local cnc index\nRAG: sources_breakdown main=5 offer=0 hybrid_primary=0 hybrid_secondary=0\nRAG completed: retrieved 5 snippets (main_index_used=cnc)\nExplanation regenerated after RAG (via openai)\nexplain: cache_hit=False key=b71a03a5 mode=bins provider=none\nexplain: polished checklist grammar and formatting\nAgent decision: accept (RAG already used; proceeding)\nself_review: confidence_base=0.74 source=deterministic\nself_review: cad_uploaded=n cad_status=none\nPerformed self-critique and confidence scoring\nself_review: flag_adjustments=missing_cad-0.05, geometry_uncertain-0.02, no_numeric_tolerances-0.03, no_2d_drawing-0.04\nself_review: adjusted_base=0.60 llm_delta=-0.04 final=0.56\nreport: process_recommendation present=True primary=CNC", "error": null, "case_id": "pl_02_plastic_small_not_im"}}
{"case_id": "sm_01_steel_small_bins", "status": "updated", "result": {"primary": "SHEET_METAL", "secondary": ["CNC"], "eligible_processes": ["CNC", "CNC_TURNING", "AM", "SHEET_METAL", "CASTING", "FORGING", "EXTRUSION", "MIM"], "gated_out": ["COMPRESSION_MOLDING", "INJECTION_MOLDING", "THERMOFORMING"], "cad_lite_status": "none", "sheet_metal_likelihood_level": null, "sheet_metal_likelihood_source": null, "findings": [{"rule_id": "CAST1", "severity": "MEDIUM", "process": "CASTING", "title": "Low volume + casting (tooling risk)"}, {"rule_id": "FORG1", "severity": "MEDIUM", "process": "FORGING", "title": "Low volume + forging (tooling risk)"}, {"rule_id": "MIM1", "severity": "HIGH", "process": "MIM", "title": "Low volume + MIM (tooling ROI risk)"}], "top_priorities": [], "duration_ms": 48718.81, "report": "# CNC Design Review + DFM Report\n\n## Input summary\n\n- Manufacturing process: SHEET_METAL\n\n- Material: Steel\n- Production volume: Small batch\n- Load type: Static\n- Tolerance criticality: Medium\n\n- Part size: Medium\n- Min internal radius: Medium\n- Min wall thickness: Thin\n- Hole depth class: None\n- Pocket aspect class: OK\n- Feature variety: Low\n- Accessibility risk: Low\n- Has clamping faces: True\n\n\n## Process recommendation\n\n- Primary: **SHEET_METAL**\n\n- Secondary: CNC\n\n- Less suitable (given current inputs): AM, CASTING, FORGING, MIM\n\n- Not applicable (hard gated): INJECTION_MOLDING (polymer process), THERMOFORMING (polymer process), COMPRESSION_MOLDING (polymer process)\n\n- Tradeoffs:\n\n  - Tooling lead time vs unit cost: IM/Sheet metal need tooling; CNC/AM suit low volume.\n\n  - Tolerance and finish: Define critical interfaces; plan post-machining or inspection where needed.\n\n  - Risk drivers: Warpage (IM/AM), supports (AM), setups (CNC/Sheet metal) affect feasibility.\n\n  - Volume sensitivity: IM and sheet metal favor production runs; CNC/AM suit proto and small batch.\n\n  - Documentation: 2D drawing and scale confirmation improve tolerance and process selection.\n\n\n\n## Manufacturing confidence inputs\n\n- CAD uploaded: no\n\n- CAD analysis status: none\n\n- CAD evidence used in rules: no\n\n- CAD Lite analysis: none\n\n_Confidence inputs not provided._\n\n\n\n## Top priorities\n\n_None_\n\n\n\n## Findings (HIGH)\n\n- **Low volume + MIM (tooling ROI risk)** (MIM1) \u2014 MIM has high upfront tooling cost; unit cost only becomes favorable at production volumes.\n  - Recommendation: Consider CNC or AM for low volumes; MIM best for stable designs at production scale.\n\n## Findings (MEDIUM)\n\n- **Low volume + casting (tooling risk)** (CAST1) \u2014 Casting has significant tooling cost; economics favor production runs.\n  - Recommendation: Consider CNC or AM for low volumes; casting best at production scale.\n- **Low volume + forging (tooling risk)** (FORG1) \u2014 Forging has significant die cost; economics favor production runs.\n  - Recommendation: Consider CNC or AM for low volumes; forging best at production scale.\n\n## Findings (LOW)\n\n_None_\n\n## Action Checklist\n\n- [ ] Confirm Issue parallel RFQs to qualified CNC shops and AM providers; plan first-article inspection and iterate design based on prototype feedback given Medium tolerance criticality.\n- [ ] Confirm design freeze and exact small-batch quantity; if volume remains low, prefer CNC or AM \u2014 \"Consider CNC or AM for low volumes; casting best at production scale.\".\n- [ ] Verify Prototype with single-piece CNC or AM to validate fit, static-load performance and assembly before any tooling investment.\n- [ ] Verify Perform a CNC DFM review: identify stock, clamping/fixturing needs, deep-pocket access, undercuts, and select tooling and roughing/finishing strategy for steel.\n- [ ] Evaluate forging and tooling ROI early; for low volume keep CNC/AM primary \u2014 \"Consider CNC or AM for low volumes; forging best at production scale.\".\n- [ ] Confirm Reassess MIM only if design is stable and volumes justify tooling: \"Consider CNC or AM for low volumes; MIM best for stable designs at production scale.\n\n## Assumptions\n\n- Material is steel and load is static as stated; no additional material variants considered.\n- Production volume is small batch and design may change during prototyping.\n- No part geometry, surface finish, or dimensional data were provided.\n- No EVIDENCE block available; cost, lead-time, and supplier capabilities are unknown.\n\n## Usage (tokens & cost)\n\n- prompt_tokens: 583\n\n- completion_tokens: 2011\n\n- total_tokens: 2594\n\n- total_cost_usd: 0.0041677500000000004\n\n\n_Note: Cost is reported by the callback and depends on model pricing; verify for production._\n\n\n## LLM usage by node\n\n- explain: attempts=1, cache_hit=False, prompt_tokens=583, completion_tokens=2011, total_tokens=2594, total_cost_usd=0.0041677500000000004\n\n- rag: cache_hit=False, retrieved_k=5, sources_count=5\n\n- self_review: attempts=1, cache_hit=False\n\n\n## Sources used\n\n1. **sheet_metal/sm_finishing_sequence_and_masking.md**\n\n   # Sheet Metal: Finishing Sequence and Masking\n\nFinishing order influences quality and dimensional accuracy.\n\n## Finishing Order Considerations\n\n- Bending typically precedes coating\n- Machining may occ...\n\n\n2. **sheet_metal/sm_joining_method_tradeoffs.md**\n\n   # Sheet Metal: Welding vs Riveting Trade-Offs\n\nJoining method selection affects strength, distortion, and cost.\n\n## Welding Characteristics\n\n- Strong, permanent joints\n- Heat distortion risk\n- Require...\n\n\n3. **sheet_metal/sm_manufacturing_efficiency.md**\n\n   # Sheet Metal: Manufacturing Efficiency\n\nEfficient sheet metal design reduces cost, lead time, and variability.\n\n## Efficiency Drivers\n\n- Fewer bends and setups\n- Consistent tooling\n- Minimal secondar...\n\n\n4. **sheet_metal/sm_edge_condition_and_deburring.md**\n\n   # Sheet Metal: Edge Condition and Deburring\n\nEdge quality affects safety, assembly, and finish quality.\n\n## Edge Formation\n\n- Laser cutting leaves heat-affected edges\n- Punching creates burrs and defo...\n\n\n5. **sheet_metal/sm_material_selection.md**\n\n   # Sheet Metal: Material Selection\n\nMaterial choice strongly affects formability, strength, corrosion resistance,\nand manufacturing cost in sheet metal design.\n\n## Common Materials\n\n- Steel: strong, af...\n\n\n\n## Agent confidence & limitations\n\n- **Score:** 0.54\n\n- **High confidence:** CNC/AM preferred for small-batch prototyping given stated small volume; Tooling-heavy processes (casting/forging/MIM) have higher upfront risk for low volumes\n\n- **Medium confidence:** MIM and forging become attractive at stable, higher production volumes; Prototype iteration via single-piece CNC/AM will validate fit and static-load performance\n\n- **Low confidence:** Specific DFM items (deep-pocket access, fixture design, tooling selection) without CAD; Any cost, lead-time, or ROI estimates\n\n- **Limitations:** CAD geometry not provided; No numeric tolerance table; Surface finish/specs absent; Supplier capabilities unknown\n\n- **To improve:** Upload native CAD or STEP file for detailed CNC DFM; Provide numeric tolerances and critical dimensions; Specify exact small-batch quantity and production ramp plan\n", "trace": "Run started\nInputs validated\nProcess selection node entered\nprocess_selection: gated_out process=INJECTION_MOLDING reason=polymer process\nprocess_selection: gated_out process=THERMOFORMING reason=polymer process\nprocess_selection: gated_out process=COMPRESSION_MOLDING reason=polymer process\nprocess_selection: eligible_processes=['AM', 'CASTING', 'CNC', 'CNC_TURNING', 'EXTRUSION', 'FORGING', 'MIM', 'SHEET_METAL']\nPSI: user_text_len=0 preview=\"\"\nprocess_selection: scorer_path=legacy_bins cad_status=none\nPSI: score_diff=0 (primary=SHEET_METAL=5, second=CNC=5)\nProcess selection computed: primary=SHEET_METAL user_selected=SHEET_METAL\nprocess_selection: cad_uploaded=n evidence_available=n\nrules: cad_uploaded=n cad_status=none evidence_keys=[]\nGenerated explanation via openai\nexplain: cache_hit=False key=38b2e069 mode=bins provider=none\nexplain: polished checklist grammar and formatting\nAgent decision: enrich via RAG\nRAG triggered: HIGH severity findings\nEntered rag_node (process=SHEET_METAL, top_k=5)\nRAG: rag_user_text_normalized=\nPSI debug: primary=SHEET_METAL, user_selected=SHEET_METAL, extrusion_offer=no, mim_offer=no, thermo_offer=no, comp_offer=no, am_offer=no, hybrid_offer=no, main_index_used=sheet_metal, offer_index_used=none, hybrid_primary_index_used=none, hybrid_secondary_index_used=none\nRAG: main_retrieve_index=sheet_metal, offer_retrieve_index=none\nRAG: main_index_used=sheet_metal\nRAG: retrieving from local sheet_metal index\nRAG: sources_breakdown main=5 offer=0 hybrid_primary=0 hybrid_secondary=0\nRAG completed: retrieved 5 snippets (main_index_used=sheet_metal)\nExplanation regenerated after RAG (via openai)\nexplain: cache_hit=False key=c4d32a33 mode=bins provider=none\nexplain: polished checklist grammar and formatting\nAgent decision: accept (RAG already used; proceeding)\nself_review: confidence_base=0.7 source=deterministic\nself_review: cad_uploaded=n cad_status=none\nPerformed self-critique and confidence scoring\nself_review: flag_adjustments=missing_cad-0.05, no_numeric_tolerances-0.03, geometry_uncertain-0.02, unknown_shop_constraints-0.02\nself_review: adjusted_base=0.58 llm_delta=-0.04 final=0.54\nreport: process_recommendation present=True primary=SHEET_METAL", "error": null, "case_id": "sm_01_steel_small_bins"}}
{"case_id": "steel_gated_im_thermo", "status": "updated", "result": {"primary": "SHEET_METAL", "secondary": ["CNC", "AM"], "eligible_processes": ["CNC", "CNC_TURNING", "AM", "SHEET_METAL", "CASTING", "FORGING", "EXTRUSION", "MIM"], "gated_out": ["COMPRESSION_MOLDING", "INJECTION_MOLDING", "THERMOFORMING"], "cad_lite_status": "none", "sheet_metal_likelihood_level": null, "sheet_metal_likelihood_source": null, "findings": [{"rule_id": "CAST1", "severity": "MEDIUM", "process": "CASTING", "title": "Low volume + casting (tooling risk)"}, {"rule_id": "FORG1", "severity": "MEDIUM", "process": "FORGING", "title": "Low volume + forging (tooling risk)"}, {"rule_id": "MIM1", "severity": "HIGH", "process": "MIM", "title": "Low volume + MIM (tooling ROI risk)"}], "top_priorities": [], "duration_ms": 37206.53, "report": "# CNC Design Review + DFM Report\n\n## Input summary\n\n- Manufacturing process: SHEET_METAL\n\n- Material: Steel\n- Production volume: Proto\n- Load type: Static\n- Tolerance criticality: Medium\n\n- Part size: Medium\n- Min internal radius: Medium\n- Min wall thickness: Thin\n- Hole depth class: None\n- Pocket aspect class: OK\n- Feature variety: Low\n- Accessibility risk: Low\n- Has clamping faces: True\n\n\n## Process recommendation\n\n- Primary: **SHEET_METAL**\n\n- Secondary: CNC, AM\n\n- Less suitable (given current inputs): CASTING, FORGING, MIM\n\n- Not applicable (hard gated): INJECTION_MOLDING (polymer process), THERMOFORMING (polymer process), COMPRESSION_MOLDING (polymer process)\n\n- Tradeoffs:\n\n  - Tooling lead time vs unit cost: IM/Sheet metal need tooling; CNC/AM suit low volume.\n\n  - Tolerance and finish: Define critical interfaces; plan post-machining or inspection where needed.\n\n  - Risk drivers: Warpage (IM/AM), supports (AM), setups (CNC/Sheet metal) affect feasibility.\n\n  - Volume sensitivity: IM and sheet metal favor production runs; CNC/AM suit proto and small batch.\n\n  - Documentation: 2D drawing and scale confirmation improve tolerance and process selection.\n\n\n\n## Manufacturing confidence inputs\n\n- CAD uploaded: no\n\n- CAD analysis status: none\n\n- CAD evidence used in rules: no\n\n- CAD Lite analysis: none\n\n_Confidence inputs not provided._\n\n\n\n## Top priorities\n\n_None_\n\n\n\n## Findings (HIGH)\n\n- **Low volume + MIM (tooling ROI risk)** (MIM1) \u2014 MIM has high upfront tooling cost; unit cost only becomes favorable at production volumes.\n  - Recommendation: Consider CNC or AM for low volumes; MIM best for stable designs at production scale.\n\n## Findings (MEDIUM)\n\n- **Low volume + casting (tooling risk)** (CAST1) \u2014 Casting has significant tooling cost; economics favor production runs.\n  - Recommendation: Consider CNC or AM for low volumes; casting best at production scale.\n- **Low volume + forging (tooling risk)** (FORG1) \u2014 Forging has significant die cost; economics favor production runs.\n  - Recommendation: Consider CNC or AM for low volumes; forging best at production scale.\n\n## Findings (LOW)\n\n_None_\n\n## Action Checklist\n\n- [ ] Define inspection plan for proto: identify critical dimensions, surface-finish targets, and first-article inspection steps aligned with Medium tolerance criticality.\n- [ ] Confirm Prioritize CNC or AM for prototyping: Consider CNC or AM for low volumes; casting best at production scale.\n- [ ] Evaluate forging path for future scaling: Consider CNC or AM for low volumes; forging best at production scale.\n- [ ] Confirm Limit MIM to stable production designs: Consider CNC or AM for low volumes; MIM best for stable designs at production scale.\n- [ ] Run static-load verification: perform FEA and a small set of physical tests on steel prototypes to confirm geometry and strength before committing process.\n- [ ] Confirm Perform tooling ROI and lead-time comparison across CNC, AM, casting, forging, and MIM; document break-even, tooling risks, and recommended next-step process for proto.\n\n## Assumptions\n\n- Geometry details (thickness, features, draft, cores) are not provided and will be reviewed before final process selection.\n- Surface finish requirements and specific dimension tolerances are unspecified and will be defined in the next design iteration.\n- Production volume is \"Proto\" (low volume) and no production tooling is assumed available.\n- Material is Steel and load is static as stated; specific steel grade and heat treatment are to be selected later.\n\n## Usage (tokens & cost)\n\n- prompt_tokens: 582\n\n- completion_tokens: 1168\n\n- total_tokens: 1750\n\n- total_cost_usd: 0.0024814999999999998\n\n\n_Note: Cost is reported by the callback and depends on model pricing; verify for production._\n\n\n## LLM usage by node\n\n- explain: attempts=1, cache_hit=False, prompt_tokens=582, completion_tokens=1168, total_tokens=1750, total_cost_usd=0.0024814999999999998\n\n- rag: cache_hit=False, retrieved_k=5, sources_count=5\n\n- self_review: attempts=1, cache_hit=False\n\n\n## Sources used\n\n1. **sheet_metal/sm_finishing_sequence_and_masking.md**\n\n   # Sheet Metal: Finishing Sequence and Masking\n\nFinishing order influences quality and dimensional accuracy.\n\n## Finishing Order Considerations\n\n- Bending typically precedes coating\n- Machining may occ...\n\n\n2. **sheet_metal/sm_joining_method_tradeoffs.md**\n\n   # Sheet Metal: Welding vs Riveting Trade-Offs\n\nJoining method selection affects strength, distortion, and cost.\n\n## Welding Characteristics\n\n- Strong, permanent joints\n- Heat distortion risk\n- Require...\n\n\n3. **sheet_metal/sm_manufacturing_efficiency.md**\n\n   # Sheet Metal: Manufacturing Efficiency\n\nEfficient sheet metal design reduces cost, lead time, and variability.\n\n## Efficiency Drivers\n\n- Fewer bends and setups\n- Consistent tooling\n- Minimal secondar...\n\n\n4. **sheet_metal/sm_edge_condition_and_deburring.md**\n\n   # Sheet Metal: Edge Condition and Deburring\n\nEdge quality affects safety, assembly, and finish quality.\n\n## Edge Formation\n\n- Laser cutting leaves heat-affected edges\n- Punching creates burrs and defo...\n\n\n5. **sheet_metal/sm_material_selection.md**\n\n   # Sheet Metal: Material Selection\n\nMaterial choice strongly affects formability, strength, corrosion resistance,\nand manufacturing cost in sheet metal design.\n\n## Common Materials\n\n- Steel: strong, af...\n\n\n\n## Agent confidence & limitations\n\n- **Score:** 0.56\n\n- **High confidence:** Low-volume prototyping favors CNC or AM over high-tooling processes.; Consider CNC or AM for low volumes; MIM best for stable designs at production scale (MIM1).\n\n- **Medium confidence:** Tooling ROI and lead-time comparison will clarify best scale-up path.; FEA plus steel prototypes should validate static-load performance before committing to process.\n\n- **Low confidence:** Specific geometry, draft, and core interactions are unknown.; Surface finish and heat-treatment requirements are unspecified.\n\n- **Limitations:** CAD model not provided; numeric tolerances missing; specific steel grade unknown; tooling cost and lead-time data absent\n\n- **To improve:** Provide native CAD model and 2D drawings with critical dimensions and datums.; Specify numeric tolerances and surface-finish targets for critical features.; Select candidate steel grade(s) and any intended heat treatment.\n", "trace": "Run started\nInputs validated\nProcess selection node entered\nprocess_selection: gated_out process=INJECTION_MOLDING reason=polymer process\nprocess_selection: gated_out process=THERMOFORMING reason=polymer process\nprocess_selection: gated_out process=COMPRESSION_MOLDING reason=polymer process\nprocess_selection: eligible_processes=['AM', 'CASTING', 'CNC', 'CNC_TURNING', 'EXTRUSION', 'FORGING', 'MIM', 'SHEET_METAL']\nPSI: user_text_len=0 preview=\"\"\nprocess_selection: scorer_path=legacy_bins cad_status=none\nPSI: score_diff=0 (primary=SHEET_METAL=5, second=CNC=5)\nProcess selection computed: primary=SHEET_METAL user_selected=SHEET_METAL\nprocess_selection: cad_uploaded=n evidence_available=n\nrules: cad_uploaded=n cad_status=none evidence_keys=[]\nGenerated explanation via openai\nexplain: cache_hit=False key=f4d4aeff mode=bins provider=none\nexplain: polished checklist grammar and formatting\nAgent decision: enrich via RAG\nRAG triggered: HIGH severity findings\nEntered rag_node (process=SHEET_METAL, top_k=5)\nRAG: rag_user_text_normalized=\nPSI debug: primary=SHEET_METAL, user_selected=SHEET_METAL, extrusion_offer=no, mim_offer=no, thermo_offer=no, comp_offer=no, am_offer=no, hybrid_offer=no, main_index_used=sheet_metal, offer_index_used=none, hybrid_primary_index_used=none, hybrid_secondary_index_used=none\nRAG: main_retrieve_index=sheet_metal, offer_retrieve_index=none\nRAG: main_index_used=sheet_metal\nRAG: retrieving from local sheet_metal index\nRAG: sources_breakdown main=5 offer=0 hybrid_primary=0 hybrid_secondary=0\nRAG completed: retrieved 5 snippets (main_index_used=sheet_metal)\nExplanation regenerated after RAG (via openai)\nexplain: cache_hit=False key=fc89c73b mode=bins provider=none\nexplain: polished checklist grammar and formatting\nAgent decision: accept (RAG already used; proceeding)\nself_review: confidence_base=0.7 source=deterministic\nself_review: cad_uploaded=n cad_status=none\nPerformed self-critique and confidence scoring\nself_review: flag_adjustments=missing_cad-0.05, geometry_uncertain-0.02, no_numeric_tolerances-0.03\nself_review: adjusted_base=0.60 llm_delta=-0.04 final=0.56\nreport: process_recommendation present=True primary=SHEET_METAL", "error": null, "case_id": "steel_gated_im_thermo"}}
{"case_id": "step_bins_cad_lite", "status": "updated", "result": {"primary": "SHEET_METAL", "secondary": ["CNC"], "eligible_processes": ["CNC", "CNC_TURNING", "AM", "SHEET_METAL", "CASTING", "FORGING", "EXTRUSION", "MIM"], "gated_out": ["COMPRESSION_MOLDING", "INJECTION_MOLDING", "THERMOFORMING"], "cad_lite_status": "failed", "sheet_metal_likelihood_level": "med", "sheet_metal_likelihood_source": "bins_only", "findings": [{"rule_id": "CAST1", "severity": "MEDIUM", "process": "CASTING", "title": "Low volume + casting (tooling risk)"}, {"rule_id": "FORG1", "severity": "MEDIUM", "process": "FORGING", "title": "Low volume + forging (tooling risk)"}, {"rule_id": "MIM1", "severity": "HIGH", "process": "MIM", "title": "Low volume + MIM (tooling ROI risk)"}], "top_priorities": [], "duration_ms": 52070.45, "report": "# CNC Design Review + DFM Report\n\n## Input summary\n\n- Manufacturing process: SHEET_METAL\n\n- Material: Steel\n- Production volume: Small batch\n- Load type: Static\n- Tolerance criticality: Medium\n\n- Part size: Medium\n- Min internal radius: Medium\n- Min wall thickness: Thin\n- Hole depth class: None\n- Pocket aspect class: OK\n- Feature variety: Low\n- Accessibility risk: Low\n- Has clamping faces: True\n\n\n## Process recommendation\n\n- Primary: **SHEET_METAL**\n\n- Secondary: CNC\n\n- Less suitable (given current inputs): AM, CASTING, FORGING, EXTRUSION, MIM\n\n- Not applicable (hard gated): INJECTION_MOLDING (polymer process), THERMOFORMING (polymer process), COMPRESSION_MOLDING (polymer process)\n\n- Tradeoffs:\n\n  - Tooling lead time vs unit cost: IM/Sheet metal need tooling; CNC/AM suit low volume.\n\n  - Tolerance and finish: Define critical interfaces; plan post-machining or inspection where needed.\n\n  - Risk drivers: Warpage (IM/AM), supports (AM), setups (CNC/Sheet metal) affect feasibility.\n\n  - Volume sensitivity: IM and sheet metal favor production runs; CNC/AM suit proto and small batch.\n\n  - Documentation: 2D drawing and scale confirmation improve tolerance and process selection.\n\n\n\n## Manufacturing confidence inputs\n\n- CAD uploaded: yes\n\n- CAD analysis status: none\n\n- CAD evidence used in rules: no\n\n- CAD Lite analysis: failed\n\n- Sheet metal likelihood: med (source=bins_only)\n\n_Confidence inputs not provided._\n\n\n\n## Top priorities\n\n_None_\n\n\n\n## Findings (HIGH)\n\n- **Low volume + MIM (tooling ROI risk)** (MIM1) \u2014 MIM has high upfront tooling cost; unit cost only becomes favorable at production volumes.\n  - Recommendation: Consider CNC or AM for low volumes; MIM best for stable designs at production scale.\n\n## Findings (MEDIUM)\n\n- **Low volume + casting (tooling risk)** (CAST1) \u2014 Casting has significant tooling cost; economics favor production runs.\n  - Recommendation: Consider CNC or AM for low volumes; casting best at production scale.\n- **Low volume + forging (tooling risk)** (FORG1) \u2014 Forging has significant die cost; economics favor production runs.\n  - Recommendation: Consider CNC or AM for low volumes; forging best at production scale.\n\n## Findings (LOW)\n\n_None_\n\n## Action Checklist\n\n- [ ] Establish inspection and QA plan aligned to Tolerance criticality: Medium; define critical dimensions, sampling plan, and required heat-treat/surface processes prior to production.\n- [ ] Confirm volume + casting (tooling risk): Consider CNC or AM for low volumes; casting best at production scale.\n- [ ] Confirm volume + forging (tooling risk): Consider CNC or AM for low volumes; forging best at production scale.\n- [ ] Confirm volume + MIM (tooling ROI risk): Consider CNC or AM for low volumes; MIM best for stable designs at production scale.\n- [ ] Address Perform manufacturability review for CNC and AM: validate feature access, fixturing, minimum wall sections, internal cavities, and achievable surface finish for Steel.\n- [ ] Address Prototype the selected route (CNC or AM) to verify fit, material behavior, assembly, cycle time, and per-piece cost for the small batch.\n\n## Assumptions\n\n- Exact part geometry and critical dimensions not provided.\n- Exact small-batch quantity, target unit cost, and lead time not provided.\n- Steel grade, required heat treatment, and surface finish specifications not provided.\n- No EVIDENCE block or manufacturing drawings supplied; recommendations assume static load use and prioritize low-tooling-risk options (CNC/AM).\n\n## Usage (tokens & cost)\n\n- prompt_tokens: 583\n\n- completion_tokens: 1418\n\n- total_tokens: 2001\n\n- total_cost_usd: 0.00298175\n\n\n_Note: Cost is reported by the callback and depends on model pricing; verify for production._\n\n\n## LLM usage by node\n\n- explain: attempts=1, cache_hit=False, prompt_tokens=583, completion_tokens=1418, total_tokens=2001, total_cost_usd=0.00298175\n\n- rag: cache_hit=False, retrieved_k=5, sources_count=5\n\n- self_review: attempts=1, cache_hit=False\n\n\n## Sources used\n\n1. **sheet_metal/sm_finishing_sequence_and_masking.md**\n\n   # Sheet Metal: Finishing Sequence and Masking\n\nFinishing order influences quality and dimensional accuracy.\n\n## Finishing Order Considerations\n\n- Bending typically precedes coating\n- Machining may occ...\n\n\n2. **sheet_metal/sm_joining_method_tradeoffs.md**\n\n   # Sheet Metal: Welding vs Riveting Trade-Offs\n\nJoining method selection affects strength, distortion, and cost.\n\n## Welding Characteristics\n\n- Strong, permanent joints\n- Heat distortion risk\n- Require...\n\n\n3. **sheet_metal/sm_manufacturing_efficiency.md**\n\n   # Sheet Metal: Manufacturing Efficiency\n\nEfficient sheet metal design reduces cost, lead time, and variability.\n\n## Efficiency Drivers\n\n- Fewer bends and setups\n- Consistent tooling\n- Minimal secondar...\n\n\n4. **sheet_metal/sm_edge_condition_and_deburring.md**\n\n   # Sheet Metal: Edge Condition and Deburring\n\nEdge quality affects safety, assembly, and finish quality.\n\n## Edge Formation\n\n- Laser cutting leaves heat-affected edges\n- Punching creates burrs and defo...\n\n\n5. **sheet_metal/sm_material_selection.md**\n\n   # Sheet Metal: Material Selection\n\nMaterial choice strongly affects formability, strength, corrosion resistance,\nand manufacturing cost in sheet metal design.\n\n## Common Materials\n\n- Steel: strong, af...\n\n\n\n## Agent confidence & limitations\n\n- **Score:** 0.55\n\n- **High confidence:** Favor CNC/AM for low-volume to avoid tooling risk; Consider CNC or AM for low volumes; MIM best for stable designs at production scale (MIM1).\n\n- **Medium confidence:** Casting/forging/MIM are more appropriate at production scale; Small-batch input supports prototyping prior to production route selection\n\n- **Low confidence:** Geometry-specific DFM (thin walls, internal features) without numeric CAD metrics; Inspection/QA sampling plan specifics without tolerances or critical-dimension data\n\n- **Limitations:** 2D drawings absent; numeric tolerances absent; CAD-derived dimensions not analyzed; tooling specifications absent\n\n- **To improve:** Run numeric CAD analysis (wall thickness, feature access, mass, bounding box) and attach results; Provide 2D drawing(s) with critical dimensions and tolerances; Specify exact small-batch quantity, target unit cost, and lead-time requirements\n", "trace": "Run started\nInputs validated\nProcess selection node entered\nprocess_selection: gated_out process=INJECTION_MOLDING reason=polymer process\nprocess_selection: gated_out process=THERMOFORMING reason=polymer process\nprocess_selection: gated_out process=COMPRESSION_MOLDING reason=polymer process\nprocess_selection: eligible_processes=['AM', 'CASTING', 'CNC', 'CNC_TURNING', 'EXTRUSION', 'FORGING', 'MIM', 'SHEET_METAL']\nPSI: user_text_len=0 preview=\"\"\nprocess_selection: cad_lite status=failed\nprocess_selection: sheet_metal_likelihood=med (source=bins_only)\nprocess_selection: scorer_path=legacy_bins cad_status=none\nPSI: score_diff=3 (primary=SHEET_METAL=8, second=CNC=5)\nProcess selection computed: primary=SHEET_METAL user_selected=SHEET_METAL\nprocess_selection: cad_uploaded=y evidence_available=n\nrules: cad_uploaded=y cad_status=none evidence_keys=[]\nGenerated explanation via openai\nexplain: cache_hit=False key=9f5ce0cc mode=bins provider=cad_uploaded_no_numeric\nexplain: polished checklist grammar and formatting\nAgent decision: enrich via RAG\nRAG triggered: HIGH severity findings\nEntered rag_node (process=SHEET_METAL, top_k=5)\nRAG: rag_user_text_normalized=\nPSI debug: primary=SHEET_METAL, user_selected=SHEET_METAL, extrusion_offer=no, mim_offer=no, thermo_offer=no, comp_offer=no, am_offer=no, hybrid_offer=no, main_index_used=sheet_metal, offer_index_used=none, hybrid_primary_index_used=none, hybrid_secondary_index_used=none\nRAG: main_retrieve_index=sheet_metal, offer_retrieve_index=none\nRAG: main_index_used=sheet_metal\nRAG: retrieving from local sheet_metal index\nRAG: sources_breakdown main=5 offer=0 hybrid_primary=0 hybrid_secondary=0\nRAG completed: retrieved 5 snippets (main_index_used=sheet_metal)\nExplanation regenerated after RAG (via openai)\nexplain: cache_hit=False key=67f0d16e mode=bins provider=cad_uploaded_no_numeric\nexplain: polished checklist grammar and formatting\nAgent decision: accept (RAG already used; proceeding)\nself_review: confidence_base=0.7 source=deterministic\nself_review: cad_uploaded=y cad_status=none\nPerformed self-critique and confidence scoring\nself_review: flag_adjustments=numeric_analysis_failed-0.02, no_numeric_tolerances-0.03, no_2d_drawing-0.04\nself_review: adjusted_base=0.61 llm_delta=-0.06 final=0.55\nreport: process_recommendation present=True primary=SHEET_METAL", "error": null, "case_id": "step_bins_cad_lite"}}
{"case_id": "turn_01_turning_keywords", "status": "updated", "result": {"primary": "CNC_TURNING", "secondary": ["CNC", "AM"], "eligible_processes": ["CNC", "CNC_TURNING", "AM", "SHEET_METAL", "CASTING", "FORGING", "EXTRUSION", "MIM"], "gated_out": ["COMPRESSION_MOLDING", "INJECTION_MOLDING", "THERMOFORMING"], "cad_lite_status": "none", "sheet_metal_likelihood_level": null, "sheet_metal_likelihood_source": null, "findings": [{"rule_id": "TURN1", "severity": "MEDIUM", "process": null, "title": "Turning: L/D ratio unknown (upload STEP for slenderness chec"}, {"rule_id": "CAST1", "severity": "MEDIUM", "process": "CASTING", "title": "Low volume + casting (tooling risk)"}, {"rule_id": "FORG1", "severity": "MEDIUM", "process": "FORGING", "title": "Low volume + forging (tooling risk)"}, {"rule_id": "MIM1", "severity": "HIGH", "process": "MIM", "title": "Low volume + MIM (tooling ROI risk)"}], "top_priorities": ["TURN1"], "duration_ms": 52243.03, "report": "# CNC Design Review + DFM Report\n\n## Input summary\n\n- Manufacturing process: CNC_TURNING\n\n- Material: Aluminum\n- Production volume: Proto\n- Load type: Static\n- Tolerance criticality: Medium\n\n- Part size: Small\n- Min internal radius: Medium\n- Min wall thickness: Medium\n- Hole depth class: None\n- Pocket aspect class: OK\n- Feature variety: Low\n- Accessibility risk: Low\n- Has clamping faces: True\n\n\n## Process recommendation\n\n- Primary: **CNC_TURNING**\n\n- Secondary: CNC, AM\n\n- Less suitable (given current inputs): SHEET_METAL, CASTING, FORGING, EXTRUSION, MIM\n\n- Not applicable (hard gated): INJECTION_MOLDING (polymer process), THERMOFORMING (polymer process), COMPRESSION_MOLDING (polymer process)\n\n- Tradeoffs:\n\n  - Tooling lead time vs unit cost: IM/Sheet metal need tooling; CNC/AM suit low volume.\n\n  - Tolerance and finish: Define critical interfaces; plan post-machining or inspection where needed.\n\n  - Risk drivers: Warpage (IM/AM), supports (AM), setups (CNC/Sheet metal) affect feasibility.\n\n  - Volume sensitivity: IM and sheet metal favor production runs; CNC/AM suit proto and small batch.\n\n  - Documentation: 2D drawing and scale confirmation improve tolerance and process selection.\n\n\n\n## Manufacturing confidence inputs\n\n- CAD uploaded: no\n\n- CAD analysis status: none\n\n- CAD evidence used in rules: no\n\n- CAD Lite analysis: none\n\n_Confidence inputs not provided._\n\n\n\n## Top priorities\n\n- [MEDIUM] Turning: L/D ratio unknown (upload STEP for slenderness check) (TURN1)\n\n\n\n## Findings (HIGH)\n\n- **Low volume + MIM (tooling ROI risk)** (MIM1) \u2014 MIM has high upfront tooling cost; unit cost only becomes favorable at production volumes.\n  - Recommendation: Consider CNC or AM for low volumes; MIM best for stable designs at production scale.\n\n## Findings (MEDIUM)\n\n- **Turning: L/D ratio unknown (upload STEP for slenderness check)** (TURN1) \u2014 Slenderness strongly affects deflection and chatter risk in turning; without geometry metrics this cannot be assessed reliably.\n  - Recommendation: Upload a STEP model or provide key dimensions; confirm whether tailstock/steady rest will be used for slender parts.\n- **Low volume + casting (tooling risk)** (CAST1) \u2014 Casting has significant tooling cost; economics favor production runs.\n  - Recommendation: Consider CNC or AM for low volumes; casting best at production scale.\n- **Low volume + forging (tooling risk)** (FORG1) \u2014 Forging has significant die cost; economics favor production runs.\n  - Recommendation: Consider CNC or AM for low volumes; forging best at production scale.\n\n## Findings (LOW)\n\n_None_\n\n## Action Checklist\n\n- [ ] Confirm Schedule a shop manufacturability review using the STEP or provided dims to verify fixturing, workholding, and support strategy given Aluminum and Medium tolerance criticality.\n- [ ] Confirm Upload a STEP model or provide key dimensions; confirm whether tailstock/steady rest will be used for slender parts.\n- [ ] Consider CNC or AM for low volumes; casting best at production scale.\n- [ ] Verify Prepare a comparative manufacturability/cost/lead-time assessment for CNC vs AM vs casting/forging/MIM prior to any tooling commitment.\n- [ ] Address TURN1: Upload a STEP model or provide key dimensions; confirm whether tailstock/steady rest will be used for slender parts.\n- [ ] Address CAST1: Consider CNC or AM for low volumes; casting best at production scale.\n\n## Assumptions\n\n- No STEP model or key dimensions were provided; slenderness (L/D) is unknown and must be confirmed.\n- Tailstock/steady rest usage and specific fixturing strategy are not specified; decision is pending.\n- Production volume is prototyping (low-volume), so tooling ROI for casting/forging/MIM is assumed unfavorable for this phase.\n- Material is Aluminum but specific alloy and mechanical requirements were not given; assume typical machinable aluminum for process selection.\n\n## Usage (tokens & cost)\n\n- prompt_tokens: 624\n\n- completion_tokens: 1785\n\n- total_tokens: 2409\n\n- total_cost_usd: 0.0037259999999999997\n\n\n_Note: Cost is reported by the callback and depends on model pricing; verify for production._\n\n\n## LLM usage by node\n\n- explain: attempts=1, cache_hit=False, prompt_tokens=624, completion_tokens=1785, total_tokens=2409, total_cost_usd=0.0037259999999999997\n\n- rag: cache_hit=False, retrieved_k=5, sources_count=5\n\n- self_review: attempts=1, cache_hit=False\n\n\n## Sources used\n\n1. **cnc/cnc_fixturing_and_datums.md**\n\n   # CNC: Fixturing and Datum Strategy\n\nGood fixturing reduces setup count, improves accuracy, and lowers scrap risk.\n\n## Datum Selection Principles\n\n- Prefer large, flat, stable surfaces as primary datu...\n\n\n2. **cnc/cnc_axis_count_and_machine_selection.md**\n\n   # CNC: Axis Count and Machine Selection\n\nChoosing the right machine configuration affects cost and feasibility.\n\n## 3-Axis Machining\n\n- Lowest cost and most widely available\n- Limited to features acce...\n\n\n3. **cnc/cnc_threads_and_tapped_holes.md**\n\n   # CNC: Threads and Tapped Holes\n\nThreading is manufacturable, but small threads and deep threads increase risk and cost.\n\n## Thread Depth Guidance\n\n- Thread only as deep as needed\n- Typical guidance i...\n\n\n4. **cnc/cnc_wall_thickness.md**\n\n   # CNC: Wall Thickness and Chatter Risk\n\nThin walls reduce rigidity and can cause vibration (chatter), loss of accuracy, and breakthrough.\n\n## Minimum Wall Thickness (Vendor Guidance)\n\n- Metals: \u2265 0.03...\n\n\n5. **cnc/cnc_internal_radii_and_fillets.md**\n\n   # CNC: Internal Radii and Fillets (Tooling & Cycle-Time)\n\nInternal corners cannot be perfectly sharp in milling; tool radius dictates achievable geometry.\n\n## Inside Corner Fillets\n\n- Prefer larger in...\n\n\n\n## Agent confidence & limitations\n\n- **Score:** 0.56\n\n- **High confidence:** MIM tooling ROI is unfavorable for low-volume prototyping; No CAD prevents numeric slenderness checks\n\n- **Medium confidence:** Recommendations to consider CNC or AM for low volumes; Fixturing and workholding concerns based on provided fixturing RAG snippets\n\n- **Low confidence:** Specific steady-rest or tailstock requirements for turning; Exact manufacturability impact of unspecified Aluminum alloy\n\n- **Limitations:** STEP model not provided; Key dimensions missing; Alloy specification absent; Shop tooling/capabilities unspecified\n\n- **To improve:** Upload the STEP model (or provide full key dimensions: overall length, diameters, critical feature locations) to enable slenderness and fixturing analysis; Confirm whether tailstock or steady rest will be used and detail planned fixturing/workholding strategy; Specify Aluminum alloy and mechanical/tolerance requirements\n", "trace": "Run started\nInputs validated\nProcess selection node entered\nprocess_selection: gated_out process=INJECTION_MOLDING reason=polymer process\nprocess_selection: gated_out process=THERMOFORMING reason=polymer process\nprocess_selection: gated_out process=COMPRESSION_MOLDING reason=polymer process\nprocess_selection: eligible_processes=['AM', 'CASTING', 'CNC', 'CNC_TURNING', 'EXTRUSION', 'FORGING', 'MIM', 'SHEET_METAL']\nPSI: user_text_len=37 preview=\"turning lathe spindle chuck bar stock\"\nprocess_selection: scorer_path=legacy_bins cad_status=none\nPSI: score_diff=0 (primary=CNC_TURNING=5, second=CNC=5)\nPSI tie-break: prefer user-selected flexible process (CNC_TURNING) when score_diff <= 1 (compatible, no strong mismatch)\nProcess selection computed: primary=CNC_TURNING user_selected=CNC_TURNING\nprocess_selection: cad_uploaded=n evidence_available=n\nProcess selection: user_text keywords influenced scoring (Turning)\nrules: cad_uploaded=n cad_status=none evidence_keys=[]\nGenerated explanation via openai\nexplain: cache_hit=False key=9261d7e7 mode=bins provider=none\nexplain: polished checklist grammar and formatting\nAgent decision: enrich via RAG\nRAG triggered: HIGH severity findings\nEntered rag_node (process=CNC_TURNING, top_k=5)\nRAG: rag_user_text_normalized=\nPSI debug: primary=CNC_TURNING, user_selected=CNC_TURNING, extrusion_offer=no, mim_offer=no, thermo_offer=no, comp_offer=no, am_offer=no, hybrid_offer=no, main_index_used=cnc, offer_index_used=none, hybrid_primary_index_used=none, hybrid_secondary_index_used=none\nRAG: main_retrieve_index=cnc, offer_retrieve_index=none\nRAG: main_index_used=cnc\nRAG: retrieving from local cnc index\nRAG: sources_breakdown main=5 offer=0 hybrid_primary=0 hybrid_secondary=0\nRAG completed: retrieved 5 snippets (main_index_used=cnc)\nExplanation regenerated after RAG (via openai)\nexplain: cache_hit=False key=6b4f3501 mode=bins provider=none\nexplain: filled checklist from findings to reach 6 items\nexplain: polished checklist grammar and formatting\nAgent decision: accept (RAG already used; proceeding)\nself_review: confidence_base=0.71 source=deterministic\nself_review: cad_uploaded=n cad_status=none\nPerformed self-critique and confidence scoring\nself_review: flag_adjustments=missing_cad-0.05, geometry_uncertain-0.02, unknown_shop_constraints-0.02\nself_review: adjusted_base=0.62 llm_delta=-0.06 final=0.56\nreport: process_recommendation present=True primary=CNC_TURNING", "error": null, "case_id": "turn_01_turning_keywords"}}
