{"case_id": "sm1_bins_steel_small", "status": "pass", "result": {"primary": "SHEET_METAL", "secondary": ["CNC"], "eligible_processes": ["CNC", "CNC_TURNING", "AM", "SHEET_METAL", "CASTING", "FORGING", "EXTRUSION", "MIM"], "gated_out": ["COMPRESSION_MOLDING", "INJECTION_MOLDING", "THERMOFORMING"], "cad_lite_status": "ok", "extrusion_lite_status": "ok", "extrusion_likelihood_level": "low", "sheet_metal_likelihood_level": "high", "sheet_metal_likelihood_source": "cad_lite", "findings": [{"rule_id": "PASS1", "severity": "LOW", "process": null, "title": "Low feature variety (favorable for cycle time and tooling)"}, {"rule_id": "PASS2", "severity": "LOW", "process": null, "title": "Low accessibility risk (good tool access)"}, {"rule_id": "CAST1", "severity": "MEDIUM", "process": "CASTING", "title": "Low volume + casting (tooling risk)"}, {"rule_id": "FORG1", "severity": "MEDIUM", "process": "FORGING", "title": "Low volume + forging (tooling risk)"}, {"rule_id": "MIM1", "severity": "HIGH", "process": "MIM", "title": "Low volume + MIM (tooling ROI risk)"}, {"rule_id": "PSI1", "severity": "MEDIUM", "process": null, "title": "Selected process differs from recommended process"}], "top_priorities": ["PSI1", "PASS1", "PASS2"], "duration_ms": 234.43, "report": "# CNC Design Review + DFM Report\n\n## Input summary\n\n- Manufacturing process: CNC\n\n- Material: Steel\n- Production volume: Small batch\n- Load type: Static\n- Tolerance criticality: Medium\n\n- Part size: Medium\n- Min internal radius: Medium\n- Min wall thickness: Medium\n- Hole depth class: None\n- Pocket aspect class: OK\n- Feature variety: Low\n- Accessibility risk: Low\n- Has clamping faces: True\n\n\n## Process recommendation\n\n- Primary: **SHEET_METAL**\n\n- Secondary: CNC\n\n- Less suitable (given current inputs): AM, CASTING, FORGING, EXTRUSION, MIM\n\n- Not applicable (hard gated): INJECTION_MOLDING (polymer process), THERMOFORMING (polymer process), COMPRESSION_MOLDING (polymer process)\n\n- Tradeoffs:\n\n  - Tooling lead time vs unit cost: IM/Sheet metal need tooling; CNC/AM suit low volume.\n\n  - Tolerance and finish: Define critical interfaces; plan post-machining or inspection where needed.\n\n  - Risk drivers: Warpage (IM/AM), supports (AM), setups (CNC/Sheet metal) affect feasibility.\n\n  - Volume sensitivity: IM and sheet metal favor production runs; CNC/AM suit proto and small batch.\n\n  - Documentation: 2D drawing and scale confirmation improve tolerance and process selection.\n\n\n\n## Manufacturing confidence inputs\n\n- CAD uploaded: yes\n\n- CAD analysis status: none\n\n- CAD evidence used in rules: no\n\n- CAD Lite analysis: ok\n\n- Extrusion Lite analysis: ok\n\n- Extrusion likelihood: low (source=extrusion_lite)\n\n- Sheet metal likelihood: high (source=cad_lite)\n\n_Confidence inputs not provided._\n\n\n\n## Top priorities\n\n- [MEDIUM] Selected process differs from recommended process (PSI1)\n\n- [LOW] Low feature variety (favorable for cycle time and tooling) (PASS1)\n\n- [LOW] Low accessibility risk (good tool access) (PASS2)\n\n\n\n## Findings (HIGH)\n\n- **Low volume + MIM (tooling ROI risk)** (MIM1) \u2014 MIM has high upfront tooling cost; unit cost only becomes favorable at production volumes.\n  - Recommendation: Consider CNC or AM for low volumes; MIM best for stable designs at production scale.\n\n## Findings (MEDIUM)\n\n- **Low volume + casting (tooling risk)** (CAST1) \u2014 Casting has significant tooling cost; economics favor production runs.\n  - Recommendation: Consider CNC or AM for low volumes; casting best at production scale.\n- **Low volume + forging (tooling risk)** (FORG1) \u2014 Forging has significant die cost; economics favor production runs.\n  - Recommendation: Consider CNC or AM for low volumes; forging best at production scale.\n- **Selected process differs from recommended process** (PSI1) \u2014 Process selection intelligence recommends SHEET_METAL (score advantage: 3 points) over selected CNC. This may indicate suboptimal process choice for material, volume, or geometry.\n  - Recommendation: Consider SHEET_METAL, CNC as alternatives. Evaluate tradeoffs: tooling lead time vs unit cost, tolerance/finish requirements, and volume sensitivity.\n\n## Findings (LOW)\n\n- **Low feature variety (favorable for cycle time and tooling)** (PASS1) \u2014 Low complexity reduces cycle time and tooling risk.\n  - Recommendation: No change needed.\n- **Low accessibility risk (good tool access)** (PASS2) \u2014 Good tool access reduces setup and machining risk.\n  - Recommendation: No change needed.\n\n## Action Checklist\n\n- [ ] Address HIGH and MEDIUM findings before release.\n- [ ] Apply recommended design changes for critical features.\n- [ ] Re-verify tolerances and interfaces after changes.\n\n## Assumptions\n\n- Inputs and part summary reflect current design intent.\n- Manufacturing process and material choices are as specified.\n\n## Usage (tokens & cost)\n\n_Usage not available._\n\n\n## LLM usage by node\n\n_Not available._\n\n\n## Agent confidence & limitations\n\n_Not available._\n", "trace": "Run started\nInputs validated\nProcess selection node entered\nprocess_selection: eligible_processes=['AM', 'CASTING', 'CNC', 'CNC_TURNING', 'EXTRUSION', 'FORGING', 'MIM', 'SHEET_METAL']\nprocess_selection: gated_out=[('INJECTION_MOLDING', 'polymer process'), ('THERMOFORMING', 'polymer process'), ('COMPRESSION_MOLDING', 'polymer process')]\nPSI: user_text_len=0 preview=\"\"\nprocess_selection: cad_lite status=ok t_est=1.4457 av_ratio=1.3834 t_over_min_dim=0.0195\nprocess_selection: sheet_metal_likelihood=high (source=cad_lite)\nprocess_selection: extrusion_likelihood=low (coeff_var=0.287858 axis=X)\nprocess_selection: am_likelihood=low (source=bins_only)\nprocess_selection: scorer_path=legacy_bins cad_status=none\nPSI: score_diff=3 (primary=SHEET_METAL=6, second=CNC=3)\nProcess selection computed: primary=SHEET_METAL user_selected=CNC\nprocess_selection: cad_uploaded=y evidence_available=n\nProcess selection mismatch: user_selected=CNC but primary=SHEET_METAL\nProcess selection warning added: selected=CNC, recommended=SHEET_METAL\nrules: cad_uploaded=y cad_status=none evidence_keys=[]\nreport: process_recommendation present=True primary=SHEET_METAL", "error": null, "error_type": null, "state_has_error": false, "case_id": "sm1_bins_steel_small"}}
{"case_id": "sm2_bins_steel_small", "status": "pass", "result": {"primary": "SHEET_METAL", "secondary": [], "eligible_processes": ["CNC", "CNC_TURNING", "AM", "SHEET_METAL", "CASTING", "FORGING", "EXTRUSION", "MIM"], "gated_out": ["COMPRESSION_MOLDING", "INJECTION_MOLDING", "THERMOFORMING"], "cad_lite_status": "failed", "extrusion_lite_status": "failed", "extrusion_likelihood_level": "none", "sheet_metal_likelihood_level": "med", "sheet_metal_likelihood_source": "bins_only", "findings": [{"rule_id": "DFM4", "severity": "HIGH", "process": null, "title": "Thin walls (deflection during machining)"}, {"rule_id": "CAST1", "severity": "MEDIUM", "process": "CASTING", "title": "Low volume + casting (tooling risk)"}, {"rule_id": "FORG1", "severity": "MEDIUM", "process": "FORGING", "title": "Low volume + forging (tooling risk)"}, {"rule_id": "MIM1", "severity": "HIGH", "process": "MIM", "title": "Low volume + MIM (tooling ROI risk)"}, {"rule_id": "PSI1", "severity": "MEDIUM", "process": null, "title": "Selected process differs from recommended process"}], "top_priorities": ["DFM4", "PSI1"], "duration_ms": 101.55, "report": "# CNC Design Review + DFM Report\n\n## Input summary\n\n- Manufacturing process: CNC\n\n- Material: Steel\n- Production volume: Small batch\n- Load type: Static\n- Tolerance criticality: Medium\n\n- Part size: Medium\n- Min internal radius: Medium\n- Min wall thickness: Thin\n- Hole depth class: None\n- Pocket aspect class: OK\n- Feature variety: Low\n- Accessibility risk: Low\n- Has clamping faces: True\n\n\n## Process recommendation\n\n- Primary: **SHEET_METAL**\n\n- Secondary: None\n\n- Less suitable (given current inputs): AM, CASTING, FORGING, EXTRUSION, MIM\n\n- Not applicable (hard gated): INJECTION_MOLDING (polymer process), THERMOFORMING (polymer process), COMPRESSION_MOLDING (polymer process)\n\n- Tradeoffs:\n\n  - Tooling lead time vs unit cost: IM/Sheet metal need tooling; CNC/AM suit low volume.\n\n  - Tolerance and finish: Define critical interfaces; plan post-machining or inspection where needed.\n\n  - Risk drivers: Warpage (IM/AM), supports (AM), setups (CNC/Sheet metal) affect feasibility.\n\n  - Volume sensitivity: IM and sheet metal favor production runs; CNC/AM suit proto and small batch.\n\n  - Documentation: 2D drawing and scale confirmation improve tolerance and process selection.\n\n\n\n## Manufacturing confidence inputs\n\n- CAD uploaded: yes\n\n- CAD analysis status: none\n\n- CAD evidence used in rules: no\n\n- CAD Lite analysis: failed\n\n- Extrusion Lite analysis: failed\n\n- Extrusion likelihood: none (source=none)\n\n- Sheet metal likelihood: med (source=bins_only)\n\n_Confidence inputs not provided._\n\n\n\n## Top priorities\n\n- [HIGH] Thin walls (deflection during machining) (DFM4)\n\n- [MEDIUM] Selected process differs from recommended process (PSI1)\n\n\n\n## Findings (HIGH)\n\n- **Thin walls (deflection during machining)** (DFM4) \u2014 Thin walls can deflect during machining, causing poor surface finish and tolerance drift.\n  - Recommendation: Thicken walls, add ribs, or plan roughing/finishing strategy; avoid long unsupported spans.\n- **Low volume + MIM (tooling ROI risk)** (MIM1) \u2014 MIM has high upfront tooling cost; unit cost only becomes favorable at production volumes.\n  - Recommendation: Consider CNC or AM for low volumes; MIM best for stable designs at production scale.\n\n## Findings (MEDIUM)\n\n- **Low volume + casting (tooling risk)** (CAST1) \u2014 Casting has significant tooling cost; economics favor production runs.\n  - Recommendation: Consider CNC or AM for low volumes; casting best at production scale.\n- **Low volume + forging (tooling risk)** (FORG1) \u2014 Forging has significant die cost; economics favor production runs.\n  - Recommendation: Consider CNC or AM for low volumes; forging best at production scale.\n- **Selected process differs from recommended process** (PSI1) \u2014 Process selection intelligence recommends SHEET_METAL (score advantage: 8 points) over selected CNC. This may indicate suboptimal process choice for material, volume, or geometry.\n  - Recommendation: Consider SHEET_METAL as alternatives. Evaluate tradeoffs: tooling lead time vs unit cost, tolerance/finish requirements, and volume sensitivity.\n\n## Findings (LOW)\n\n_None_\n\n## Action Checklist\n\n- [ ] Address HIGH and MEDIUM findings before release.\n- [ ] Apply recommended design changes for critical features.\n- [ ] Re-verify tolerances and interfaces after changes.\n\n## Assumptions\n\n- Inputs and part summary reflect current design intent.\n- Manufacturing process and material choices are as specified.\n\n## Usage (tokens & cost)\n\n_Usage not available._\n\n\n## LLM usage by node\n\n_Not available._\n\n\n## Agent confidence & limitations\n\n_Not available._\n", "trace": "Run started\nInputs validated\nProcess selection node entered\nprocess_selection: eligible_processes=['AM', 'CASTING', 'CNC', 'CNC_TURNING', 'EXTRUSION', 'FORGING', 'MIM', 'SHEET_METAL']\nprocess_selection: gated_out=[('INJECTION_MOLDING', 'polymer process'), ('THERMOFORMING', 'polymer process'), ('COMPRESSION_MOLDING', 'polymer process')]\nPSI: user_text_len=0 preview=\"\"\nprocess_selection: cad_lite status=failed\nprocess_selection: sheet_metal_likelihood=med (source=bins_only)\nprocess_selection: extrusion_likelihood=none (coeff_var=? axis=?)\nprocess_selection: am_likelihood=low (source=bins_only)\nprocess_selection: bins_boost SHEET_METAL thin+metal +4\nprocess_selection: scorer_path=legacy_bins cad_status=none\nPSI: score_diff=8 (primary=SHEET_METAL=12, second=CNC=4)\nProcess selection computed: primary=SHEET_METAL user_selected=CNC\nprocess_selection: cad_uploaded=y evidence_available=n\nProcess selection mismatch: user_selected=CNC but primary=SHEET_METAL\nRule triggered: Thin walls (deflection during machining) \u2192 HIGH severity\nProcess selection warning added: selected=CNC, recommended=SHEET_METAL\nrules: cad_uploaded=y cad_status=none evidence_keys=[]\nreport: process_recommendation present=True primary=SHEET_METAL", "error": null, "error_type": null, "state_has_error": false, "case_id": "sm2_bins_steel_small"}}
{"case_id": "sm3_bins_steel_small", "status": "pass", "result": {"primary": "SHEET_METAL", "secondary": ["CNC"], "eligible_processes": ["CNC", "CNC_TURNING", "AM", "SHEET_METAL", "CASTING", "FORGING", "EXTRUSION", "MIM"], "gated_out": ["COMPRESSION_MOLDING", "INJECTION_MOLDING", "THERMOFORMING"], "cad_lite_status": "ok", "extrusion_lite_status": "ok", "extrusion_likelihood_level": "low", "sheet_metal_likelihood_level": "high", "sheet_metal_likelihood_source": "cad_lite", "findings": [{"rule_id": "PASS1", "severity": "LOW", "process": null, "title": "Low feature variety (favorable for cycle time and tooling)"}, {"rule_id": "PASS2", "severity": "LOW", "process": null, "title": "Low accessibility risk (good tool access)"}, {"rule_id": "CAST1", "severity": "MEDIUM", "process": "CASTING", "title": "Low volume + casting (tooling risk)"}, {"rule_id": "FORG1", "severity": "MEDIUM", "process": "FORGING", "title": "Low volume + forging (tooling risk)"}, {"rule_id": "MIM1", "severity": "HIGH", "process": "MIM", "title": "Low volume + MIM (tooling ROI risk)"}, {"rule_id": "PSI1", "severity": "MEDIUM", "process": null, "title": "Selected process differs from recommended process"}], "top_priorities": ["PSI1", "PASS1", "PASS2"], "duration_ms": 90.33, "report": "# CNC Design Review + DFM Report\n\n## Input summary\n\n- Manufacturing process: CNC\n\n- Material: Steel\n- Production volume: Small batch\n- Load type: Static\n- Tolerance criticality: Medium\n\n- Part size: Medium\n- Min internal radius: Medium\n- Min wall thickness: Medium\n- Hole depth class: None\n- Pocket aspect class: OK\n- Feature variety: Low\n- Accessibility risk: Low\n- Has clamping faces: True\n\n\n## Process recommendation\n\n- Primary: **SHEET_METAL**\n\n- Secondary: CNC\n\n- Less suitable (given current inputs): AM, CASTING, FORGING, EXTRUSION, MIM\n\n- Not applicable (hard gated): INJECTION_MOLDING (polymer process), THERMOFORMING (polymer process), COMPRESSION_MOLDING (polymer process)\n\n- Tradeoffs:\n\n  - Tooling lead time vs unit cost: IM/Sheet metal need tooling; CNC/AM suit low volume.\n\n  - Tolerance and finish: Define critical interfaces; plan post-machining or inspection where needed.\n\n  - Risk drivers: Warpage (IM/AM), supports (AM), setups (CNC/Sheet metal) affect feasibility.\n\n  - Volume sensitivity: IM and sheet metal favor production runs; CNC/AM suit proto and small batch.\n\n  - Documentation: 2D drawing and scale confirmation improve tolerance and process selection.\n\n\n\n## Manufacturing confidence inputs\n\n- CAD uploaded: yes\n\n- CAD analysis status: none\n\n- CAD evidence used in rules: no\n\n- CAD Lite analysis: ok\n\n- Extrusion Lite analysis: ok\n\n- Extrusion likelihood: low (source=extrusion_lite)\n\n- Sheet metal likelihood: high (source=cad_lite)\n\n_Confidence inputs not provided._\n\n\n\n## Top priorities\n\n- [MEDIUM] Selected process differs from recommended process (PSI1)\n\n- [LOW] Low feature variety (favorable for cycle time and tooling) (PASS1)\n\n- [LOW] Low accessibility risk (good tool access) (PASS2)\n\n\n\n## Findings (HIGH)\n\n- **Low volume + MIM (tooling ROI risk)** (MIM1) \u2014 MIM has high upfront tooling cost; unit cost only becomes favorable at production volumes.\n  - Recommendation: Consider CNC or AM for low volumes; MIM best for stable designs at production scale.\n\n## Findings (MEDIUM)\n\n- **Low volume + casting (tooling risk)** (CAST1) \u2014 Casting has significant tooling cost; economics favor production runs.\n  - Recommendation: Consider CNC or AM for low volumes; casting best at production scale.\n- **Low volume + forging (tooling risk)** (FORG1) \u2014 Forging has significant die cost; economics favor production runs.\n  - Recommendation: Consider CNC or AM for low volumes; forging best at production scale.\n- **Selected process differs from recommended process** (PSI1) \u2014 Process selection intelligence recommends SHEET_METAL (score advantage: 3 points) over selected CNC. This may indicate suboptimal process choice for material, volume, or geometry.\n  - Recommendation: Consider SHEET_METAL, CNC as alternatives. Evaluate tradeoffs: tooling lead time vs unit cost, tolerance/finish requirements, and volume sensitivity.\n\n## Findings (LOW)\n\n- **Low feature variety (favorable for cycle time and tooling)** (PASS1) \u2014 Low complexity reduces cycle time and tooling risk.\n  - Recommendation: No change needed.\n- **Low accessibility risk (good tool access)** (PASS2) \u2014 Good tool access reduces setup and machining risk.\n  - Recommendation: No change needed.\n\n## Action Checklist\n\n- [ ] Address HIGH and MEDIUM findings before release.\n- [ ] Apply recommended design changes for critical features.\n- [ ] Re-verify tolerances and interfaces after changes.\n\n## Assumptions\n\n- Inputs and part summary reflect current design intent.\n- Manufacturing process and material choices are as specified.\n\n## Usage (tokens & cost)\n\n_Usage not available._\n\n\n## LLM usage by node\n\n_Not available._\n\n\n## Agent confidence & limitations\n\n_Not available._\n", "trace": "Run started\nInputs validated\nProcess selection node entered\nprocess_selection: eligible_processes=['AM', 'CASTING', 'CNC', 'CNC_TURNING', 'EXTRUSION', 'FORGING', 'MIM', 'SHEET_METAL']\nprocess_selection: gated_out=[('INJECTION_MOLDING', 'polymer process'), ('THERMOFORMING', 'polymer process'), ('COMPRESSION_MOLDING', 'polymer process')]\nPSI: user_text_len=0 preview=\"\"\nprocess_selection: cad_lite status=ok t_est=2.9112 av_ratio=0.687 t_over_min_dim=0.0178\nprocess_selection: sheet_metal_likelihood=high (source=cad_lite)\nprocess_selection: extrusion_likelihood=low (coeff_var=0.171319 axis=Z)\nprocess_selection: am_likelihood=low (source=bins_only)\nprocess_selection: scorer_path=legacy_bins cad_status=none\nPSI: score_diff=3 (primary=SHEET_METAL=6, second=CNC=3)\nProcess selection computed: primary=SHEET_METAL user_selected=CNC\nprocess_selection: cad_uploaded=y evidence_available=n\nProcess selection mismatch: user_selected=CNC but primary=SHEET_METAL\nProcess selection warning added: selected=CNC, recommended=SHEET_METAL\nrules: cad_uploaded=y cad_status=none evidence_keys=[]\nreport: process_recommendation present=True primary=SHEET_METAL", "error": null, "error_type": null, "state_has_error": false, "case_id": "sm3_bins_steel_small"}}
{"case_id": "sm4_bins_steel_small", "status": "pass", "result": {"primary": "SHEET_METAL", "secondary": ["CNC"], "eligible_processes": ["CNC", "CNC_TURNING", "AM", "SHEET_METAL", "CASTING", "FORGING", "EXTRUSION", "MIM"], "gated_out": ["COMPRESSION_MOLDING", "INJECTION_MOLDING", "THERMOFORMING"], "cad_lite_status": "ok", "extrusion_lite_status": "ok", "extrusion_likelihood_level": "low", "sheet_metal_likelihood_level": "high", "sheet_metal_likelihood_source": "cad_lite", "findings": [{"rule_id": "PASS1", "severity": "LOW", "process": null, "title": "Low feature variety (favorable for cycle time and tooling)"}, {"rule_id": "PASS2", "severity": "LOW", "process": null, "title": "Low accessibility risk (good tool access)"}, {"rule_id": "CAST1", "severity": "MEDIUM", "process": "CASTING", "title": "Low volume + casting (tooling risk)"}, {"rule_id": "FORG1", "severity": "MEDIUM", "process": "FORGING", "title": "Low volume + forging (tooling risk)"}, {"rule_id": "MIM1", "severity": "HIGH", "process": "MIM", "title": "Low volume + MIM (tooling ROI risk)"}, {"rule_id": "PSI1", "severity": "MEDIUM", "process": null, "title": "Selected process differs from recommended process"}], "top_priorities": ["PSI1", "PASS1", "PASS2"], "duration_ms": 87.77, "report": "# CNC Design Review + DFM Report\n\n## Input summary\n\n- Manufacturing process: CNC\n\n- Material: Steel\n- Production volume: Small batch\n- Load type: Static\n- Tolerance criticality: Medium\n\n- Part size: Medium\n- Min internal radius: Medium\n- Min wall thickness: Medium\n- Hole depth class: None\n- Pocket aspect class: OK\n- Feature variety: Low\n- Accessibility risk: Low\n- Has clamping faces: True\n\n\n## Process recommendation\n\n- Primary: **SHEET_METAL**\n\n- Secondary: CNC\n\n- Less suitable (given current inputs): AM, CASTING, FORGING, EXTRUSION, MIM\n\n- Not applicable (hard gated): INJECTION_MOLDING (polymer process), THERMOFORMING (polymer process), COMPRESSION_MOLDING (polymer process)\n\n- Tradeoffs:\n\n  - Tooling lead time vs unit cost: IM/Sheet metal need tooling; CNC/AM suit low volume.\n\n  - Tolerance and finish: Define critical interfaces; plan post-machining or inspection where needed.\n\n  - Risk drivers: Warpage (IM/AM), supports (AM), setups (CNC/Sheet metal) affect feasibility.\n\n  - Volume sensitivity: IM and sheet metal favor production runs; CNC/AM suit proto and small batch.\n\n  - Documentation: 2D drawing and scale confirmation improve tolerance and process selection.\n\n\n\n## Manufacturing confidence inputs\n\n- CAD uploaded: yes\n\n- CAD analysis status: none\n\n- CAD evidence used in rules: no\n\n- CAD Lite analysis: ok\n\n- Extrusion Lite analysis: ok\n\n- Extrusion likelihood: low (source=extrusion_lite)\n\n- Sheet metal likelihood: high (source=cad_lite)\n\n_Confidence inputs not provided._\n\n\n\n## Top priorities\n\n- [MEDIUM] Selected process differs from recommended process (PSI1)\n\n- [LOW] Low feature variety (favorable for cycle time and tooling) (PASS1)\n\n- [LOW] Low accessibility risk (good tool access) (PASS2)\n\n\n\n## Findings (HIGH)\n\n- **Low volume + MIM (tooling ROI risk)** (MIM1) \u2014 MIM has high upfront tooling cost; unit cost only becomes favorable at production volumes.\n  - Recommendation: Consider CNC or AM for low volumes; MIM best for stable designs at production scale.\n\n## Findings (MEDIUM)\n\n- **Low volume + casting (tooling risk)** (CAST1) \u2014 Casting has significant tooling cost; economics favor production runs.\n  - Recommendation: Consider CNC or AM for low volumes; casting best at production scale.\n- **Low volume + forging (tooling risk)** (FORG1) \u2014 Forging has significant die cost; economics favor production runs.\n  - Recommendation: Consider CNC or AM for low volumes; forging best at production scale.\n- **Selected process differs from recommended process** (PSI1) \u2014 Process selection intelligence recommends SHEET_METAL (score advantage: 3 points) over selected CNC. This may indicate suboptimal process choice for material, volume, or geometry.\n  - Recommendation: Consider SHEET_METAL, CNC as alternatives. Evaluate tradeoffs: tooling lead time vs unit cost, tolerance/finish requirements, and volume sensitivity.\n\n## Findings (LOW)\n\n- **Low feature variety (favorable for cycle time and tooling)** (PASS1) \u2014 Low complexity reduces cycle time and tooling risk.\n  - Recommendation: No change needed.\n- **Low accessibility risk (good tool access)** (PASS2) \u2014 Good tool access reduces setup and machining risk.\n  - Recommendation: No change needed.\n\n## Action Checklist\n\n- [ ] Address HIGH and MEDIUM findings before release.\n- [ ] Apply recommended design changes for critical features.\n- [ ] Re-verify tolerances and interfaces after changes.\n\n## Assumptions\n\n- Inputs and part summary reflect current design intent.\n- Manufacturing process and material choices are as specified.\n\n## Usage (tokens & cost)\n\n_Usage not available._\n\n\n## LLM usage by node\n\n_Not available._\n\n\n## Agent confidence & limitations\n\n_Not available._\n", "trace": "Run started\nInputs validated\nProcess selection node entered\nprocess_selection: eligible_processes=['AM', 'CASTING', 'CNC', 'CNC_TURNING', 'EXTRUSION', 'FORGING', 'MIM', 'SHEET_METAL']\nprocess_selection: gated_out=[('INJECTION_MOLDING', 'polymer process'), ('THERMOFORMING', 'polymer process'), ('COMPRESSION_MOLDING', 'polymer process')]\nPSI: user_text_len=0 preview=\"\"\nprocess_selection: cad_lite status=ok t_est=1.1021 av_ratio=1.8147 t_over_min_dim=0.0367\nprocess_selection: sheet_metal_likelihood=high (source=cad_lite)\nprocess_selection: extrusion_likelihood=low (coeff_var=0.11134 axis=X)\nprocess_selection: am_likelihood=low (source=bins_only)\nprocess_selection: scorer_path=legacy_bins cad_status=none\nPSI: score_diff=3 (primary=SHEET_METAL=6, second=CNC=3)\nProcess selection computed: primary=SHEET_METAL user_selected=CNC\nprocess_selection: cad_uploaded=y evidence_available=n\nProcess selection mismatch: user_selected=CNC but primary=SHEET_METAL\nProcess selection warning added: selected=CNC, recommended=SHEET_METAL\nrules: cad_uploaded=y cad_status=none evidence_keys=[]\nreport: process_recommendation present=True primary=SHEET_METAL", "error": null, "error_type": null, "state_has_error": false, "case_id": "sm4_bins_steel_small"}}
{"case_id": "cnc1_bins_steel_small", "status": "pass", "result": {"primary": "CNC", "secondary": [], "eligible_processes": ["CNC", "CNC_TURNING", "AM", "SHEET_METAL", "CASTING", "FORGING", "EXTRUSION", "MIM"], "gated_out": ["COMPRESSION_MOLDING", "INJECTION_MOLDING", "THERMOFORMING"], "cad_lite_status": "ok", "extrusion_lite_status": "ok", "extrusion_likelihood_level": "low", "sheet_metal_likelihood_level": "med", "sheet_metal_likelihood_source": "cad_lite", "findings": [{"rule_id": "PASS1", "severity": "LOW", "process": null, "title": "Low feature variety (favorable for cycle time and tooling)"}, {"rule_id": "PASS2", "severity": "LOW", "process": null, "title": "Low accessibility risk (good tool access)"}, {"rule_id": "CAST1", "severity": "MEDIUM", "process": "CASTING", "title": "Low volume + casting (tooling risk)"}, {"rule_id": "FORG1", "severity": "MEDIUM", "process": "FORGING", "title": "Low volume + forging (tooling risk)"}, {"rule_id": "MIM1", "severity": "HIGH", "process": "MIM", "title": "Low volume + MIM (tooling ROI risk)"}], "top_priorities": ["PASS1", "PASS2"], "duration_ms": 87.69, "report": "# CNC Design Review + DFM Report\n\n## Input summary\n\n- Manufacturing process: CNC\n\n- Material: Steel\n- Production volume: Small batch\n- Load type: Static\n- Tolerance criticality: Medium\n\n- Part size: Medium\n- Min internal radius: Medium\n- Min wall thickness: Medium\n- Hole depth class: None\n- Pocket aspect class: OK\n- Feature variety: Low\n- Accessibility risk: Low\n- Has clamping faces: True\n\n\n## Process recommendation\n\n- Primary: **CNC**\n\n- Secondary: None\n\n- Less suitable (given current inputs): AM, CASTING, FORGING, EXTRUSION, MIM\n\n- Not applicable (hard gated): INJECTION_MOLDING (polymer process), THERMOFORMING (polymer process), COMPRESSION_MOLDING (polymer process)\n\n- Tradeoffs:\n\n  - Tooling lead time vs unit cost: IM/Sheet metal need tooling; CNC/AM suit low volume.\n\n  - Tolerance and finish: Define critical interfaces; plan post-machining or inspection where needed.\n\n  - Risk drivers: Warpage (IM/AM), supports (AM), setups (CNC/Sheet metal) affect feasibility.\n\n  - Volume sensitivity: IM and sheet metal favor production runs; CNC/AM suit proto and small batch.\n\n  - Documentation: 2D drawing and scale confirmation improve tolerance and process selection.\n\n\n\n## Manufacturing confidence inputs\n\n- CAD uploaded: yes\n\n- CAD analysis status: none\n\n- CAD evidence used in rules: no\n\n- CAD Lite analysis: ok\n\n- Extrusion Lite analysis: ok\n\n- Extrusion likelihood: low (source=extrusion_lite)\n\n- Sheet metal likelihood: med (source=cad_lite)\n\n_Confidence inputs not provided._\n\n\n\n## Top priorities\n\n- [LOW] Low feature variety (favorable for cycle time and tooling) (PASS1)\n\n- [LOW] Low accessibility risk (good tool access) (PASS2)\n\n\n\n## Findings (HIGH)\n\n- **Low volume + MIM (tooling ROI risk)** (MIM1) \u2014 MIM has high upfront tooling cost; unit cost only becomes favorable at production volumes.\n  - Recommendation: Consider CNC or AM for low volumes; MIM best for stable designs at production scale.\n\n## Findings (MEDIUM)\n\n- **Low volume + casting (tooling risk)** (CAST1) \u2014 Casting has significant tooling cost; economics favor production runs.\n  - Recommendation: Consider CNC or AM for low volumes; casting best at production scale.\n- **Low volume + forging (tooling risk)** (FORG1) \u2014 Forging has significant die cost; economics favor production runs.\n  - Recommendation: Consider CNC or AM for low volumes; forging best at production scale.\n\n## Findings (LOW)\n\n- **Low feature variety (favorable for cycle time and tooling)** (PASS1) \u2014 Low complexity reduces cycle time and tooling risk.\n  - Recommendation: No change needed.\n- **Low accessibility risk (good tool access)** (PASS2) \u2014 Good tool access reduces setup and machining risk.\n  - Recommendation: No change needed.\n\n## Action Checklist\n\n- [ ] Address HIGH and MEDIUM findings before release.\n- [ ] Apply recommended design changes for critical features.\n- [ ] Re-verify tolerances and interfaces after changes.\n\n## Assumptions\n\n- Inputs and part summary reflect current design intent.\n- Manufacturing process and material choices are as specified.\n\n## Usage (tokens & cost)\n\n_Usage not available._\n\n\n## LLM usage by node\n\n_Not available._\n\n\n## Agent confidence & limitations\n\n_Not available._\n", "trace": "Run started\nInputs validated\nProcess selection node entered\nprocess_selection: eligible_processes=['AM', 'CASTING', 'CNC', 'CNC_TURNING', 'EXTRUSION', 'FORGING', 'MIM', 'SHEET_METAL']\nprocess_selection: gated_out=[('INJECTION_MOLDING', 'polymer process'), ('THERMOFORMING', 'polymer process'), ('COMPRESSION_MOLDING', 'polymer process')]\nPSI: user_text_len=0 preview=\"\"\nprocess_selection: cad_lite status=ok t_est=13.4597 av_ratio=0.1486 t_over_min_dim=0.1869\nprocess_selection: sheet_metal_likelihood=med (source=cad_lite)\nprocess_selection: extrusion_likelihood=low (coeff_var=0.759286 axis=X)\nprocess_selection: am_likelihood=low (source=bins_only)\nprocess_selection: scorer_path=legacy_bins cad_status=none\nPSI: score_diff=2 (primary=CNC=5, second=SHEET_METAL=3)\nProcess selection computed: primary=CNC user_selected=CNC\nprocess_selection: cad_uploaded=y evidence_available=n\nrules: cad_uploaded=y cad_status=none evidence_keys=[]\nreport: process_recommendation present=True primary=CNC", "error": null, "error_type": null, "state_has_error": false, "case_id": "cnc1_bins_steel_small"}}
{"case_id": "cnc2_bins_steel_small", "status": "pass", "result": {"primary": "CNC", "secondary": [], "eligible_processes": ["CNC", "CNC_TURNING", "AM", "SHEET_METAL", "CASTING", "FORGING", "EXTRUSION", "MIM"], "gated_out": ["COMPRESSION_MOLDING", "INJECTION_MOLDING", "THERMOFORMING"], "cad_lite_status": "ok", "extrusion_lite_status": "ok", "extrusion_likelihood_level": "low", "sheet_metal_likelihood_level": "med", "sheet_metal_likelihood_source": "cad_lite", "findings": [{"rule_id": "PASS1", "severity": "LOW", "process": null, "title": "Low feature variety (favorable for cycle time and tooling)"}, {"rule_id": "PASS2", "severity": "LOW", "process": null, "title": "Low accessibility risk (good tool access)"}, {"rule_id": "CAST1", "severity": "MEDIUM", "process": "CASTING", "title": "Low volume + casting (tooling risk)"}, {"rule_id": "FORG1", "severity": "MEDIUM", "process": "FORGING", "title": "Low volume + forging (tooling risk)"}, {"rule_id": "MIM1", "severity": "HIGH", "process": "MIM", "title": "Low volume + MIM (tooling ROI risk)"}], "top_priorities": ["PASS1", "PASS2"], "duration_ms": 92.06, "report": "# CNC Design Review + DFM Report\n\n## Input summary\n\n- Manufacturing process: CNC\n\n- Material: Steel\n- Production volume: Small batch\n- Load type: Static\n- Tolerance criticality: Medium\n\n- Part size: Medium\n- Min internal radius: Medium\n- Min wall thickness: Medium\n- Hole depth class: None\n- Pocket aspect class: OK\n- Feature variety: Low\n- Accessibility risk: Low\n- Has clamping faces: True\n\n\n## Process recommendation\n\n- Primary: **CNC**\n\n- Secondary: None\n\n- Less suitable (given current inputs): AM, CASTING, FORGING, EXTRUSION, MIM\n\n- Not applicable (hard gated): INJECTION_MOLDING (polymer process), THERMOFORMING (polymer process), COMPRESSION_MOLDING (polymer process)\n\n- Tradeoffs:\n\n  - Tooling lead time vs unit cost: IM/Sheet metal need tooling; CNC/AM suit low volume.\n\n  - Tolerance and finish: Define critical interfaces; plan post-machining or inspection where needed.\n\n  - Risk drivers: Warpage (IM/AM), supports (AM), setups (CNC/Sheet metal) affect feasibility.\n\n  - Volume sensitivity: IM and sheet metal favor production runs; CNC/AM suit proto and small batch.\n\n  - Documentation: 2D drawing and scale confirmation improve tolerance and process selection.\n\n\n\n## Manufacturing confidence inputs\n\n- CAD uploaded: yes\n\n- CAD analysis status: none\n\n- CAD evidence used in rules: no\n\n- CAD Lite analysis: ok\n\n- Extrusion Lite analysis: ok\n\n- Extrusion likelihood: low (source=extrusion_lite)\n\n- Sheet metal likelihood: med (source=cad_lite)\n\n_Confidence inputs not provided._\n\n\n\n## Top priorities\n\n- [LOW] Low feature variety (favorable for cycle time and tooling) (PASS1)\n\n- [LOW] Low accessibility risk (good tool access) (PASS2)\n\n\n\n## Findings (HIGH)\n\n- **Low volume + MIM (tooling ROI risk)** (MIM1) \u2014 MIM has high upfront tooling cost; unit cost only becomes favorable at production volumes.\n  - Recommendation: Consider CNC or AM for low volumes; MIM best for stable designs at production scale.\n\n## Findings (MEDIUM)\n\n- **Low volume + casting (tooling risk)** (CAST1) \u2014 Casting has significant tooling cost; economics favor production runs.\n  - Recommendation: Consider CNC or AM for low volumes; casting best at production scale.\n- **Low volume + forging (tooling risk)** (FORG1) \u2014 Forging has significant die cost; economics favor production runs.\n  - Recommendation: Consider CNC or AM for low volumes; forging best at production scale.\n\n## Findings (LOW)\n\n- **Low feature variety (favorable for cycle time and tooling)** (PASS1) \u2014 Low complexity reduces cycle time and tooling risk.\n  - Recommendation: No change needed.\n- **Low accessibility risk (good tool access)** (PASS2) \u2014 Good tool access reduces setup and machining risk.\n  - Recommendation: No change needed.\n\n## Action Checklist\n\n- [ ] Address HIGH and MEDIUM findings before release.\n- [ ] Apply recommended design changes for critical features.\n- [ ] Re-verify tolerances and interfaces after changes.\n\n## Assumptions\n\n- Inputs and part summary reflect current design intent.\n- Manufacturing process and material choices are as specified.\n\n## Usage (tokens & cost)\n\n_Usage not available._\n\n\n## LLM usage by node\n\n_Not available._\n\n\n## Agent confidence & limitations\n\n_Not available._\n", "trace": "Run started\nInputs validated\nProcess selection node entered\nprocess_selection: eligible_processes=['AM', 'CASTING', 'CNC', 'CNC_TURNING', 'EXTRUSION', 'FORGING', 'MIM', 'SHEET_METAL']\nprocess_selection: gated_out=[('INJECTION_MOLDING', 'polymer process'), ('THERMOFORMING', 'polymer process'), ('COMPRESSION_MOLDING', 'polymer process')]\nPSI: user_text_len=0 preview=\"\"\nprocess_selection: cad_lite status=ok t_est=8.5037 av_ratio=0.2352 t_over_min_dim=0.0945\nprocess_selection: sheet_metal_likelihood=med (source=cad_lite)\nprocess_selection: extrusion_likelihood=low (coeff_var=0.644099 axis=Z)\nprocess_selection: am_likelihood=low (source=bins_only)\nprocess_selection: scorer_path=legacy_bins cad_status=none\nPSI: score_diff=2 (primary=CNC=5, second=SHEET_METAL=3)\nProcess selection computed: primary=CNC user_selected=CNC\nprocess_selection: cad_uploaded=y evidence_available=n\nrules: cad_uploaded=y cad_status=none evidence_keys=[]\nreport: process_recommendation present=True primary=CNC", "error": null, "error_type": null, "state_has_error": false, "case_id": "cnc2_bins_steel_small"}}
{"case_id": "cnc3_bins_steel_small", "status": "pass", "result": {"primary": "CNC", "secondary": [], "eligible_processes": ["CNC", "CNC_TURNING", "AM", "SHEET_METAL", "CASTING", "FORGING", "EXTRUSION", "MIM"], "gated_out": ["COMPRESSION_MOLDING", "INJECTION_MOLDING", "THERMOFORMING"], "cad_lite_status": "ok", "extrusion_lite_status": "ok", "extrusion_likelihood_level": "low", "sheet_metal_likelihood_level": "med", "sheet_metal_likelihood_source": "cad_lite", "findings": [{"rule_id": "PASS1", "severity": "LOW", "process": null, "title": "Low feature variety (favorable for cycle time and tooling)"}, {"rule_id": "PASS2", "severity": "LOW", "process": null, "title": "Low accessibility risk (good tool access)"}, {"rule_id": "CAST1", "severity": "MEDIUM", "process": "CASTING", "title": "Low volume + casting (tooling risk)"}, {"rule_id": "FORG1", "severity": "MEDIUM", "process": "FORGING", "title": "Low volume + forging (tooling risk)"}, {"rule_id": "MIM1", "severity": "HIGH", "process": "MIM", "title": "Low volume + MIM (tooling ROI risk)"}], "top_priorities": ["PASS1", "PASS2"], "duration_ms": 93.71, "report": "# CNC Design Review + DFM Report\n\n## Input summary\n\n- Manufacturing process: CNC\n\n- Material: Steel\n- Production volume: Small batch\n- Load type: Static\n- Tolerance criticality: Medium\n\n- Part size: Medium\n- Min internal radius: Medium\n- Min wall thickness: Medium\n- Hole depth class: None\n- Pocket aspect class: OK\n- Feature variety: Low\n- Accessibility risk: Low\n- Has clamping faces: True\n\n\n## Process recommendation\n\n- Primary: **CNC**\n\n- Secondary: None\n\n- Less suitable (given current inputs): AM, CASTING, FORGING, EXTRUSION, MIM\n\n- Not applicable (hard gated): INJECTION_MOLDING (polymer process), THERMOFORMING (polymer process), COMPRESSION_MOLDING (polymer process)\n\n- Tradeoffs:\n\n  - Tooling lead time vs unit cost: IM/Sheet metal need tooling; CNC/AM suit low volume.\n\n  - Tolerance and finish: Define critical interfaces; plan post-machining or inspection where needed.\n\n  - Risk drivers: Warpage (IM/AM), supports (AM), setups (CNC/Sheet metal) affect feasibility.\n\n  - Volume sensitivity: IM and sheet metal favor production runs; CNC/AM suit proto and small batch.\n\n  - Documentation: 2D drawing and scale confirmation improve tolerance and process selection.\n\n\n\n## Manufacturing confidence inputs\n\n- CAD uploaded: yes\n\n- CAD analysis status: none\n\n- CAD evidence used in rules: no\n\n- CAD Lite analysis: ok\n\n- Extrusion Lite analysis: ok\n\n- Extrusion likelihood: low (source=extrusion_lite)\n\n- Sheet metal likelihood: med (source=cad_lite)\n\n_Confidence inputs not provided._\n\n\n\n## Top priorities\n\n- [LOW] Low feature variety (favorable for cycle time and tooling) (PASS1)\n\n- [LOW] Low accessibility risk (good tool access) (PASS2)\n\n\n\n## Findings (HIGH)\n\n- **Low volume + MIM (tooling ROI risk)** (MIM1) \u2014 MIM has high upfront tooling cost; unit cost only becomes favorable at production volumes.\n  - Recommendation: Consider CNC or AM for low volumes; MIM best for stable designs at production scale.\n\n## Findings (MEDIUM)\n\n- **Low volume + casting (tooling risk)** (CAST1) \u2014 Casting has significant tooling cost; economics favor production runs.\n  - Recommendation: Consider CNC or AM for low volumes; casting best at production scale.\n- **Low volume + forging (tooling risk)** (FORG1) \u2014 Forging has significant die cost; economics favor production runs.\n  - Recommendation: Consider CNC or AM for low volumes; forging best at production scale.\n\n## Findings (LOW)\n\n- **Low feature variety (favorable for cycle time and tooling)** (PASS1) \u2014 Low complexity reduces cycle time and tooling risk.\n  - Recommendation: No change needed.\n- **Low accessibility risk (good tool access)** (PASS2) \u2014 Good tool access reduces setup and machining risk.\n  - Recommendation: No change needed.\n\n## Action Checklist\n\n- [ ] Address HIGH and MEDIUM findings before release.\n- [ ] Apply recommended design changes for critical features.\n- [ ] Re-verify tolerances and interfaces after changes.\n\n## Assumptions\n\n- Inputs and part summary reflect current design intent.\n- Manufacturing process and material choices are as specified.\n\n## Usage (tokens & cost)\n\n_Usage not available._\n\n\n## LLM usage by node\n\n_Not available._\n\n\n## Agent confidence & limitations\n\n_Not available._\n", "trace": "Run started\nInputs validated\nProcess selection node entered\nprocess_selection: eligible_processes=['AM', 'CASTING', 'CNC', 'CNC_TURNING', 'EXTRUSION', 'FORGING', 'MIM', 'SHEET_METAL']\nprocess_selection: gated_out=[('INJECTION_MOLDING', 'polymer process'), ('THERMOFORMING', 'polymer process'), ('COMPRESSION_MOLDING', 'polymer process')]\nPSI: user_text_len=0 preview=\"\"\nprocess_selection: cad_lite status=ok t_est=5.2318 av_ratio=0.3823 t_over_min_dim=0.2754\nprocess_selection: sheet_metal_likelihood=med (source=cad_lite)\nprocess_selection: extrusion_likelihood=low (coeff_var=0.328631 axis=X)\nprocess_selection: am_likelihood=low (source=bins_only)\nprocess_selection: scorer_path=legacy_bins cad_status=none\nPSI: score_diff=2 (primary=CNC=5, second=SHEET_METAL=3)\nProcess selection computed: primary=CNC user_selected=CNC\nprocess_selection: cad_uploaded=y evidence_available=n\nrules: cad_uploaded=y cad_status=none evidence_keys=[]\nreport: process_recommendation present=True primary=CNC", "error": null, "error_type": null, "state_has_error": false, "case_id": "cnc3_bins_steel_small"}}
{"case_id": "cnc4_bins_steel_small", "status": "pass", "result": {"primary": "CNC", "secondary": [], "eligible_processes": ["CNC", "CNC_TURNING", "AM", "SHEET_METAL", "CASTING", "FORGING", "EXTRUSION", "MIM"], "gated_out": ["COMPRESSION_MOLDING", "INJECTION_MOLDING", "THERMOFORMING"], "cad_lite_status": "failed", "extrusion_lite_status": "failed", "extrusion_likelihood_level": "none", "sheet_metal_likelihood_level": "low", "sheet_metal_likelihood_source": "none", "findings": [{"rule_id": "PASS1", "severity": "LOW", "process": null, "title": "Low feature variety (favorable for cycle time and tooling)"}, {"rule_id": "PASS2", "severity": "LOW", "process": null, "title": "Low accessibility risk (good tool access)"}, {"rule_id": "CAST1", "severity": "MEDIUM", "process": "CASTING", "title": "Low volume + casting (tooling risk)"}, {"rule_id": "FORG1", "severity": "MEDIUM", "process": "FORGING", "title": "Low volume + forging (tooling risk)"}, {"rule_id": "MIM1", "severity": "HIGH", "process": "MIM", "title": "Low volume + MIM (tooling ROI risk)"}], "top_priorities": ["PASS1", "PASS2"], "duration_ms": 89.64, "report": "# CNC Design Review + DFM Report\n\n## Input summary\n\n- Manufacturing process: CNC\n\n- Material: Steel\n- Production volume: Small batch\n- Load type: Static\n- Tolerance criticality: Medium\n\n- Part size: Medium\n- Min internal radius: Medium\n- Min wall thickness: Medium\n- Hole depth class: None\n- Pocket aspect class: OK\n- Feature variety: Low\n- Accessibility risk: Low\n- Has clamping faces: True\n\n\n## Process recommendation\n\n- Primary: **CNC**\n\n- Secondary: None\n\n- Less suitable (given current inputs): AM, SHEET_METAL, CASTING, FORGING, EXTRUSION, MIM\n\n- Not applicable (hard gated): INJECTION_MOLDING (polymer process), THERMOFORMING (polymer process), COMPRESSION_MOLDING (polymer process)\n\n- Tradeoffs:\n\n  - Tooling lead time vs unit cost: IM/Sheet metal need tooling; CNC/AM suit low volume.\n\n  - Tolerance and finish: Define critical interfaces; plan post-machining or inspection where needed.\n\n  - Risk drivers: Warpage (IM/AM), supports (AM), setups (CNC/Sheet metal) affect feasibility.\n\n  - Volume sensitivity: IM and sheet metal favor production runs; CNC/AM suit proto and small batch.\n\n  - Documentation: 2D drawing and scale confirmation improve tolerance and process selection.\n\n\n\n## Manufacturing confidence inputs\n\n- CAD uploaded: yes\n\n- CAD analysis status: none\n\n- CAD evidence used in rules: no\n\n- CAD Lite analysis: failed\n\n- Extrusion Lite analysis: failed\n\n- Extrusion likelihood: none (source=none)\n\n- Sheet metal likelihood: low (source=none)\n\n_Confidence inputs not provided._\n\n\n\n## Top priorities\n\n- [LOW] Low feature variety (favorable for cycle time and tooling) (PASS1)\n\n- [LOW] Low accessibility risk (good tool access) (PASS2)\n\n\n\n## Findings (HIGH)\n\n- **Low volume + MIM (tooling ROI risk)** (MIM1) \u2014 MIM has high upfront tooling cost; unit cost only becomes favorable at production volumes.\n  - Recommendation: Consider CNC or AM for low volumes; MIM best for stable designs at production scale.\n\n## Findings (MEDIUM)\n\n- **Low volume + casting (tooling risk)** (CAST1) \u2014 Casting has significant tooling cost; economics favor production runs.\n  - Recommendation: Consider CNC or AM for low volumes; casting best at production scale.\n- **Low volume + forging (tooling risk)** (FORG1) \u2014 Forging has significant die cost; economics favor production runs.\n  - Recommendation: Consider CNC or AM for low volumes; forging best at production scale.\n\n## Findings (LOW)\n\n- **Low feature variety (favorable for cycle time and tooling)** (PASS1) \u2014 Low complexity reduces cycle time and tooling risk.\n  - Recommendation: No change needed.\n- **Low accessibility risk (good tool access)** (PASS2) \u2014 Good tool access reduces setup and machining risk.\n  - Recommendation: No change needed.\n\n## Action Checklist\n\n- [ ] Address HIGH and MEDIUM findings before release.\n- [ ] Apply recommended design changes for critical features.\n- [ ] Re-verify tolerances and interfaces after changes.\n\n## Assumptions\n\n- Inputs and part summary reflect current design intent.\n- Manufacturing process and material choices are as specified.\n\n## Usage (tokens & cost)\n\n_Usage not available._\n\n\n## LLM usage by node\n\n_Not available._\n\n\n## Agent confidence & limitations\n\n_Not available._\n", "trace": "Run started\nInputs validated\nProcess selection node entered\nprocess_selection: eligible_processes=['AM', 'CASTING', 'CNC', 'CNC_TURNING', 'EXTRUSION', 'FORGING', 'MIM', 'SHEET_METAL']\nprocess_selection: gated_out=[('INJECTION_MOLDING', 'polymer process'), ('THERMOFORMING', 'polymer process'), ('COMPRESSION_MOLDING', 'polymer process')]\nPSI: user_text_len=0 preview=\"\"\nprocess_selection: cad_lite status=failed\nprocess_selection: sheet_metal_likelihood=low (source=none)\nprocess_selection: extrusion_likelihood=none (coeff_var=? axis=?)\nprocess_selection: am_likelihood=low (source=bins_only)\nprocess_selection: scorer_path=legacy_bins cad_status=none\nPSI: score_diff=4 (primary=CNC=5, second=CNC_TURNING=1)\nProcess selection computed: primary=CNC user_selected=CNC\nprocess_selection: cad_uploaded=y evidence_available=n\nrules: cad_uploaded=y cad_status=none evidence_keys=[]\nreport: process_recommendation present=True primary=CNC", "error": null, "error_type": null, "state_has_error": false, "case_id": "cnc4_bins_steel_small"}}
{"case_id": "turning1_bins_steel", "status": "pass", "result": {"primary": "CNC", "secondary": ["AM"], "eligible_processes": ["CNC", "CNC_TURNING", "AM", "SHEET_METAL", "CASTING", "FORGING", "EXTRUSION", "MIM"], "gated_out": ["COMPRESSION_MOLDING", "INJECTION_MOLDING", "THERMOFORMING"], "cad_lite_status": "ok", "extrusion_lite_status": "ok", "extrusion_likelihood_level": "low", "sheet_metal_likelihood_level": "med", "sheet_metal_likelihood_source": "cad_lite", "findings": [{"rule_id": "PASS1", "severity": "LOW", "process": null, "title": "Low feature variety (favorable for cycle time and tooling)"}, {"rule_id": "PASS2", "severity": "LOW", "process": null, "title": "Low accessibility risk (good tool access)"}, {"rule_id": "CAST1", "severity": "MEDIUM", "process": "CASTING", "title": "Low volume + casting (tooling risk)"}, {"rule_id": "FORG1", "severity": "MEDIUM", "process": "FORGING", "title": "Low volume + forging (tooling risk)"}, {"rule_id": "MIM1", "severity": "HIGH", "process": "MIM", "title": "Low volume + MIM (tooling ROI risk)"}], "top_priorities": ["PASS1", "PASS2"], "duration_ms": 93.22, "report": "# CNC Design Review + DFM Report\n\n## Input summary\n\n- Manufacturing process: CNC\n\n- Material: Steel\n- Production volume: Proto\n- Load type: Static\n- Tolerance criticality: Medium\n\n- Part size: Medium\n- Min internal radius: Medium\n- Min wall thickness: Medium\n- Hole depth class: None\n- Pocket aspect class: OK\n- Feature variety: Low\n- Accessibility risk: Low\n- Has clamping faces: True\n\n\n## Process recommendation\n\n- Primary: **CNC**\n\n- Secondary: AM\n\n- Less suitable (given current inputs): CASTING, FORGING, EXTRUSION, MIM\n\n- Not applicable (hard gated): INJECTION_MOLDING (polymer process), THERMOFORMING (polymer process), COMPRESSION_MOLDING (polymer process)\n\n- Tradeoffs:\n\n  - Tooling lead time vs unit cost: IM/Sheet metal need tooling; CNC/AM suit low volume.\n\n  - Tolerance and finish: Define critical interfaces; plan post-machining or inspection where needed.\n\n  - Risk drivers: Warpage (IM/AM), supports (AM), setups (CNC/Sheet metal) affect feasibility.\n\n  - Volume sensitivity: IM and sheet metal favor production runs; CNC/AM suit proto and small batch.\n\n  - Documentation: 2D drawing and scale confirmation improve tolerance and process selection.\n\n\n\n## Manufacturing confidence inputs\n\n- CAD uploaded: yes\n\n- CAD analysis status: none\n\n- CAD evidence used in rules: no\n\n- CAD Lite analysis: ok\n\n- Extrusion Lite analysis: ok\n\n- Extrusion likelihood: low (source=extrusion_lite)\n\n- Sheet metal likelihood: med (source=cad_lite)\n\n_Confidence inputs not provided._\n\n\n\n## Top priorities\n\n- [LOW] Low feature variety (favorable for cycle time and tooling) (PASS1)\n\n- [LOW] Low accessibility risk (good tool access) (PASS2)\n\n\n\n## Findings (HIGH)\n\n- **Low volume + MIM (tooling ROI risk)** (MIM1) \u2014 MIM has high upfront tooling cost; unit cost only becomes favorable at production volumes.\n  - Recommendation: Consider CNC or AM for low volumes; MIM best for stable designs at production scale.\n\n## Findings (MEDIUM)\n\n- **Low volume + casting (tooling risk)** (CAST1) \u2014 Casting has significant tooling cost; economics favor production runs.\n  - Recommendation: Consider CNC or AM for low volumes; casting best at production scale.\n- **Low volume + forging (tooling risk)** (FORG1) \u2014 Forging has significant die cost; economics favor production runs.\n  - Recommendation: Consider CNC or AM for low volumes; forging best at production scale.\n\n## Findings (LOW)\n\n- **Low feature variety (favorable for cycle time and tooling)** (PASS1) \u2014 Low complexity reduces cycle time and tooling risk.\n  - Recommendation: No change needed.\n- **Low accessibility risk (good tool access)** (PASS2) \u2014 Good tool access reduces setup and machining risk.\n  - Recommendation: No change needed.\n\n## Action Checklist\n\n- [ ] Address HIGH and MEDIUM findings before release.\n- [ ] Apply recommended design changes for critical features.\n- [ ] Re-verify tolerances and interfaces after changes.\n\n## Assumptions\n\n- Inputs and part summary reflect current design intent.\n- Manufacturing process and material choices are as specified.\n\n## Usage (tokens & cost)\n\n_Usage not available._\n\n\n## LLM usage by node\n\n_Not available._\n\n\n## Agent confidence & limitations\n\n_Not available._\n", "trace": "Run started\nInputs validated\nProcess selection node entered\nprocess_selection: eligible_processes=['AM', 'CASTING', 'CNC', 'CNC_TURNING', 'EXTRUSION', 'FORGING', 'MIM', 'SHEET_METAL']\nprocess_selection: gated_out=[('INJECTION_MOLDING', 'polymer process'), ('THERMOFORMING', 'polymer process'), ('COMPRESSION_MOLDING', 'polymer process')]\nPSI: user_text_len=0 preview=\"\"\nprocess_selection: cad_lite status=ok t_est=6.9762 av_ratio=0.2867 t_over_min_dim=0.2325\nprocess_selection: sheet_metal_likelihood=med (source=cad_lite)\nprocess_selection: extrusion_likelihood=low (coeff_var=0.235114 axis=X)\nprocess_selection: am_likelihood=low (source=bins_only)\nprocess_selection: scorer_path=legacy_bins cad_status=none\nPSI: score_diff=2 (primary=CNC=5, second=SHEET_METAL=3)\nProcess selection computed: primary=CNC user_selected=CNC\nprocess_selection: cad_uploaded=y evidence_available=n\nrules: cad_uploaded=y cad_status=none evidence_keys=[]\nreport: process_recommendation present=True primary=CNC", "error": null, "error_type": null, "state_has_error": false, "case_id": "turning1_bins_steel"}}
{"case_id": "turning2_bins_steel", "status": "pass", "result": {"primary": "CNC", "secondary": ["AM"], "eligible_processes": ["CNC", "CNC_TURNING", "AM", "SHEET_METAL", "CASTING", "FORGING", "EXTRUSION", "MIM"], "gated_out": ["COMPRESSION_MOLDING", "INJECTION_MOLDING", "THERMOFORMING"], "cad_lite_status": "failed", "extrusion_lite_status": "failed", "extrusion_likelihood_level": "none", "sheet_metal_likelihood_level": "low", "sheet_metal_likelihood_source": "none", "findings": [{"rule_id": "PASS1", "severity": "LOW", "process": null, "title": "Low feature variety (favorable for cycle time and tooling)"}, {"rule_id": "PASS2", "severity": "LOW", "process": null, "title": "Low accessibility risk (good tool access)"}, {"rule_id": "CAST1", "severity": "MEDIUM", "process": "CASTING", "title": "Low volume + casting (tooling risk)"}, {"rule_id": "FORG1", "severity": "MEDIUM", "process": "FORGING", "title": "Low volume + forging (tooling risk)"}, {"rule_id": "MIM1", "severity": "HIGH", "process": "MIM", "title": "Low volume + MIM (tooling ROI risk)"}], "top_priorities": ["PASS1", "PASS2"], "duration_ms": 90.1, "report": "# CNC Design Review + DFM Report\n\n## Input summary\n\n- Manufacturing process: CNC\n\n- Material: Steel\n- Production volume: Proto\n- Load type: Static\n- Tolerance criticality: Medium\n\n- Part size: Medium\n- Min internal radius: Medium\n- Min wall thickness: Medium\n- Hole depth class: None\n- Pocket aspect class: OK\n- Feature variety: Low\n- Accessibility risk: Low\n- Has clamping faces: True\n\n\n## Process recommendation\n\n- Primary: **CNC**\n\n- Secondary: AM\n\n- Less suitable (given current inputs): SHEET_METAL, CASTING, FORGING, EXTRUSION, MIM\n\n- Not applicable (hard gated): INJECTION_MOLDING (polymer process), THERMOFORMING (polymer process), COMPRESSION_MOLDING (polymer process)\n\n- Tradeoffs:\n\n  - Tooling lead time vs unit cost: IM/Sheet metal need tooling; CNC/AM suit low volume.\n\n  - Tolerance and finish: Define critical interfaces; plan post-machining or inspection where needed.\n\n  - Risk drivers: Warpage (IM/AM), supports (AM), setups (CNC/Sheet metal) affect feasibility.\n\n  - Volume sensitivity: IM and sheet metal favor production runs; CNC/AM suit proto and small batch.\n\n  - Documentation: 2D drawing and scale confirmation improve tolerance and process selection.\n\n\n\n## Manufacturing confidence inputs\n\n- CAD uploaded: yes\n\n- CAD analysis status: none\n\n- CAD evidence used in rules: no\n\n- CAD Lite analysis: failed\n\n- Extrusion Lite analysis: failed\n\n- Extrusion likelihood: none (source=none)\n\n- Sheet metal likelihood: low (source=none)\n\n_Confidence inputs not provided._\n\n\n\n## Top priorities\n\n- [LOW] Low feature variety (favorable for cycle time and tooling) (PASS1)\n\n- [LOW] Low accessibility risk (good tool access) (PASS2)\n\n\n\n## Findings (HIGH)\n\n- **Low volume + MIM (tooling ROI risk)** (MIM1) \u2014 MIM has high upfront tooling cost; unit cost only becomes favorable at production volumes.\n  - Recommendation: Consider CNC or AM for low volumes; MIM best for stable designs at production scale.\n\n## Findings (MEDIUM)\n\n- **Low volume + casting (tooling risk)** (CAST1) \u2014 Casting has significant tooling cost; economics favor production runs.\n  - Recommendation: Consider CNC or AM for low volumes; casting best at production scale.\n- **Low volume + forging (tooling risk)** (FORG1) \u2014 Forging has significant die cost; economics favor production runs.\n  - Recommendation: Consider CNC or AM for low volumes; forging best at production scale.\n\n## Findings (LOW)\n\n- **Low feature variety (favorable for cycle time and tooling)** (PASS1) \u2014 Low complexity reduces cycle time and tooling risk.\n  - Recommendation: No change needed.\n- **Low accessibility risk (good tool access)** (PASS2) \u2014 Good tool access reduces setup and machining risk.\n  - Recommendation: No change needed.\n\n## Action Checklist\n\n- [ ] Address HIGH and MEDIUM findings before release.\n- [ ] Apply recommended design changes for critical features.\n- [ ] Re-verify tolerances and interfaces after changes.\n\n## Assumptions\n\n- Inputs and part summary reflect current design intent.\n- Manufacturing process and material choices are as specified.\n\n## Usage (tokens & cost)\n\n_Usage not available._\n\n\n## LLM usage by node\n\n_Not available._\n\n\n## Agent confidence & limitations\n\n_Not available._\n", "trace": "Run started\nInputs validated\nProcess selection node entered\nprocess_selection: eligible_processes=['AM', 'CASTING', 'CNC', 'CNC_TURNING', 'EXTRUSION', 'FORGING', 'MIM', 'SHEET_METAL']\nprocess_selection: gated_out=[('INJECTION_MOLDING', 'polymer process'), ('THERMOFORMING', 'polymer process'), ('COMPRESSION_MOLDING', 'polymer process')]\nPSI: user_text_len=0 preview=\"\"\nprocess_selection: cad_lite status=failed\nprocess_selection: sheet_metal_likelihood=low (source=none)\nprocess_selection: extrusion_likelihood=none (coeff_var=? axis=?)\nprocess_selection: am_likelihood=low (source=bins_only)\nprocess_selection: scorer_path=legacy_bins cad_status=none\nPSI: score_diff=3 (primary=CNC=5, second=AM=2)\nProcess selection computed: primary=CNC user_selected=CNC\nprocess_selection: cad_uploaded=y evidence_available=n\nrules: cad_uploaded=y cad_status=none evidence_keys=[]\nreport: process_recommendation present=True primary=CNC", "error": null, "error_type": null, "state_has_error": false, "case_id": "turning2_bins_steel"}}
{"case_id": "turning3_bins_steel", "status": "pass", "result": {"primary": "CNC", "secondary": ["AM"], "eligible_processes": ["CNC", "CNC_TURNING", "AM", "SHEET_METAL", "CASTING", "FORGING", "EXTRUSION", "MIM"], "gated_out": ["COMPRESSION_MOLDING", "INJECTION_MOLDING", "THERMOFORMING"], "cad_lite_status": "failed", "extrusion_lite_status": "failed", "extrusion_likelihood_level": "none", "sheet_metal_likelihood_level": "low", "sheet_metal_likelihood_source": "none", "findings": [{"rule_id": "PASS1", "severity": "LOW", "process": null, "title": "Low feature variety (favorable for cycle time and tooling)"}, {"rule_id": "PASS2", "severity": "LOW", "process": null, "title": "Low accessibility risk (good tool access)"}, {"rule_id": "CAST1", "severity": "MEDIUM", "process": "CASTING", "title": "Low volume + casting (tooling risk)"}, {"rule_id": "FORG1", "severity": "MEDIUM", "process": "FORGING", "title": "Low volume + forging (tooling risk)"}, {"rule_id": "MIM1", "severity": "HIGH", "process": "MIM", "title": "Low volume + MIM (tooling ROI risk)"}], "top_priorities": ["PASS1", "PASS2"], "duration_ms": 99.07, "report": "# CNC Design Review + DFM Report\n\n## Input summary\n\n- Manufacturing process: CNC\n\n- Material: Steel\n- Production volume: Proto\n- Load type: Static\n- Tolerance criticality: Medium\n\n- Part size: Medium\n- Min internal radius: Medium\n- Min wall thickness: Medium\n- Hole depth class: None\n- Pocket aspect class: OK\n- Feature variety: Low\n- Accessibility risk: Low\n- Has clamping faces: True\n\n\n## Process recommendation\n\n- Primary: **CNC**\n\n- Secondary: AM\n\n- Less suitable (given current inputs): SHEET_METAL, CASTING, FORGING, EXTRUSION, MIM\n\n- Not applicable (hard gated): INJECTION_MOLDING (polymer process), THERMOFORMING (polymer process), COMPRESSION_MOLDING (polymer process)\n\n- Tradeoffs:\n\n  - Tooling lead time vs unit cost: IM/Sheet metal need tooling; CNC/AM suit low volume.\n\n  - Tolerance and finish: Define critical interfaces; plan post-machining or inspection where needed.\n\n  - Risk drivers: Warpage (IM/AM), supports (AM), setups (CNC/Sheet metal) affect feasibility.\n\n  - Volume sensitivity: IM and sheet metal favor production runs; CNC/AM suit proto and small batch.\n\n  - Documentation: 2D drawing and scale confirmation improve tolerance and process selection.\n\n\n\n## Manufacturing confidence inputs\n\n- CAD uploaded: yes\n\n- CAD analysis status: none\n\n- CAD evidence used in rules: no\n\n- CAD Lite analysis: failed\n\n- Extrusion Lite analysis: failed\n\n- Extrusion likelihood: none (source=none)\n\n- Sheet metal likelihood: low (source=none)\n\n_Confidence inputs not provided._\n\n\n\n## Top priorities\n\n- [LOW] Low feature variety (favorable for cycle time and tooling) (PASS1)\n\n- [LOW] Low accessibility risk (good tool access) (PASS2)\n\n\n\n## Findings (HIGH)\n\n- **Low volume + MIM (tooling ROI risk)** (MIM1) \u2014 MIM has high upfront tooling cost; unit cost only becomes favorable at production volumes.\n  - Recommendation: Consider CNC or AM for low volumes; MIM best for stable designs at production scale.\n\n## Findings (MEDIUM)\n\n- **Low volume + casting (tooling risk)** (CAST1) \u2014 Casting has significant tooling cost; economics favor production runs.\n  - Recommendation: Consider CNC or AM for low volumes; casting best at production scale.\n- **Low volume + forging (tooling risk)** (FORG1) \u2014 Forging has significant die cost; economics favor production runs.\n  - Recommendation: Consider CNC or AM for low volumes; forging best at production scale.\n\n## Findings (LOW)\n\n- **Low feature variety (favorable for cycle time and tooling)** (PASS1) \u2014 Low complexity reduces cycle time and tooling risk.\n  - Recommendation: No change needed.\n- **Low accessibility risk (good tool access)** (PASS2) \u2014 Good tool access reduces setup and machining risk.\n  - Recommendation: No change needed.\n\n## Action Checklist\n\n- [ ] Address HIGH and MEDIUM findings before release.\n- [ ] Apply recommended design changes for critical features.\n- [ ] Re-verify tolerances and interfaces after changes.\n\n## Assumptions\n\n- Inputs and part summary reflect current design intent.\n- Manufacturing process and material choices are as specified.\n\n## Usage (tokens & cost)\n\n_Usage not available._\n\n\n## LLM usage by node\n\n_Not available._\n\n\n## Agent confidence & limitations\n\n_Not available._\n", "trace": "Run started\nInputs validated\nProcess selection node entered\nprocess_selection: eligible_processes=['AM', 'CASTING', 'CNC', 'CNC_TURNING', 'EXTRUSION', 'FORGING', 'MIM', 'SHEET_METAL']\nprocess_selection: gated_out=[('INJECTION_MOLDING', 'polymer process'), ('THERMOFORMING', 'polymer process'), ('COMPRESSION_MOLDING', 'polymer process')]\nPSI: user_text_len=0 preview=\"\"\nprocess_selection: cad_lite status=failed\nprocess_selection: sheet_metal_likelihood=low (source=none)\nprocess_selection: extrusion_likelihood=none (coeff_var=? axis=?)\nprocess_selection: am_likelihood=low (source=bins_only)\nprocess_selection: scorer_path=legacy_bins cad_status=none\nPSI: score_diff=3 (primary=CNC=5, second=AM=2)\nProcess selection computed: primary=CNC user_selected=CNC\nprocess_selection: cad_uploaded=y evidence_available=n\nrules: cad_uploaded=y cad_status=none evidence_keys=[]\nreport: process_recommendation present=True primary=CNC", "error": null, "error_type": null, "state_has_error": false, "case_id": "turning3_bins_steel"}}
{"case_id": "extrusion1_bins_aluminum", "status": "pass", "result": {"primary": "EXTRUSION", "secondary": [], "eligible_processes": ["CNC", "CNC_TURNING", "AM", "SHEET_METAL", "CASTING", "FORGING", "EXTRUSION", "MIM"], "gated_out": ["COMPRESSION_MOLDING", "INJECTION_MOLDING", "THERMOFORMING"], "cad_lite_status": "ok", "extrusion_lite_status": "ok", "extrusion_likelihood_level": "high", "sheet_metal_likelihood_level": "med", "sheet_metal_likelihood_source": "cad_lite", "findings": [{"rule_id": "PASS1", "severity": "LOW", "process": null, "title": "Low feature variety (favorable for cycle time and tooling)"}, {"rule_id": "PASS2", "severity": "LOW", "process": null, "title": "Low accessibility risk (good tool access)"}, {"rule_id": "HYBRID1", "severity": "MEDIUM", "process": null, "title": "Consider EXTRUSION + CNC finishing"}], "top_priorities": ["HYBRID1", "PASS1", "PASS2"], "duration_ms": 118.64, "report": "# CNC Design Review + DFM Report\n\n## Input summary\n\n- Manufacturing process: CNC\n\n- Material: Aluminum\n- Production volume: Production\n- Load type: Static\n- Tolerance criticality: Medium\n\n- Part size: Medium\n- Min internal radius: Medium\n- Min wall thickness: Medium\n- Hole depth class: None\n- Pocket aspect class: OK\n- Feature variety: Low\n- Accessibility risk: Low\n- Has clamping faces: True\n\n\n## Process recommendation\n\n- Primary: **EXTRUSION**\n\n- Secondary: CNC\n\n- Less suitable (given current inputs): AM, CASTING, FORGING, MIM\n\n- Not applicable (hard gated): INJECTION_MOLDING (polymer process), THERMOFORMING (polymer process), COMPRESSION_MOLDING (polymer process)\n\n- Tradeoffs:\n\n  - Tooling lead time vs unit cost: IM/Sheet metal need tooling; CNC/AM suit low volume.\n\n  - Tolerance and finish: Define critical interfaces; plan post-machining or inspection where needed.\n\n  - Risk drivers: Warpage (IM/AM), supports (AM), setups (CNC/Sheet metal) affect feasibility.\n\n  - Volume sensitivity: IM and sheet metal favor production runs; CNC/AM suit proto and small batch.\n\n  - Documentation: 2D drawing and scale confirmation improve tolerance and process selection.\n\n\n\n## Manufacturing confidence inputs\n\n- CAD uploaded: yes\n\n- CAD analysis status: none\n\n- CAD evidence used in rules: no\n\n- CAD Lite analysis: ok\n\n- Extrusion Lite analysis: ok\n\n- Extrusion likelihood: high (source=extrusion_lite)\n\n- Sheet metal likelihood: med (source=cad_lite)\n\n_Confidence inputs not provided._\n\n\n\n## Top priorities\n\n- [MEDIUM] Consider EXTRUSION + CNC finishing (HYBRID1)\n\n- [LOW] Low feature variety (favorable for cycle time and tooling) (PASS1)\n\n- [LOW] Low accessibility risk (good tool access) (PASS2)\n\n\n\n## Findings (HIGH)\n\n_None_\n\n## Findings (MEDIUM)\n\n- **Consider EXTRUSION + CNC finishing** (HYBRID1) \u2014 Process selection intelligence recommends EXTRUSION (score advantage: 4 points) for near-net shape and economics. User requirements indicate need for secondary finishing operations.\n  - Recommendation: Primary: EXTRUSION for near-net shape and economics at volume. Secondary: CNC for cut-to-length, drilling, tapping, and milling. Design for finishing: define machining datums and leave stock only where needed.\n\n## Findings (LOW)\n\n- **Low feature variety (favorable for cycle time and tooling)** (PASS1) \u2014 Low complexity reduces cycle time and tooling risk.\n  - Recommendation: No change needed.\n- **Low accessibility risk (good tool access)** (PASS2) \u2014 Good tool access reduces setup and machining risk.\n  - Recommendation: No change needed.\n\n## Action Checklist\n\n- [ ] Address HIGH and MEDIUM findings before release.\n- [ ] Apply recommended design changes for critical features.\n- [ ] Re-verify tolerances and interfaces after changes.\n\n## Assumptions\n\n- Inputs and part summary reflect current design intent.\n- Manufacturing process and material choices are as specified.\n\n## Usage (tokens & cost)\n\n_Usage not available._\n\n\n## LLM usage by node\n\n_Not available._\n\n\n## Agent confidence & limitations\n\n_Not available._\n", "trace": "Run started\nInputs validated\nProcess selection node entered\nprocess_selection: eligible_processes=['AM', 'CASTING', 'CNC', 'CNC_TURNING', 'EXTRUSION', 'FORGING', 'MIM', 'SHEET_METAL']\nprocess_selection: gated_out=[('INJECTION_MOLDING', 'polymer process'), ('THERMOFORMING', 'polymer process'), ('COMPRESSION_MOLDING', 'polymer process')]\nPSI: user_text_len=0 preview=\"\"\nprocess_selection: cad_lite status=ok t_est=2.8352 av_ratio=0.7054 t_over_min_dim=0.189\nprocess_selection: sheet_metal_likelihood=med (source=cad_lite)\nprocess_selection: extrusion_likelihood=high (coeff_var=0.0 axis=Y)\nprocess_selection: am_likelihood=low (source=bins_only)\nprocess_selection: bins_boost EXTRUSION high +5; bins_penalize MIM -6\nprocess_selection: bins_guard MIM cap for Aluminum\nprocess_selection: scorer_path=legacy_bins cad_status=none\nPSI: score_diff=3 (primary=EXTRUSION=6, second=SHEET_METAL=3)\nProcess selection computed: primary=EXTRUSION user_selected=CNC\nprocess_selection: cad_uploaded=y evidence_available=n\nProcess selection mismatch: user_selected=CNC but primary=EXTRUSION\nHybrid offer added: EXTRUSION + CNC finishing\nrules: cad_uploaded=y cad_status=none evidence_keys=[]\nreport: process_recommendation present=True primary=EXTRUSION", "error": null, "error_type": null, "state_has_error": false, "case_id": "extrusion1_bins_aluminum"}}
{"case_id": "extrusion2_bins_aluminum", "status": "pass", "result": {"primary": "CNC", "secondary": ["CNC_TURNING"], "eligible_processes": ["CNC", "CNC_TURNING", "AM", "SHEET_METAL", "CASTING", "FORGING", "EXTRUSION", "MIM"], "gated_out": ["COMPRESSION_MOLDING", "INJECTION_MOLDING", "THERMOFORMING"], "cad_lite_status": "failed", "extrusion_lite_status": "failed", "extrusion_likelihood_level": "none", "sheet_metal_likelihood_level": "low", "sheet_metal_likelihood_source": "none", "findings": [{"rule_id": "PASS1", "severity": "LOW", "process": null, "title": "Low feature variety (favorable for cycle time and tooling)"}, {"rule_id": "PASS2", "severity": "LOW", "process": null, "title": "Low accessibility risk (good tool access)"}], "top_priorities": ["PASS1", "PASS2"], "duration_ms": 117.68, "report": "# CNC Design Review + DFM Report\n\n## Input summary\n\n- Manufacturing process: CNC\n\n- Material: Aluminum\n- Production volume: Production\n- Load type: Static\n- Tolerance criticality: Medium\n\n- Part size: Medium\n- Min internal radius: Medium\n- Min wall thickness: Medium\n- Hole depth class: None\n- Pocket aspect class: OK\n- Feature variety: Low\n- Accessibility risk: Low\n- Has clamping faces: True\n\n\n## Process recommendation\n\n- Primary: **CNC**\n\n- Secondary: CNC_TURNING\n\n- Less suitable (given current inputs): AM\n\n- Not applicable (hard gated): INJECTION_MOLDING (polymer process), THERMOFORMING (polymer process), COMPRESSION_MOLDING (polymer process)\n\n- Tradeoffs:\n\n  - Tooling lead time vs unit cost: IM/Sheet metal need tooling; CNC/AM suit low volume.\n\n  - Tolerance and finish: Define critical interfaces; plan post-machining or inspection where needed.\n\n  - Risk drivers: Warpage (IM/AM), supports (AM), setups (CNC/Sheet metal) affect feasibility.\n\n  - Volume sensitivity: IM and sheet metal favor production runs; CNC/AM suit proto and small batch.\n\n  - Documentation: 2D drawing and scale confirmation improve tolerance and process selection.\n\n\n\n## Manufacturing confidence inputs\n\n- CAD uploaded: yes\n\n- CAD analysis status: none\n\n- CAD evidence used in rules: no\n\n- CAD Lite analysis: failed\n\n- Extrusion Lite analysis: failed\n\n- Extrusion likelihood: none (source=none)\n\n- Sheet metal likelihood: low (source=none)\n\n_Confidence inputs not provided._\n\n\n\n## Top priorities\n\n- [LOW] Low feature variety (favorable for cycle time and tooling) (PASS1)\n\n- [LOW] Low accessibility risk (good tool access) (PASS2)\n\n\n\n## Findings (HIGH)\n\n_None_\n\n## Findings (MEDIUM)\n\n_None_\n\n## Findings (LOW)\n\n- **Low feature variety (favorable for cycle time and tooling)** (PASS1) \u2014 Low complexity reduces cycle time and tooling risk.\n  - Recommendation: No change needed.\n- **Low accessibility risk (good tool access)** (PASS2) \u2014 Good tool access reduces setup and machining risk.\n  - Recommendation: No change needed.\n\n## Action Checklist\n\n- [ ] No blocking issues; optional improvements may apply.\n- [ ] Review LOW findings for incremental improvements.\n- [ ] Confirm part meets functional requirements.\n\n## Assumptions\n\n- Inputs and part summary reflect current design intent.\n- Manufacturing process and material choices are as specified.\n\n## Usage (tokens & cost)\n\n_Usage not available._\n\n\n## LLM usage by node\n\n_Not available._\n\n\n## Agent confidence & limitations\n\n_Not available._\n", "trace": "Run started\nInputs validated\nProcess selection node entered\nprocess_selection: eligible_processes=['AM', 'CASTING', 'CNC', 'CNC_TURNING', 'EXTRUSION', 'FORGING', 'MIM', 'SHEET_METAL']\nprocess_selection: gated_out=[('INJECTION_MOLDING', 'polymer process'), ('THERMOFORMING', 'polymer process'), ('COMPRESSION_MOLDING', 'polymer process')]\nPSI: user_text_len=0 preview=\"\"\nprocess_selection: cad_lite status=failed\nprocess_selection: sheet_metal_likelihood=low (source=none)\nprocess_selection: extrusion_likelihood=none (coeff_var=? axis=?)\nprocess_selection: am_likelihood=low (source=bins_only)\nprocess_selection: bins_guard MIM cap for Aluminum\nprocess_selection: scorer_path=legacy_bins cad_status=none\nPSI: score_diff=2 (primary=CNC=3, second=CNC_TURNING=1)\nProcess selection computed: primary=CNC user_selected=CNC\nprocess_selection: cad_uploaded=y evidence_available=n\nrules: cad_uploaded=y cad_status=none evidence_keys=[]\nreport: process_recommendation present=True primary=CNC", "error": null, "error_type": null, "state_has_error": false, "case_id": "extrusion2_bins_aluminum"}}
{"case_id": "extrusion3_bins_aluminum", "status": "pass", "result": {"primary": "CNC", "secondary": ["CNC_TURNING"], "eligible_processes": ["CNC", "CNC_TURNING", "AM", "SHEET_METAL", "CASTING", "FORGING", "EXTRUSION", "MIM"], "gated_out": ["COMPRESSION_MOLDING", "INJECTION_MOLDING", "THERMOFORMING"], "cad_lite_status": "failed", "extrusion_lite_status": "failed", "extrusion_likelihood_level": "none", "sheet_metal_likelihood_level": "low", "sheet_metal_likelihood_source": "none", "findings": [{"rule_id": "PASS1", "severity": "LOW", "process": null, "title": "Low feature variety (favorable for cycle time and tooling)"}, {"rule_id": "PASS2", "severity": "LOW", "process": null, "title": "Low accessibility risk (good tool access)"}], "top_priorities": ["PASS1", "PASS2"], "duration_ms": 92.5, "report": "# CNC Design Review + DFM Report\n\n## Input summary\n\n- Manufacturing process: CNC\n\n- Material: Aluminum\n- Production volume: Production\n- Load type: Static\n- Tolerance criticality: Medium\n\n- Part size: Medium\n- Min internal radius: Medium\n- Min wall thickness: Medium\n- Hole depth class: None\n- Pocket aspect class: OK\n- Feature variety: Low\n- Accessibility risk: Low\n- Has clamping faces: True\n\n\n## Process recommendation\n\n- Primary: **CNC**\n\n- Secondary: CNC_TURNING\n\n- Less suitable (given current inputs): AM\n\n- Not applicable (hard gated): INJECTION_MOLDING (polymer process), THERMOFORMING (polymer process), COMPRESSION_MOLDING (polymer process)\n\n- Tradeoffs:\n\n  - Tooling lead time vs unit cost: IM/Sheet metal need tooling; CNC/AM suit low volume.\n\n  - Tolerance and finish: Define critical interfaces; plan post-machining or inspection where needed.\n\n  - Risk drivers: Warpage (IM/AM), supports (AM), setups (CNC/Sheet metal) affect feasibility.\n\n  - Volume sensitivity: IM and sheet metal favor production runs; CNC/AM suit proto and small batch.\n\n  - Documentation: 2D drawing and scale confirmation improve tolerance and process selection.\n\n\n\n## Manufacturing confidence inputs\n\n- CAD uploaded: yes\n\n- CAD analysis status: none\n\n- CAD evidence used in rules: no\n\n- CAD Lite analysis: failed\n\n- Extrusion Lite analysis: failed\n\n- Extrusion likelihood: none (source=none)\n\n- Sheet metal likelihood: low (source=none)\n\n_Confidence inputs not provided._\n\n\n\n## Top priorities\n\n- [LOW] Low feature variety (favorable for cycle time and tooling) (PASS1)\n\n- [LOW] Low accessibility risk (good tool access) (PASS2)\n\n\n\n## Findings (HIGH)\n\n_None_\n\n## Findings (MEDIUM)\n\n_None_\n\n## Findings (LOW)\n\n- **Low feature variety (favorable for cycle time and tooling)** (PASS1) \u2014 Low complexity reduces cycle time and tooling risk.\n  - Recommendation: No change needed.\n- **Low accessibility risk (good tool access)** (PASS2) \u2014 Good tool access reduces setup and machining risk.\n  - Recommendation: No change needed.\n\n## Action Checklist\n\n- [ ] No blocking issues; optional improvements may apply.\n- [ ] Review LOW findings for incremental improvements.\n- [ ] Confirm part meets functional requirements.\n\n## Assumptions\n\n- Inputs and part summary reflect current design intent.\n- Manufacturing process and material choices are as specified.\n\n## Usage (tokens & cost)\n\n_Usage not available._\n\n\n## LLM usage by node\n\n_Not available._\n\n\n## Agent confidence & limitations\n\n_Not available._\n", "trace": "Run started\nInputs validated\nProcess selection node entered\nprocess_selection: eligible_processes=['AM', 'CASTING', 'CNC', 'CNC_TURNING', 'EXTRUSION', 'FORGING', 'MIM', 'SHEET_METAL']\nprocess_selection: gated_out=[('INJECTION_MOLDING', 'polymer process'), ('THERMOFORMING', 'polymer process'), ('COMPRESSION_MOLDING', 'polymer process')]\nPSI: user_text_len=0 preview=\"\"\nprocess_selection: cad_lite status=failed\nprocess_selection: sheet_metal_likelihood=low (source=none)\nprocess_selection: extrusion_likelihood=none (coeff_var=? axis=?)\nprocess_selection: am_likelihood=low (source=bins_only)\nprocess_selection: bins_guard MIM cap for Aluminum\nprocess_selection: scorer_path=legacy_bins cad_status=none\nPSI: score_diff=2 (primary=CNC=3, second=CNC_TURNING=1)\nProcess selection computed: primary=CNC user_selected=CNC\nprocess_selection: cad_uploaded=y evidence_available=n\nrules: cad_uploaded=y cad_status=none evidence_keys=[]\nreport: process_recommendation present=True primary=CNC", "error": null, "error_type": null, "state_has_error": false, "case_id": "extrusion3_bins_aluminum"}}
{"case_id": "im1_bins_plastic_high", "status": "pass", "result": {"primary": "INJECTION_MOLDING", "secondary": [], "eligible_processes": ["CNC", "CNC_TURNING", "AM", "SHEET_METAL", "INJECTION_MOLDING", "EXTRUSION", "THERMOFORMING", "COMPRESSION_MOLDING"], "gated_out": ["CASTING", "FORGING", "MIM"], "cad_lite_status": "failed", "extrusion_lite_status": "failed", "extrusion_likelihood_level": "none", "sheet_metal_likelihood_level": "low", "sheet_metal_likelihood_source": "none", "findings": [{"rule_id": "PASS1", "severity": "LOW", "process": null, "title": "Low feature variety (favorable for cycle time and tooling)"}, {"rule_id": "PASS2", "severity": "LOW", "process": null, "title": "Low accessibility risk (good tool access)"}, {"rule_id": "PSI1", "severity": "MEDIUM", "process": null, "title": "Selected process differs from recommended process"}], "top_priorities": ["PSI1", "PASS1", "PASS2"], "duration_ms": 117.08, "report": "# CNC Design Review + DFM Report\n\n## Input summary\n\n- Manufacturing process: CNC\n\n- Material: Plastic\n- Production volume: Production\n- Load type: Static\n- Tolerance criticality: Medium\n\n- Part size: Medium\n- Min internal radius: Medium\n- Min wall thickness: Medium\n- Hole depth class: None\n- Pocket aspect class: OK\n- Feature variety: Low\n- Accessibility risk: Low\n- Has clamping faces: True\n\n\n## Process recommendation\n\n- Primary: **INJECTION_MOLDING**\n\n- Secondary: None\n\n- Less suitable (given current inputs): AM, SHEET_METAL, EXTRUSION\n\n- Not applicable (hard gated): CASTING (metal process), FORGING (metal process), MIM (metal process)\n\n- Primary rationale:\n\n  - Production volume favors IM economics\n\n- Tradeoffs:\n\n  - Tooling lead time vs unit cost: IM/Sheet metal need tooling; CNC/AM suit low volume.\n\n  - Tolerance and finish: Define critical interfaces; plan post-machining or inspection where needed.\n\n  - Risk drivers: Warpage (IM/AM), supports (AM), setups (CNC/Sheet metal) affect feasibility.\n\n  - Volume sensitivity: IM and sheet metal favor production runs; CNC/AM suit proto and small batch.\n\n  - Documentation: 2D drawing and scale confirmation improve tolerance and process selection.\n\n\n\n## Manufacturing confidence inputs\n\n- CAD uploaded: yes\n\n- CAD analysis status: none\n\n- CAD evidence used in rules: no\n\n- CAD Lite analysis: failed\n\n- Extrusion Lite analysis: failed\n\n- Extrusion likelihood: none (source=none)\n\n- Sheet metal likelihood: low (source=none)\n\n_Confidence inputs not provided._\n\n\n\n## Top priorities\n\n- [MEDIUM] Selected process differs from recommended process (PSI1)\n\n- [LOW] Low feature variety (favorable for cycle time and tooling) (PASS1)\n\n- [LOW] Low accessibility risk (good tool access) (PASS2)\n\n\n\n## Findings (HIGH)\n\n_None_\n\n## Findings (MEDIUM)\n\n- **Selected process differs from recommended process** (PSI1) \u2014 Process selection intelligence recommends INJECTION_MOLDING (score advantage: 12 points) over selected CNC. This may indicate suboptimal process choice for material, volume, or geometry.\n  - Recommendation: Consider INJECTION_MOLDING as alternatives. Evaluate tradeoffs: tooling lead time vs unit cost, tolerance/finish requirements, and volume sensitivity.\n\n## Findings (LOW)\n\n- **Low feature variety (favorable for cycle time and tooling)** (PASS1) \u2014 Low complexity reduces cycle time and tooling risk.\n  - Recommendation: No change needed.\n- **Low accessibility risk (good tool access)** (PASS2) \u2014 Good tool access reduces setup and machining risk.\n  - Recommendation: No change needed.\n\n## Action Checklist\n\n- [ ] Address HIGH and MEDIUM findings before release.\n- [ ] Apply recommended design changes for critical features.\n- [ ] Re-verify tolerances and interfaces after changes.\n\n## Assumptions\n\n- Inputs and part summary reflect current design intent.\n- Manufacturing process and material choices are as specified.\n\n## Usage (tokens & cost)\n\n_Usage not available._\n\n\n## LLM usage by node\n\n_Not available._\n\n\n## Agent confidence & limitations\n\n_Not available._\n", "trace": "Run started\nInputs validated\nProcess selection node entered\nprocess_selection: eligible_processes=['AM', 'CNC', 'CNC_TURNING', 'COMPRESSION_MOLDING', 'EXTRUSION', 'INJECTION_MOLDING', 'SHEET_METAL', 'THERMOFORMING']\nprocess_selection: gated_out=[('CASTING', 'metal process'), ('FORGING', 'metal process'), ('MIM', 'metal process')]\nPSI: user_text_len=0 preview=\"\"\nprocess_selection: cad_lite status=failed\nprocess_selection: sheet_metal_likelihood=low (source=none)\nprocess_selection: extrusion_likelihood=none (coeff_var=? axis=?)\nprocess_selection: am_likelihood=low (source=bins_only)\nprocess_selection: scorer_path=legacy_bins cad_status=none\nPSI: score_diff=5 (primary=INJECTION_MOLDING=10, second=THERMOFORMING=5)\nProcess selection computed: primary=INJECTION_MOLDING user_selected=CNC\nprocess_selection: cad_uploaded=y evidence_available=n\nProcess selection mismatch: user_selected=CNC but primary=INJECTION_MOLDING\nProcess selection warning added: selected=CNC, recommended=INJECTION_MOLDING\nrules: cad_uploaded=y cad_status=none evidence_keys=[]\nreport: process_recommendation present=True primary=INJECTION_MOLDING", "error": null, "error_type": null, "state_has_error": false, "case_id": "im1_bins_plastic_high"}}
{"case_id": "im1_bins_plastic_small", "status": "pass", "result": {"primary": "CNC", "secondary": ["THERMOFORMING", "CNC_TURNING"], "eligible_processes": ["CNC", "CNC_TURNING", "AM", "SHEET_METAL", "INJECTION_MOLDING", "EXTRUSION", "THERMOFORMING", "COMPRESSION_MOLDING"], "gated_out": ["CASTING", "FORGING", "MIM"], "cad_lite_status": "failed", "extrusion_lite_status": "failed", "extrusion_likelihood_level": "none", "sheet_metal_likelihood_level": "low", "sheet_metal_likelihood_source": "none", "findings": [{"rule_id": "PASS1", "severity": "LOW", "process": null, "title": "Low feature variety (favorable for cycle time and tooling)"}, {"rule_id": "PASS2", "severity": "LOW", "process": null, "title": "Low accessibility risk (good tool access)"}, {"rule_id": "IM1", "severity": "HIGH", "process": "INJECTION_MOLDING", "title": "Low volume + injection molding (tooling ROI risk)"}], "top_priorities": ["PASS1", "PASS2"], "duration_ms": 116.07, "report": "# CNC Design Review + DFM Report\n\n## Input summary\n\n- Manufacturing process: CNC\n\n- Material: Plastic\n- Production volume: Small batch\n- Load type: Static\n- Tolerance criticality: Medium\n\n- Part size: Medium\n- Min internal radius: Medium\n- Min wall thickness: Medium\n- Hole depth class: None\n- Pocket aspect class: OK\n- Feature variety: Low\n- Accessibility risk: Low\n- Has clamping faces: True\n\n\n## Process recommendation\n\n- Primary: **CNC**\n\n- Secondary: THERMOFORMING, CNC_TURNING\n\n- Less suitable (given current inputs): None\n\n- Not applicable (hard gated): CASTING (metal process), FORGING (metal process), MIM (metal process)\n\n- Tradeoffs:\n\n  - Tooling lead time vs unit cost: IM/Sheet metal need tooling; CNC/AM suit low volume.\n\n  - Tolerance and finish: Define critical interfaces; plan post-machining or inspection where needed.\n\n  - Risk drivers: Warpage (IM/AM), supports (AM), setups (CNC/Sheet metal) affect feasibility.\n\n  - Volume sensitivity: IM and sheet metal favor production runs; CNC/AM suit proto and small batch.\n\n  - Documentation: 2D drawing and scale confirmation improve tolerance and process selection.\n\n\n\n## Manufacturing confidence inputs\n\n- CAD uploaded: yes\n\n- CAD analysis status: none\n\n- CAD evidence used in rules: no\n\n- CAD Lite analysis: failed\n\n- Extrusion Lite analysis: failed\n\n- Extrusion likelihood: none (source=none)\n\n- Sheet metal likelihood: low (source=none)\n\n_Confidence inputs not provided._\n\n\n\n## Top priorities\n\n- [LOW] Low feature variety (favorable for cycle time and tooling) (PASS1)\n\n- [LOW] Low accessibility risk (good tool access) (PASS2)\n\n\n\n## Findings (HIGH)\n\n- **Low volume + injection molding (tooling ROI risk)** (IM1) \u2014 Injection molding has high upfront tooling cost; unit cost only becomes favorable at high volumes.\n  - Recommendation: Consider alternative processes (CNC, AM) for low volumes; injection molding best for stable designs at production scale.\n\n## Findings (MEDIUM)\n\n_None_\n\n## Findings (LOW)\n\n- **Low feature variety (favorable for cycle time and tooling)** (PASS1) \u2014 Low complexity reduces cycle time and tooling risk.\n  - Recommendation: No change needed.\n- **Low accessibility risk (good tool access)** (PASS2) \u2014 Good tool access reduces setup and machining risk.\n  - Recommendation: No change needed.\n\n## Action Checklist\n\n- [ ] Address HIGH and MEDIUM findings before release.\n- [ ] Apply recommended design changes for critical features.\n- [ ] Re-verify tolerances and interfaces after changes.\n\n## Assumptions\n\n- Inputs and part summary reflect current design intent.\n- Manufacturing process and material choices are as specified.\n\n## Usage (tokens & cost)\n\n_Usage not available._\n\n\n## LLM usage by node\n\n_Not available._\n\n\n## Agent confidence & limitations\n\n_Not available._\n", "trace": "Run started\nInputs validated\nProcess selection node entered\nprocess_selection: eligible_processes=['AM', 'CNC', 'CNC_TURNING', 'COMPRESSION_MOLDING', 'EXTRUSION', 'INJECTION_MOLDING', 'SHEET_METAL', 'THERMOFORMING']\nprocess_selection: gated_out=[('CASTING', 'metal process'), ('FORGING', 'metal process'), ('MIM', 'metal process')]\nPSI: user_text_len=0 preview=\"\"\nprocess_selection: cad_lite status=failed\nprocess_selection: sheet_metal_likelihood=low (source=none)\nprocess_selection: extrusion_likelihood=none (coeff_var=? axis=?)\nprocess_selection: am_likelihood=low (source=bins_only)\nprocess_selection: scorer_path=legacy_bins cad_status=none\nprocess_selection: bins_anchor applied selected=CNC margin=2 top_was=THERMOFORMING\nPSI: score_diff=0 (primary=CNC=2, second=CNC=2)\nPSI tie-break: prefer user-selected flexible process (CNC) when score_diff <= 1 (compatible, no strong mismatch)\nPSI: final score_diff=0 (after tie-break, primary changed from THERMOFORMING to CNC)\nProcess selection computed: primary=CNC user_selected=CNC\nprocess_selection: cad_uploaded=y evidence_available=n\nrules: cad_uploaded=y cad_status=none evidence_keys=[]\nreport: process_recommendation present=True primary=CNC", "error": null, "error_type": null, "state_has_error": false, "case_id": "im1_bins_plastic_small"}}
{"case_id": "edge1_am", "status": "pass", "result": {"primary": "AM", "secondary": ["CNC"], "eligible_processes": ["CNC", "CNC_TURNING", "AM", "SHEET_METAL", "CASTING", "FORGING", "EXTRUSION", "MIM"], "gated_out": ["COMPRESSION_MOLDING", "INJECTION_MOLDING", "THERMOFORMING"], "cad_lite_status": "failed", "extrusion_lite_status": "failed", "extrusion_likelihood_level": "none", "sheet_metal_likelihood_level": "low", "sheet_metal_likelihood_source": "none", "findings": [{"rule_id": "LPBF1", "severity": "HIGH", "process": null, "title": "Support structures required (metal LPBF)"}, {"rule_id": "LPBF10", "severity": "MEDIUM", "process": null, "title": "Powder removal access (metal LPBF)"}, {"rule_id": "AM2", "severity": "HIGH", "process": null, "title": "Support or bridging (geometry)"}, {"rule_id": "AM8", "severity": "MEDIUM", "process": null, "title": "High feature variety (print time)"}, {"rule_id": "CAST1", "severity": "MEDIUM", "process": "CASTING", "title": "Low volume + casting (tooling risk)"}, {"rule_id": "FORG1", "severity": "MEDIUM", "process": "FORGING", "title": "Low volume + forging (tooling risk)"}, {"rule_id": "MIM1", "severity": "HIGH", "process": "MIM", "title": "Low volume + MIM (tooling ROI risk)"}], "top_priorities": ["LPBF1", "AM2", "LPBF10"], "duration_ms": 101.56, "report": "# CNC Design Review + DFM Report\n\n## Input summary\n\n- Manufacturing process: AM\n\n- Material: Steel\n- Production volume: Proto\n- Load type: Static\n- Tolerance criticality: Medium\n\n- Part size: Small\n- Min internal radius: Small\n- Min wall thickness: Medium\n- Hole depth class: None\n- Pocket aspect class: OK\n- Feature variety: High\n- Accessibility risk: High\n- Has clamping faces: True\n\n\n## Process recommendation\n\n- Primary: **AM**\n\n- Secondary: CNC\n\n- Less suitable (given current inputs): SHEET_METAL, CASTING, FORGING, EXTRUSION, MIM\n\n- Not applicable (hard gated): INJECTION_MOLDING (polymer process), THERMOFORMING (polymer process), COMPRESSION_MOLDING (polymer process)\n\n- Tradeoffs:\n\n  - Tooling lead time vs unit cost: IM/Sheet metal need tooling; CNC/AM suit low volume.\n\n  - Tolerance and finish: Define critical interfaces; plan post-machining or inspection where needed.\n\n  - Risk drivers: Warpage (IM/AM), supports (AM), setups (CNC/Sheet metal) affect feasibility.\n\n  - Volume sensitivity: IM and sheet metal favor production runs; CNC/AM suit proto and small batch.\n\n  - Documentation: 2D drawing and scale confirmation improve tolerance and process selection.\n\n\n\n## Manufacturing confidence inputs\n\n- CAD uploaded: yes\n\n- CAD analysis status: none\n\n- CAD evidence used in rules: no\n\n- CAD Lite analysis: failed\n\n- Extrusion Lite analysis: failed\n\n- Extrusion likelihood: none (source=none)\n\n- Sheet metal likelihood: low (source=none)\n\n_Confidence inputs not provided._\n\n\n\n## Top priorities\n\n- [HIGH] Support structures required (metal LPBF) (LPBF1)\n\n- [HIGH] Support or bridging (geometry) (AM2)\n\n- [MEDIUM] Powder removal access (metal LPBF) (LPBF10)\n\n\n\n## Findings (HIGH)\n\n- **Support structures required (metal LPBF)** (LPBF1) \u2014 Metal LPBF requires supports for overhangs; supports add cost, time, and post-processing.\n  - Recommendation: Design self-supporting geometry; minimize overhangs <45\u00b0; ensure support removal access; plan for EDM/saw removal.\n- **Support or bridging (geometry)** (AM2) \u2014 Supports add material, time, and post-processing; bridging can sag. Poor removal access increases risk.\n  - Recommendation: Design self-supporting where possible; limit support contact area. Ensure removal access for supports.\n- **Low volume + MIM (tooling ROI risk)** (MIM1) \u2014 MIM has high upfront tooling cost; unit cost only becomes favorable at production volumes.\n  - Recommendation: Consider CNC or AM for low volumes; MIM best for stable designs at production scale.\n\n## Findings (MEDIUM)\n\n- **Powder removal access (metal LPBF)** (LPBF10) \u2014 Trapped powder must be removed; poor access increases cleaning time and risk.\n  - Recommendation: Design for powder removal access; add drain holes; plan cleaning procedures.\n- **High feature variety (print time)** (AM8) \u2014 Many distinct features increase print time and failure risk.\n  - Recommendation: Consolidate geometry where possible; use consistent wall thicknesses.\n- **Low volume + casting (tooling risk)** (CAST1) \u2014 Casting has significant tooling cost; economics favor production runs.\n  - Recommendation: Consider CNC or AM for low volumes; casting best at production scale.\n- **Low volume + forging (tooling risk)** (FORG1) \u2014 Forging has significant die cost; economics favor production runs.\n  - Recommendation: Consider CNC or AM for low volumes; forging best at production scale.\n\n## Findings (LOW)\n\n_None_\n\n## Action Checklist\n\n- [ ] Address HIGH and MEDIUM findings before release.\n- [ ] Apply recommended design changes for critical features.\n- [ ] Re-verify tolerances and interfaces after changes.\n\n## Assumptions\n\n- Inputs and part summary reflect current design intent.\n- Manufacturing process and material choices are as specified.\n\n## Usage (tokens & cost)\n\n_Usage not available._\n\n\n## LLM usage by node\n\n_Not available._\n\n\n## Agent confidence & limitations\n\n_Not available._\n", "trace": "Run started\nInputs validated\nProcess selection node entered\nprocess_selection: eligible_processes=['AM', 'CASTING', 'CNC', 'CNC_TURNING', 'EXTRUSION', 'FORGING', 'MIM', 'SHEET_METAL']\nprocess_selection: gated_out=[('INJECTION_MOLDING', 'polymer process'), ('THERMOFORMING', 'polymer process'), ('COMPRESSION_MOLDING', 'polymer process')]\nPSI: user_text_len=0 preview=\"\"\nprocess_selection: cad_lite status=failed\nprocess_selection: sheet_metal_likelihood=low (source=none)\nprocess_selection: extrusion_likelihood=none (coeff_var=? axis=?)\nprocess_selection: am_likelihood=med (source=bins_only)\nprocess_selection: bins_boost AM +3\nprocess_selection: scorer_path=legacy_bins cad_status=none\nPSI: score_diff=1 (primary=AM=6, second=CNC=5)\nPSI tie-break: prefer user-selected flexible process (AM) when score_diff <= 1 (compatible, no strong mismatch)\nProcess selection computed: primary=AM user_selected=AM\nprocess_selection: cad_uploaded=y evidence_available=n\nPSI: am_tech=METAL_LPBF (source=material)\nRule triggered: Support structures required (metal LPBF) \u2192 HIGH severity\nRule triggered: Powder removal access (metal LPBF) \u2192 MEDIUM severity\nruleset_used=am_metal_lpbf\nam_fallback_generic=True\nrules: cad_uploaded=y cad_status=none evidence_keys=[]\nreport: process_recommendation present=True primary=AM", "error": null, "error_type": null, "state_has_error": false, "case_id": "edge1_am"}}
{"case_id": "edge2_extrusion", "status": "pass", "result": {"primary": "EXTRUSION", "secondary": ["SHEET_METAL", "CNC"], "eligible_processes": ["CNC", "CNC_TURNING", "AM", "SHEET_METAL", "CASTING", "FORGING", "EXTRUSION", "MIM"], "gated_out": ["COMPRESSION_MOLDING", "INJECTION_MOLDING", "THERMOFORMING"], "cad_lite_status": "ok", "extrusion_lite_status": "ok", "extrusion_likelihood_level": "low", "sheet_metal_likelihood_level": "med", "sheet_metal_likelihood_source": "cad_lite", "findings": [{"rule_id": "EXTR2", "severity": "HIGH", "process": null, "title": "Non-uniform wall thickness (distortion/warpage risk)"}], "top_priorities": ["EXTR2"], "duration_ms": 115.96, "report": "# CNC Design Review + DFM Report\n\n## Input summary\n\n- Manufacturing process: EXTRUSION\n\n- Material: Aluminum\n- Production volume: Production\n- Load type: Static\n- Tolerance criticality: Medium\n\n- Part size: Medium\n- Min internal radius: Medium\n- Min wall thickness: Thin\n- Hole depth class: None\n- Pocket aspect class: OK\n- Feature variety: Low\n- Accessibility risk: Low\n- Has clamping faces: True\n\n\n## Process recommendation\n\n- Primary: **EXTRUSION**\n\n- Secondary: SHEET_METAL, CNC\n\n- Less suitable (given current inputs): AM, CASTING, FORGING, MIM\n\n- Not applicable (hard gated): INJECTION_MOLDING (polymer process), THERMOFORMING (polymer process), COMPRESSION_MOLDING (polymer process)\n\n- Tradeoffs:\n\n  - Tooling lead time vs unit cost: IM/Sheet metal need tooling; CNC/AM suit low volume.\n\n  - Tolerance and finish: Define critical interfaces; plan post-machining or inspection where needed.\n\n  - Risk drivers: Warpage (IM/AM), supports (AM), setups (CNC/Sheet metal) affect feasibility.\n\n  - Volume sensitivity: IM and sheet metal favor production runs; CNC/AM suit proto and small batch.\n\n  - Documentation: 2D drawing and scale confirmation improve tolerance and process selection.\n\n\n\n## Manufacturing confidence inputs\n\n- CAD uploaded: yes\n\n- CAD analysis status: none\n\n- CAD evidence used in rules: no\n\n- CAD Lite analysis: ok\n\n- Extrusion Lite analysis: ok\n\n- Extrusion likelihood: low (source=extrusion_lite)\n\n- Sheet metal likelihood: med (source=cad_lite)\n\n_Confidence inputs not provided._\n\n\n\n## Top priorities\n\n- [HIGH] Non-uniform wall thickness (distortion/warpage risk) (EXTR2)\n\n\n\n## Findings (HIGH)\n\n- **Non-uniform wall thickness (distortion/warpage risk)** (EXTR2) \u2014 Non-uniform thickness leads to uneven cooling, residual stress, and warping in extrusion.\n  - Recommendation: Aim for adjacent wall thickness ratio < 2:1; use smooth transitions; avoid thin flanges.\n\n## Findings (MEDIUM)\n\n_None_\n\n## Findings (LOW)\n\n_None_\n\n## Action Checklist\n\n- [ ] Address HIGH and MEDIUM findings before release.\n- [ ] Apply recommended design changes for critical features.\n- [ ] Re-verify tolerances and interfaces after changes.\n\n## Assumptions\n\n- Inputs and part summary reflect current design intent.\n- Manufacturing process and material choices are as specified.\n\n## Usage (tokens & cost)\n\n_Usage not available._\n\n\n## LLM usage by node\n\n_Not available._\n\n\n## Agent confidence & limitations\n\n_Not available._\n", "trace": "Run started\nInputs validated\nProcess selection node entered\nprocess_selection: eligible_processes=['AM', 'CASTING', 'CNC', 'CNC_TURNING', 'EXTRUSION', 'FORGING', 'MIM', 'SHEET_METAL']\nprocess_selection: gated_out=[('INJECTION_MOLDING', 'polymer process'), ('THERMOFORMING', 'polymer process'), ('COMPRESSION_MOLDING', 'polymer process')]\nPSI: user_text_len=0 preview=\"\"\nprocess_selection: cad_lite status=ok t_est=3.0477 av_ratio=0.6562 t_over_min_dim=0.2032\nprocess_selection: sheet_metal_likelihood=med (source=cad_lite)\nprocess_selection: extrusion_likelihood=low (coeff_var=0.352472 axis=X)\nprocess_selection: am_likelihood=low (source=bins_only)\nprocess_selection: bins_boost EXTRUSION fallback (thin+Al) +5; SM -2; MIM -4\nprocess_selection: bins_guard MIM cap for Aluminum\nprocess_selection: scorer_path=legacy_bins cad_status=none\nPSI: score_diff=0 (primary=EXTRUSION=6, second=SHEET_METAL=6)\nProcess selection computed: primary=EXTRUSION user_selected=EXTRUSION\nprocess_selection: cad_uploaded=y evidence_available=n\nRule triggered: Non-uniform wall thickness (distortion/warpage risk) \u2192 HIGH severity\nruleset_used=extrusion\nrules: cad_uploaded=y cad_status=none evidence_keys=[]\nreport: process_recommendation present=True primary=EXTRUSION", "error": null, "error_type": null, "state_has_error": false, "case_id": "edge2_extrusion"}}
{"case_id": "edge3_injection_molding_production", "status": "pass", "result": {"primary": "INJECTION_MOLDING", "secondary": [], "eligible_processes": ["CNC", "CNC_TURNING", "AM", "SHEET_METAL", "INJECTION_MOLDING", "EXTRUSION", "THERMOFORMING", "COMPRESSION_MOLDING"], "gated_out": ["CASTING", "FORGING", "MIM"], "cad_lite_status": "failed", "extrusion_lite_status": "failed", "extrusion_likelihood_level": "none", "sheet_metal_likelihood_level": "low", "sheet_metal_likelihood_source": "none", "findings": [], "top_priorities": [], "duration_ms": 93.31, "report": "# CNC Design Review + DFM Report\n\n## Input summary\n\n- Manufacturing process: INJECTION_MOLDING\n\n- Material: Plastic\n- Production volume: Production\n- Load type: Static\n- Tolerance criticality: Medium\n\n- Part size: Medium\n- Min internal radius: Medium\n- Min wall thickness: Medium\n- Hole depth class: None\n- Pocket aspect class: OK\n- Feature variety: Low\n- Accessibility risk: Low\n- Has clamping faces: True\n\n\n## Process recommendation\n\n- Primary: **INJECTION_MOLDING**\n\n- Secondary: None\n\n- Less suitable (given current inputs): CNC, AM, SHEET_METAL, EXTRUSION\n\n- Not applicable (hard gated): CASTING (metal process), FORGING (metal process), MIM (metal process)\n\n- Primary rationale:\n\n  - Production volume favors IM economics\n\n- Tradeoffs:\n\n  - Tooling lead time vs unit cost: IM/Sheet metal need tooling; CNC/AM suit low volume.\n\n  - Tolerance and finish: Define critical interfaces; plan post-machining or inspection where needed.\n\n  - Risk drivers: Warpage (IM/AM), supports (AM), setups (CNC/Sheet metal) affect feasibility.\n\n  - Volume sensitivity: IM and sheet metal favor production runs; CNC/AM suit proto and small batch.\n\n  - Documentation: 2D drawing and scale confirmation improve tolerance and process selection.\n\n\n\n## Manufacturing confidence inputs\n\n- CAD uploaded: yes\n\n- CAD analysis status: none\n\n- CAD evidence used in rules: no\n\n- CAD Lite analysis: failed\n\n- Extrusion Lite analysis: failed\n\n- Extrusion likelihood: none (source=none)\n\n- Sheet metal likelihood: low (source=none)\n\n_Confidence inputs not provided._\n\n\n\n## Top priorities\n\n_None_\n\n\n\n\n## Findings (HIGH)\n\n_None_\n\n## Findings (MEDIUM)\n\n_None_\n\n## Findings (LOW)\n\n_None_\n\n## Action Checklist\n\n- [ ] Review IM design guidelines: draft angles, wall thickness, ribs/bosses.\n- [ ] Plan tooling ROI analysis for production volume.\n- [ ] Consider gate/vent/cooling design early in tooling discussion.\n- [ ] Validate resin selection for application requirements.\n\n## Assumptions\n\n- Injection molding process intent is confirmed.\n- Tooling exists or will be quoted based on design.\n- Resin grade selection is TBD or as specified.\n- Draft angles and wall thickness uniformity not validated without CAD review.\n\n## Usage (tokens & cost)\n\n_Usage not available._\n\n\n## LLM usage by node\n\n_Not available._\n\n\n## Agent confidence & limitations\n\n_Not available._\n", "trace": "Run started\nInputs validated\nProcess selection node entered\nprocess_selection: eligible_processes=['AM', 'CNC', 'CNC_TURNING', 'COMPRESSION_MOLDING', 'EXTRUSION', 'INJECTION_MOLDING', 'SHEET_METAL', 'THERMOFORMING']\nprocess_selection: gated_out=[('CASTING', 'metal process'), ('FORGING', 'metal process'), ('MIM', 'metal process')]\nPSI: user_text_len=0 preview=\"\"\nprocess_selection: cad_lite status=failed\nprocess_selection: sheet_metal_likelihood=low (source=none)\nprocess_selection: extrusion_likelihood=none (coeff_var=? axis=?)\nprocess_selection: am_likelihood=low (source=bins_only)\nprocess_selection: scorer_path=legacy_bins cad_status=none\nPSI: score_diff=5 (primary=INJECTION_MOLDING=10, second=THERMOFORMING=5)\nProcess selection computed: primary=INJECTION_MOLDING user_selected=INJECTION_MOLDING\nprocess_selection: cad_uploaded=y evidence_available=n\nrules: cad_uploaded=y cad_status=none evidence_keys=[]\nreport: process_recommendation present=True primary=INJECTION_MOLDING", "error": null, "error_type": null, "state_has_error": false, "case_id": "edge3_injection_molding_production"}}
{"case_id": "edge4_impeller_cnc", "status": "pass", "result": {"primary": "CNC", "secondary": ["AM"], "eligible_processes": ["CNC", "CNC_TURNING", "AM", "SHEET_METAL", "CASTING", "FORGING", "EXTRUSION", "MIM"], "gated_out": ["COMPRESSION_MOLDING", "INJECTION_MOLDING", "THERMOFORMING"], "cad_lite_status": "failed", "extrusion_lite_status": "failed", "extrusion_likelihood_level": "none", "sheet_metal_likelihood_level": "low", "sheet_metal_likelihood_source": "none", "findings": [{"rule_id": "PASS1", "severity": "LOW", "process": null, "title": "Low feature variety (favorable for cycle time and tooling)"}, {"rule_id": "PASS2", "severity": "LOW", "process": null, "title": "Low accessibility risk (good tool access)"}, {"rule_id": "CAST1", "severity": "MEDIUM", "process": "CASTING", "title": "Low volume + casting (tooling risk)"}, {"rule_id": "FORG1", "severity": "MEDIUM", "process": "FORGING", "title": "Low volume + forging (tooling risk)"}, {"rule_id": "MIM1", "severity": "HIGH", "process": "MIM", "title": "Low volume + MIM (tooling ROI risk)"}], "top_priorities": ["PASS1", "PASS2"], "duration_ms": 91.29, "report": "# CNC Design Review + DFM Report\n\n## Input summary\n\n- Manufacturing process: CNC\n\n- Material: Aluminum\n- Production volume: Proto\n- Load type: Static\n- Tolerance criticality: Medium\n\n- Part size: Medium\n- Min internal radius: Medium\n- Min wall thickness: Medium\n- Hole depth class: None\n- Pocket aspect class: OK\n- Feature variety: Low\n- Accessibility risk: Low\n- Has clamping faces: True\n\n\n## Process recommendation\n\n- Primary: **CNC**\n\n- Secondary: AM\n\n- Less suitable (given current inputs): SHEET_METAL, CASTING, FORGING, EXTRUSION, MIM\n\n- Not applicable (hard gated): INJECTION_MOLDING (polymer process), THERMOFORMING (polymer process), COMPRESSION_MOLDING (polymer process)\n\n- Tradeoffs:\n\n  - Tooling lead time vs unit cost: IM/Sheet metal need tooling; CNC/AM suit low volume.\n\n  - Tolerance and finish: Define critical interfaces; plan post-machining or inspection where needed.\n\n  - Risk drivers: Warpage (IM/AM), supports (AM), setups (CNC/Sheet metal) affect feasibility.\n\n  - Volume sensitivity: IM and sheet metal favor production runs; CNC/AM suit proto and small batch.\n\n  - Documentation: 2D drawing and scale confirmation improve tolerance and process selection.\n\n\n\n## Manufacturing confidence inputs\n\n- CAD uploaded: yes\n\n- CAD analysis status: none\n\n- CAD evidence used in rules: no\n\n- CAD Lite analysis: failed\n\n- Extrusion Lite analysis: failed\n\n- Extrusion likelihood: none (source=none)\n\n- Sheet metal likelihood: low (source=none)\n\n_Confidence inputs not provided._\n\n\n\n## Top priorities\n\n- [LOW] Low feature variety (favorable for cycle time and tooling) (PASS1)\n\n- [LOW] Low accessibility risk (good tool access) (PASS2)\n\n\n\n## Findings (HIGH)\n\n- **Low volume + MIM (tooling ROI risk)** (MIM1) \u2014 MIM has high upfront tooling cost; unit cost only becomes favorable at production volumes.\n  - Recommendation: Consider CNC or AM for low volumes; MIM best for stable designs at production scale.\n\n## Findings (MEDIUM)\n\n- **Low volume + casting (tooling risk)** (CAST1) \u2014 Casting has significant tooling cost; economics favor production runs.\n  - Recommendation: Consider CNC or AM for low volumes; casting best at production scale.\n- **Low volume + forging (tooling risk)** (FORG1) \u2014 Forging has significant die cost; economics favor production runs.\n  - Recommendation: Consider CNC or AM for low volumes; forging best at production scale.\n\n## Findings (LOW)\n\n- **Low feature variety (favorable for cycle time and tooling)** (PASS1) \u2014 Low complexity reduces cycle time and tooling risk.\n  - Recommendation: No change needed.\n- **Low accessibility risk (good tool access)** (PASS2) \u2014 Good tool access reduces setup and machining risk.\n  - Recommendation: No change needed.\n\n## Action Checklist\n\n- [ ] Address HIGH and MEDIUM findings before release.\n- [ ] Apply recommended design changes for critical features.\n- [ ] Re-verify tolerances and interfaces after changes.\n\n## Assumptions\n\n- Inputs and part summary reflect current design intent.\n- Manufacturing process and material choices are as specified.\n\n## Usage (tokens & cost)\n\n_Usage not available._\n\n\n## LLM usage by node\n\n_Not available._\n\n\n## Agent confidence & limitations\n\n_Not available._\n", "trace": "Run started\nInputs validated\nProcess selection node entered\nprocess_selection: eligible_processes=['AM', 'CASTING', 'CNC', 'CNC_TURNING', 'EXTRUSION', 'FORGING', 'MIM', 'SHEET_METAL']\nprocess_selection: gated_out=[('INJECTION_MOLDING', 'polymer process'), ('THERMOFORMING', 'polymer process'), ('COMPRESSION_MOLDING', 'polymer process')]\nPSI: user_text_len=0 preview=\"\"\nprocess_selection: cad_lite status=failed\nprocess_selection: sheet_metal_likelihood=low (source=none)\nprocess_selection: extrusion_likelihood=none (coeff_var=? axis=?)\nprocess_selection: am_likelihood=low (source=bins_only)\nprocess_selection: bins_guard MIM cap for Aluminum\nprocess_selection: scorer_path=legacy_bins cad_status=none\nPSI: score_diff=3 (primary=CNC=5, second=AM=2)\nProcess selection computed: primary=CNC user_selected=CNC\nprocess_selection: cad_uploaded=y evidence_available=n\nrules: cad_uploaded=y cad_status=none evidence_keys=[]\nreport: process_recommendation present=True primary=CNC", "error": null, "error_type": null, "state_has_error": false, "case_id": "edge4_impeller_cnc"}}
{"case_id": "edge5_bracket_ambiguous", "status": "pass", "result": {"primary": "CNC", "secondary": [], "eligible_processes": ["CNC", "CNC_TURNING", "AM", "SHEET_METAL", "CASTING", "FORGING", "EXTRUSION", "MIM"], "gated_out": ["COMPRESSION_MOLDING", "INJECTION_MOLDING", "THERMOFORMING"], "cad_lite_status": "failed", "extrusion_lite_status": "failed", "extrusion_likelihood_level": "none", "sheet_metal_likelihood_level": "low", "sheet_metal_likelihood_source": "none", "findings": [{"rule_id": "PASS1", "severity": "LOW", "process": null, "title": "Low feature variety (favorable for cycle time and tooling)"}, {"rule_id": "PASS2", "severity": "LOW", "process": null, "title": "Low accessibility risk (good tool access)"}, {"rule_id": "CAST1", "severity": "MEDIUM", "process": "CASTING", "title": "Low volume + casting (tooling risk)"}, {"rule_id": "FORG1", "severity": "MEDIUM", "process": "FORGING", "title": "Low volume + forging (tooling risk)"}, {"rule_id": "MIM1", "severity": "HIGH", "process": "MIM", "title": "Low volume + MIM (tooling ROI risk)"}], "top_priorities": ["PASS1", "PASS2"], "duration_ms": 98.44, "report": "# CNC Design Review + DFM Report\n\n## Input summary\n\n- Manufacturing process: CNC\n\n- Material: Steel\n- Production volume: Small batch\n- Load type: Static\n- Tolerance criticality: Medium\n\n- Part size: Medium\n- Min internal radius: Medium\n- Min wall thickness: Medium\n- Hole depth class: None\n- Pocket aspect class: OK\n- Feature variety: Low\n- Accessibility risk: Low\n- Has clamping faces: True\n\n\n## Process recommendation\n\n- Primary: **CNC**\n\n- Secondary: None\n\n- Less suitable (given current inputs): AM, SHEET_METAL, CASTING, FORGING, EXTRUSION, MIM\n\n- Not applicable (hard gated): INJECTION_MOLDING (polymer process), THERMOFORMING (polymer process), COMPRESSION_MOLDING (polymer process)\n\n- Tradeoffs:\n\n  - Tooling lead time vs unit cost: IM/Sheet metal need tooling; CNC/AM suit low volume.\n\n  - Tolerance and finish: Define critical interfaces; plan post-machining or inspection where needed.\n\n  - Risk drivers: Warpage (IM/AM), supports (AM), setups (CNC/Sheet metal) affect feasibility.\n\n  - Volume sensitivity: IM and sheet metal favor production runs; CNC/AM suit proto and small batch.\n\n  - Documentation: 2D drawing and scale confirmation improve tolerance and process selection.\n\n\n\n## Manufacturing confidence inputs\n\n- CAD uploaded: yes\n\n- CAD analysis status: none\n\n- CAD evidence used in rules: no\n\n- CAD Lite analysis: failed\n\n- Extrusion Lite analysis: failed\n\n- Extrusion likelihood: none (source=none)\n\n- Sheet metal likelihood: low (source=none)\n\n_Confidence inputs not provided._\n\n\n\n## Top priorities\n\n- [LOW] Low feature variety (favorable for cycle time and tooling) (PASS1)\n\n- [LOW] Low accessibility risk (good tool access) (PASS2)\n\n\n\n## Findings (HIGH)\n\n- **Low volume + MIM (tooling ROI risk)** (MIM1) \u2014 MIM has high upfront tooling cost; unit cost only becomes favorable at production volumes.\n  - Recommendation: Consider CNC or AM for low volumes; MIM best for stable designs at production scale.\n\n## Findings (MEDIUM)\n\n- **Low volume + casting (tooling risk)** (CAST1) \u2014 Casting has significant tooling cost; economics favor production runs.\n  - Recommendation: Consider CNC or AM for low volumes; casting best at production scale.\n- **Low volume + forging (tooling risk)** (FORG1) \u2014 Forging has significant die cost; economics favor production runs.\n  - Recommendation: Consider CNC or AM for low volumes; forging best at production scale.\n\n## Findings (LOW)\n\n- **Low feature variety (favorable for cycle time and tooling)** (PASS1) \u2014 Low complexity reduces cycle time and tooling risk.\n  - Recommendation: No change needed.\n- **Low accessibility risk (good tool access)** (PASS2) \u2014 Good tool access reduces setup and machining risk.\n  - Recommendation: No change needed.\n\n## Action Checklist\n\n- [ ] Address HIGH and MEDIUM findings before release.\n- [ ] Apply recommended design changes for critical features.\n- [ ] Re-verify tolerances and interfaces after changes.\n\n## Assumptions\n\n- Inputs and part summary reflect current design intent.\n- Manufacturing process and material choices are as specified.\n\n## Usage (tokens & cost)\n\n_Usage not available._\n\n\n## LLM usage by node\n\n_Not available._\n\n\n## Agent confidence & limitations\n\n_Not available._\n", "trace": "Run started\nInputs validated\nProcess selection node entered\nprocess_selection: eligible_processes=['AM', 'CASTING', 'CNC', 'CNC_TURNING', 'EXTRUSION', 'FORGING', 'MIM', 'SHEET_METAL']\nprocess_selection: gated_out=[('INJECTION_MOLDING', 'polymer process'), ('THERMOFORMING', 'polymer process'), ('COMPRESSION_MOLDING', 'polymer process')]\nPSI: user_text_len=0 preview=\"\"\nprocess_selection: cad_lite status=failed\nprocess_selection: sheet_metal_likelihood=low (source=none)\nprocess_selection: extrusion_likelihood=none (coeff_var=? axis=?)\nprocess_selection: am_likelihood=low (source=bins_only)\nprocess_selection: scorer_path=legacy_bins cad_status=none\nPSI: score_diff=4 (primary=CNC=5, second=CNC_TURNING=1)\nProcess selection computed: primary=CNC user_selected=CNC\nprocess_selection: cad_uploaded=y evidence_available=n\nrules: cad_uploaded=y cad_status=none evidence_keys=[]\nreport: process_recommendation present=True primary=CNC", "error": null, "error_type": null, "state_has_error": false, "case_id": "edge5_bracket_ambiguous"}}
{"case_id": "cnc1_bins_template", "status": "pass", "result": {"primary": "CNC", "secondary": [], "eligible_processes": ["CNC", "CNC_TURNING", "AM", "SHEET_METAL", "CASTING", "FORGING", "EXTRUSION", "MIM"], "gated_out": ["COMPRESSION_MOLDING", "INJECTION_MOLDING", "THERMOFORMING"], "cad_lite_status": "ok", "extrusion_lite_status": "ok", "extrusion_likelihood_level": "low", "sheet_metal_likelihood_level": "med", "sheet_metal_likelihood_source": "cad_lite", "findings": [{"rule_id": "PASS1", "severity": "LOW", "process": null, "title": "Low feature variety (favorable for cycle time and tooling)"}, {"rule_id": "PASS2", "severity": "LOW", "process": null, "title": "Low accessibility risk (good tool access)"}, {"rule_id": "CAST1", "severity": "MEDIUM", "process": "CASTING", "title": "Low volume + casting (tooling risk)"}, {"rule_id": "FORG1", "severity": "MEDIUM", "process": "FORGING", "title": "Low volume + forging (tooling risk)"}, {"rule_id": "MIM1", "severity": "HIGH", "process": "MIM", "title": "Low volume + MIM (tooling ROI risk)"}], "top_priorities": ["PASS1", "PASS2"], "duration_ms": 91.21, "report": "# CNC Design Review + DFM Report\n\n## Input summary\n\n- Manufacturing process: CNC\n\n- Material: Steel\n- Production volume: Small batch\n- Load type: Static\n- Tolerance criticality: Medium\n\n- Part size: Medium\n- Min internal radius: Medium\n- Min wall thickness: Medium\n- Hole depth class: None\n- Pocket aspect class: OK\n- Feature variety: Low\n- Accessibility risk: Low\n- Has clamping faces: True\n\n\n## Process recommendation\n\n- Primary: **CNC**\n\n- Secondary: None\n\n- Less suitable (given current inputs): AM, CASTING, FORGING, EXTRUSION, MIM\n\n- Not applicable (hard gated): INJECTION_MOLDING (polymer process), THERMOFORMING (polymer process), COMPRESSION_MOLDING (polymer process)\n\n- Tradeoffs:\n\n  - Tooling lead time vs unit cost: IM/Sheet metal need tooling; CNC/AM suit low volume.\n\n  - Tolerance and finish: Define critical interfaces; plan post-machining or inspection where needed.\n\n  - Risk drivers: Warpage (IM/AM), supports (AM), setups (CNC/Sheet metal) affect feasibility.\n\n  - Volume sensitivity: IM and sheet metal favor production runs; CNC/AM suit proto and small batch.\n\n  - Documentation: 2D drawing and scale confirmation improve tolerance and process selection.\n\n\n\n## Manufacturing confidence inputs\n\n- CAD uploaded: yes\n\n- CAD analysis status: none\n\n- CAD evidence used in rules: no\n\n- CAD Lite analysis: ok\n\n- Extrusion Lite analysis: ok\n\n- Extrusion likelihood: low (source=extrusion_lite)\n\n- Sheet metal likelihood: med (source=cad_lite)\n\n_Confidence inputs not provided._\n\n\n\n## Top priorities\n\n- [LOW] Low feature variety (favorable for cycle time and tooling) (PASS1)\n\n- [LOW] Low accessibility risk (good tool access) (PASS2)\n\n\n\n## Findings (HIGH)\n\n- **Low volume + MIM (tooling ROI risk)** (MIM1) \u2014 MIM has high upfront tooling cost; unit cost only becomes favorable at production volumes.\n  - Recommendation: Consider CNC or AM for low volumes; MIM best for stable designs at production scale.\n\n## Findings (MEDIUM)\n\n- **Low volume + casting (tooling risk)** (CAST1) \u2014 Casting has significant tooling cost; economics favor production runs.\n  - Recommendation: Consider CNC or AM for low volumes; casting best at production scale.\n- **Low volume + forging (tooling risk)** (FORG1) \u2014 Forging has significant die cost; economics favor production runs.\n  - Recommendation: Consider CNC or AM for low volumes; forging best at production scale.\n\n## Findings (LOW)\n\n- **Low feature variety (favorable for cycle time and tooling)** (PASS1) \u2014 Low complexity reduces cycle time and tooling risk.\n  - Recommendation: No change needed.\n- **Low accessibility risk (good tool access)** (PASS2) \u2014 Good tool access reduces setup and machining risk.\n  - Recommendation: No change needed.\n\n## Action Checklist\n\n- [ ] Address HIGH and MEDIUM findings before release.\n- [ ] Apply recommended design changes for critical features.\n- [ ] Re-verify tolerances and interfaces after changes.\n\n## Assumptions\n\n- Inputs and part summary reflect current design intent.\n- Manufacturing process and material choices are as specified.\n\n## Usage (tokens & cost)\n\n_Usage not available._\n\n\n## LLM usage by node\n\n_Not available._\n\n\n## Agent confidence & limitations\n\n_Not available._\n", "trace": "Run started\nInputs validated\nProcess selection node entered\nprocess_selection: eligible_processes=['AM', 'CASTING', 'CNC', 'CNC_TURNING', 'EXTRUSION', 'FORGING', 'MIM', 'SHEET_METAL']\nprocess_selection: gated_out=[('INJECTION_MOLDING', 'polymer process'), ('THERMOFORMING', 'polymer process'), ('COMPRESSION_MOLDING', 'polymer process')]\nPSI: user_text_len=0 preview=\"\"\nprocess_selection: cad_lite status=ok t_est=13.4597 av_ratio=0.1486 t_over_min_dim=0.1869\nprocess_selection: sheet_metal_likelihood=med (source=cad_lite)\nprocess_selection: extrusion_likelihood=low (coeff_var=0.759286 axis=X)\nprocess_selection: am_likelihood=low (source=bins_only)\nprocess_selection: scorer_path=legacy_bins cad_status=none\nPSI: score_diff=2 (primary=CNC=5, second=SHEET_METAL=3)\nProcess selection computed: primary=CNC user_selected=CNC\nprocess_selection: cad_uploaded=y evidence_available=n\nrules: cad_uploaded=y cad_status=none evidence_keys=[]\nreport: process_recommendation present=True primary=CNC", "error": null, "error_type": null, "state_has_error": false, "case_id": "cnc1_bins_template"}}
{"case_id": "cnc2_bins_template", "status": "pass", "result": {"primary": "CNC", "secondary": [], "eligible_processes": ["CNC", "CNC_TURNING", "AM", "SHEET_METAL", "CASTING", "FORGING", "EXTRUSION", "MIM"], "gated_out": ["COMPRESSION_MOLDING", "INJECTION_MOLDING", "THERMOFORMING"], "cad_lite_status": "ok", "extrusion_lite_status": "ok", "extrusion_likelihood_level": "low", "sheet_metal_likelihood_level": "med", "sheet_metal_likelihood_source": "cad_lite", "findings": [{"rule_id": "PASS1", "severity": "LOW", "process": null, "title": "Low feature variety (favorable for cycle time and tooling)"}, {"rule_id": "PASS2", "severity": "LOW", "process": null, "title": "Low accessibility risk (good tool access)"}, {"rule_id": "CAST1", "severity": "MEDIUM", "process": "CASTING", "title": "Low volume + casting (tooling risk)"}, {"rule_id": "FORG1", "severity": "MEDIUM", "process": "FORGING", "title": "Low volume + forging (tooling risk)"}, {"rule_id": "MIM1", "severity": "HIGH", "process": "MIM", "title": "Low volume + MIM (tooling ROI risk)"}], "top_priorities": ["PASS1", "PASS2"], "duration_ms": 92.88, "report": "# CNC Design Review + DFM Report\n\n## Input summary\n\n- Manufacturing process: CNC\n\n- Material: Steel\n- Production volume: Small batch\n- Load type: Static\n- Tolerance criticality: Medium\n\n- Part size: Medium\n- Min internal radius: Medium\n- Min wall thickness: Medium\n- Hole depth class: None\n- Pocket aspect class: OK\n- Feature variety: Low\n- Accessibility risk: Low\n- Has clamping faces: True\n\n\n## Process recommendation\n\n- Primary: **CNC**\n\n- Secondary: None\n\n- Less suitable (given current inputs): AM, CASTING, FORGING, EXTRUSION, MIM\n\n- Not applicable (hard gated): INJECTION_MOLDING (polymer process), THERMOFORMING (polymer process), COMPRESSION_MOLDING (polymer process)\n\n- Tradeoffs:\n\n  - Tooling lead time vs unit cost: IM/Sheet metal need tooling; CNC/AM suit low volume.\n\n  - Tolerance and finish: Define critical interfaces; plan post-machining or inspection where needed.\n\n  - Risk drivers: Warpage (IM/AM), supports (AM), setups (CNC/Sheet metal) affect feasibility.\n\n  - Volume sensitivity: IM and sheet metal favor production runs; CNC/AM suit proto and small batch.\n\n  - Documentation: 2D drawing and scale confirmation improve tolerance and process selection.\n\n\n\n## Manufacturing confidence inputs\n\n- CAD uploaded: yes\n\n- CAD analysis status: none\n\n- CAD evidence used in rules: no\n\n- CAD Lite analysis: ok\n\n- Extrusion Lite analysis: ok\n\n- Extrusion likelihood: low (source=extrusion_lite)\n\n- Sheet metal likelihood: med (source=cad_lite)\n\n_Confidence inputs not provided._\n\n\n\n## Top priorities\n\n- [LOW] Low feature variety (favorable for cycle time and tooling) (PASS1)\n\n- [LOW] Low accessibility risk (good tool access) (PASS2)\n\n\n\n## Findings (HIGH)\n\n- **Low volume + MIM (tooling ROI risk)** (MIM1) \u2014 MIM has high upfront tooling cost; unit cost only becomes favorable at production volumes.\n  - Recommendation: Consider CNC or AM for low volumes; MIM best for stable designs at production scale.\n\n## Findings (MEDIUM)\n\n- **Low volume + casting (tooling risk)** (CAST1) \u2014 Casting has significant tooling cost; economics favor production runs.\n  - Recommendation: Consider CNC or AM for low volumes; casting best at production scale.\n- **Low volume + forging (tooling risk)** (FORG1) \u2014 Forging has significant die cost; economics favor production runs.\n  - Recommendation: Consider CNC or AM for low volumes; forging best at production scale.\n\n## Findings (LOW)\n\n- **Low feature variety (favorable for cycle time and tooling)** (PASS1) \u2014 Low complexity reduces cycle time and tooling risk.\n  - Recommendation: No change needed.\n- **Low accessibility risk (good tool access)** (PASS2) \u2014 Good tool access reduces setup and machining risk.\n  - Recommendation: No change needed.\n\n## Action Checklist\n\n- [ ] Address HIGH and MEDIUM findings before release.\n- [ ] Apply recommended design changes for critical features.\n- [ ] Re-verify tolerances and interfaces after changes.\n\n## Assumptions\n\n- Inputs and part summary reflect current design intent.\n- Manufacturing process and material choices are as specified.\n\n## Usage (tokens & cost)\n\n_Usage not available._\n\n\n## LLM usage by node\n\n_Not available._\n\n\n## Agent confidence & limitations\n\n_Not available._\n", "trace": "Run started\nInputs validated\nProcess selection node entered\nprocess_selection: eligible_processes=['AM', 'CASTING', 'CNC', 'CNC_TURNING', 'EXTRUSION', 'FORGING', 'MIM', 'SHEET_METAL']\nprocess_selection: gated_out=[('INJECTION_MOLDING', 'polymer process'), ('THERMOFORMING', 'polymer process'), ('COMPRESSION_MOLDING', 'polymer process')]\nPSI: user_text_len=0 preview=\"\"\nprocess_selection: cad_lite status=ok t_est=8.5037 av_ratio=0.2352 t_over_min_dim=0.0945\nprocess_selection: sheet_metal_likelihood=med (source=cad_lite)\nprocess_selection: extrusion_likelihood=low (coeff_var=0.644099 axis=Z)\nprocess_selection: am_likelihood=low (source=bins_only)\nprocess_selection: scorer_path=legacy_bins cad_status=none\nPSI: score_diff=2 (primary=CNC=5, second=SHEET_METAL=3)\nProcess selection computed: primary=CNC user_selected=CNC\nprocess_selection: cad_uploaded=y evidence_available=n\nrules: cad_uploaded=y cad_status=none evidence_keys=[]\nreport: process_recommendation present=True primary=CNC", "error": null, "error_type": null, "state_has_error": false, "case_id": "cnc2_bins_template"}}
{"case_id": "cnc3_bins_template", "status": "pass", "result": {"primary": "CNC", "secondary": [], "eligible_processes": ["CNC", "CNC_TURNING", "AM", "SHEET_METAL", "CASTING", "FORGING", "EXTRUSION", "MIM"], "gated_out": ["COMPRESSION_MOLDING", "INJECTION_MOLDING", "THERMOFORMING"], "cad_lite_status": "ok", "extrusion_lite_status": "ok", "extrusion_likelihood_level": "low", "sheet_metal_likelihood_level": "med", "sheet_metal_likelihood_source": "cad_lite", "findings": [{"rule_id": "PASS1", "severity": "LOW", "process": null, "title": "Low feature variety (favorable for cycle time and tooling)"}, {"rule_id": "PASS2", "severity": "LOW", "process": null, "title": "Low accessibility risk (good tool access)"}, {"rule_id": "CAST1", "severity": "MEDIUM", "process": "CASTING", "title": "Low volume + casting (tooling risk)"}, {"rule_id": "FORG1", "severity": "MEDIUM", "process": "FORGING", "title": "Low volume + forging (tooling risk)"}, {"rule_id": "MIM1", "severity": "HIGH", "process": "MIM", "title": "Low volume + MIM (tooling ROI risk)"}], "top_priorities": ["PASS1", "PASS2"], "duration_ms": 93.61, "report": "# CNC Design Review + DFM Report\n\n## Input summary\n\n- Manufacturing process: CNC\n\n- Material: Steel\n- Production volume: Small batch\n- Load type: Static\n- Tolerance criticality: Medium\n\n- Part size: Medium\n- Min internal radius: Medium\n- Min wall thickness: Medium\n- Hole depth class: None\n- Pocket aspect class: OK\n- Feature variety: Low\n- Accessibility risk: Low\n- Has clamping faces: True\n\n\n## Process recommendation\n\n- Primary: **CNC**\n\n- Secondary: None\n\n- Less suitable (given current inputs): AM, CASTING, FORGING, EXTRUSION, MIM\n\n- Not applicable (hard gated): INJECTION_MOLDING (polymer process), THERMOFORMING (polymer process), COMPRESSION_MOLDING (polymer process)\n\n- Tradeoffs:\n\n  - Tooling lead time vs unit cost: IM/Sheet metal need tooling; CNC/AM suit low volume.\n\n  - Tolerance and finish: Define critical interfaces; plan post-machining or inspection where needed.\n\n  - Risk drivers: Warpage (IM/AM), supports (AM), setups (CNC/Sheet metal) affect feasibility.\n\n  - Volume sensitivity: IM and sheet metal favor production runs; CNC/AM suit proto and small batch.\n\n  - Documentation: 2D drawing and scale confirmation improve tolerance and process selection.\n\n\n\n## Manufacturing confidence inputs\n\n- CAD uploaded: yes\n\n- CAD analysis status: none\n\n- CAD evidence used in rules: no\n\n- CAD Lite analysis: ok\n\n- Extrusion Lite analysis: ok\n\n- Extrusion likelihood: low (source=extrusion_lite)\n\n- Sheet metal likelihood: med (source=cad_lite)\n\n_Confidence inputs not provided._\n\n\n\n## Top priorities\n\n- [LOW] Low feature variety (favorable for cycle time and tooling) (PASS1)\n\n- [LOW] Low accessibility risk (good tool access) (PASS2)\n\n\n\n## Findings (HIGH)\n\n- **Low volume + MIM (tooling ROI risk)** (MIM1) \u2014 MIM has high upfront tooling cost; unit cost only becomes favorable at production volumes.\n  - Recommendation: Consider CNC or AM for low volumes; MIM best for stable designs at production scale.\n\n## Findings (MEDIUM)\n\n- **Low volume + casting (tooling risk)** (CAST1) \u2014 Casting has significant tooling cost; economics favor production runs.\n  - Recommendation: Consider CNC or AM for low volumes; casting best at production scale.\n- **Low volume + forging (tooling risk)** (FORG1) \u2014 Forging has significant die cost; economics favor production runs.\n  - Recommendation: Consider CNC or AM for low volumes; forging best at production scale.\n\n## Findings (LOW)\n\n- **Low feature variety (favorable for cycle time and tooling)** (PASS1) \u2014 Low complexity reduces cycle time and tooling risk.\n  - Recommendation: No change needed.\n- **Low accessibility risk (good tool access)** (PASS2) \u2014 Good tool access reduces setup and machining risk.\n  - Recommendation: No change needed.\n\n## Action Checklist\n\n- [ ] Address HIGH and MEDIUM findings before release.\n- [ ] Apply recommended design changes for critical features.\n- [ ] Re-verify tolerances and interfaces after changes.\n\n## Assumptions\n\n- Inputs and part summary reflect current design intent.\n- Manufacturing process and material choices are as specified.\n\n## Usage (tokens & cost)\n\n_Usage not available._\n\n\n## LLM usage by node\n\n_Not available._\n\n\n## Agent confidence & limitations\n\n_Not available._\n", "trace": "Run started\nInputs validated\nProcess selection node entered\nprocess_selection: eligible_processes=['AM', 'CASTING', 'CNC', 'CNC_TURNING', 'EXTRUSION', 'FORGING', 'MIM', 'SHEET_METAL']\nprocess_selection: gated_out=[('INJECTION_MOLDING', 'polymer process'), ('THERMOFORMING', 'polymer process'), ('COMPRESSION_MOLDING', 'polymer process')]\nPSI: user_text_len=0 preview=\"\"\nprocess_selection: cad_lite status=ok t_est=5.2318 av_ratio=0.3823 t_over_min_dim=0.2754\nprocess_selection: sheet_metal_likelihood=med (source=cad_lite)\nprocess_selection: extrusion_likelihood=low (coeff_var=0.328631 axis=X)\nprocess_selection: am_likelihood=low (source=bins_only)\nprocess_selection: scorer_path=legacy_bins cad_status=none\nPSI: score_diff=2 (primary=CNC=5, second=SHEET_METAL=3)\nProcess selection computed: primary=CNC user_selected=CNC\nprocess_selection: cad_uploaded=y evidence_available=n\nrules: cad_uploaded=y cad_status=none evidence_keys=[]\nreport: process_recommendation present=True primary=CNC", "error": null, "error_type": null, "state_has_error": false, "case_id": "cnc3_bins_template"}}
{"case_id": "cnc4_bins_template", "status": "pass", "result": {"primary": "CNC", "secondary": [], "eligible_processes": ["CNC", "CNC_TURNING", "AM", "SHEET_METAL", "CASTING", "FORGING", "EXTRUSION", "MIM"], "gated_out": ["COMPRESSION_MOLDING", "INJECTION_MOLDING", "THERMOFORMING"], "cad_lite_status": "failed", "extrusion_lite_status": "failed", "extrusion_likelihood_level": "none", "sheet_metal_likelihood_level": "low", "sheet_metal_likelihood_source": "none", "findings": [{"rule_id": "PASS1", "severity": "LOW", "process": null, "title": "Low feature variety (favorable for cycle time and tooling)"}, {"rule_id": "PASS2", "severity": "LOW", "process": null, "title": "Low accessibility risk (good tool access)"}, {"rule_id": "CAST1", "severity": "MEDIUM", "process": "CASTING", "title": "Low volume + casting (tooling risk)"}, {"rule_id": "FORG1", "severity": "MEDIUM", "process": "FORGING", "title": "Low volume + forging (tooling risk)"}, {"rule_id": "MIM1", "severity": "HIGH", "process": "MIM", "title": "Low volume + MIM (tooling ROI risk)"}], "top_priorities": ["PASS1", "PASS2"], "duration_ms": 94.6, "report": "# CNC Design Review + DFM Report\n\n## Input summary\n\n- Manufacturing process: CNC\n\n- Material: Steel\n- Production volume: Small batch\n- Load type: Static\n- Tolerance criticality: Medium\n\n- Part size: Medium\n- Min internal radius: Medium\n- Min wall thickness: Medium\n- Hole depth class: None\n- Pocket aspect class: OK\n- Feature variety: Low\n- Accessibility risk: Low\n- Has clamping faces: True\n\n\n## Process recommendation\n\n- Primary: **CNC**\n\n- Secondary: None\n\n- Less suitable (given current inputs): AM, SHEET_METAL, CASTING, FORGING, EXTRUSION, MIM\n\n- Not applicable (hard gated): INJECTION_MOLDING (polymer process), THERMOFORMING (polymer process), COMPRESSION_MOLDING (polymer process)\n\n- Tradeoffs:\n\n  - Tooling lead time vs unit cost: IM/Sheet metal need tooling; CNC/AM suit low volume.\n\n  - Tolerance and finish: Define critical interfaces; plan post-machining or inspection where needed.\n\n  - Risk drivers: Warpage (IM/AM), supports (AM), setups (CNC/Sheet metal) affect feasibility.\n\n  - Volume sensitivity: IM and sheet metal favor production runs; CNC/AM suit proto and small batch.\n\n  - Documentation: 2D drawing and scale confirmation improve tolerance and process selection.\n\n\n\n## Manufacturing confidence inputs\n\n- CAD uploaded: yes\n\n- CAD analysis status: none\n\n- CAD evidence used in rules: no\n\n- CAD Lite analysis: failed\n\n- Extrusion Lite analysis: failed\n\n- Extrusion likelihood: none (source=none)\n\n- Sheet metal likelihood: low (source=none)\n\n_Confidence inputs not provided._\n\n\n\n## Top priorities\n\n- [LOW] Low feature variety (favorable for cycle time and tooling) (PASS1)\n\n- [LOW] Low accessibility risk (good tool access) (PASS2)\n\n\n\n## Findings (HIGH)\n\n- **Low volume + MIM (tooling ROI risk)** (MIM1) \u2014 MIM has high upfront tooling cost; unit cost only becomes favorable at production volumes.\n  - Recommendation: Consider CNC or AM for low volumes; MIM best for stable designs at production scale.\n\n## Findings (MEDIUM)\n\n- **Low volume + casting (tooling risk)** (CAST1) \u2014 Casting has significant tooling cost; economics favor production runs.\n  - Recommendation: Consider CNC or AM for low volumes; casting best at production scale.\n- **Low volume + forging (tooling risk)** (FORG1) \u2014 Forging has significant die cost; economics favor production runs.\n  - Recommendation: Consider CNC or AM for low volumes; forging best at production scale.\n\n## Findings (LOW)\n\n- **Low feature variety (favorable for cycle time and tooling)** (PASS1) \u2014 Low complexity reduces cycle time and tooling risk.\n  - Recommendation: No change needed.\n- **Low accessibility risk (good tool access)** (PASS2) \u2014 Good tool access reduces setup and machining risk.\n  - Recommendation: No change needed.\n\n## Action Checklist\n\n- [ ] Address HIGH and MEDIUM findings before release.\n- [ ] Apply recommended design changes for critical features.\n- [ ] Re-verify tolerances and interfaces after changes.\n\n## Assumptions\n\n- Inputs and part summary reflect current design intent.\n- Manufacturing process and material choices are as specified.\n\n## Usage (tokens & cost)\n\n_Usage not available._\n\n\n## LLM usage by node\n\n_Not available._\n\n\n## Agent confidence & limitations\n\n_Not available._\n", "trace": "Run started\nInputs validated\nProcess selection node entered\nprocess_selection: eligible_processes=['AM', 'CASTING', 'CNC', 'CNC_TURNING', 'EXTRUSION', 'FORGING', 'MIM', 'SHEET_METAL']\nprocess_selection: gated_out=[('INJECTION_MOLDING', 'polymer process'), ('THERMOFORMING', 'polymer process'), ('COMPRESSION_MOLDING', 'polymer process')]\nPSI: user_text_len=0 preview=\"\"\nprocess_selection: cad_lite status=failed\nprocess_selection: sheet_metal_likelihood=low (source=none)\nprocess_selection: extrusion_likelihood=none (coeff_var=? axis=?)\nprocess_selection: am_likelihood=low (source=bins_only)\nprocess_selection: scorer_path=legacy_bins cad_status=none\nPSI: score_diff=4 (primary=CNC=5, second=CNC_TURNING=1)\nProcess selection computed: primary=CNC user_selected=CNC\nprocess_selection: cad_uploaded=y evidence_available=n\nrules: cad_uploaded=y cad_status=none evidence_keys=[]\nreport: process_recommendation present=True primary=CNC", "error": null, "error_type": null, "state_has_error": false, "case_id": "cnc4_bins_template"}}
{"case_id": "cnc_turning1_bins_template", "status": "pass", "result": {"primary": "CNC_TURNING", "secondary": ["CNC"], "eligible_processes": ["CNC", "CNC_TURNING", "AM", "SHEET_METAL", "CASTING", "FORGING", "EXTRUSION", "MIM"], "gated_out": ["COMPRESSION_MOLDING", "INJECTION_MOLDING", "THERMOFORMING"], "cad_lite_status": "ok", "extrusion_lite_status": "ok", "extrusion_likelihood_level": "low", "sheet_metal_likelihood_level": "med", "sheet_metal_likelihood_source": "cad_lite", "findings": [{"rule_id": "TURN1", "severity": "MEDIUM", "process": null, "title": "Turning: L/D ratio unknown (upload STEP for slenderness chec"}, {"rule_id": "CAST1", "severity": "MEDIUM", "process": "CASTING", "title": "Low volume + casting (tooling risk)"}, {"rule_id": "FORG1", "severity": "MEDIUM", "process": "FORGING", "title": "Low volume + forging (tooling risk)"}, {"rule_id": "MIM1", "severity": "HIGH", "process": "MIM", "title": "Low volume + MIM (tooling ROI risk)"}], "top_priorities": ["TURN1"], "duration_ms": 102.72, "report": "# CNC Design Review + DFM Report\n\n## Input summary\n\n- Manufacturing process: CNC_TURNING\n\n- Material: Steel\n- Production volume: Small batch\n- Load type: Static\n- Tolerance criticality: Medium\n\n- Part size: Medium\n- Min internal radius: Medium\n- Min wall thickness: Medium\n- Hole depth class: None\n- Pocket aspect class: OK\n- Feature variety: Low\n- Accessibility risk: Low\n- Has clamping faces: True\n\n\n## Process recommendation\n\n- Primary: **CNC_TURNING**\n\n- Secondary: CNC\n\n- Less suitable (given current inputs): CASTING, FORGING, MIM\n\n- Not applicable (hard gated): INJECTION_MOLDING (polymer process), THERMOFORMING (polymer process), COMPRESSION_MOLDING (polymer process)\n\n- Tradeoffs:\n\n  - Tooling lead time vs unit cost: IM/Sheet metal need tooling; CNC/AM suit low volume.\n\n  - Tolerance and finish: Define critical interfaces; plan post-machining or inspection where needed.\n\n  - Risk drivers: Warpage (IM/AM), supports (AM), setups (CNC/Sheet metal) affect feasibility.\n\n  - Volume sensitivity: IM and sheet metal favor production runs; CNC/AM suit proto and small batch.\n\n  - Documentation: 2D drawing and scale confirmation improve tolerance and process selection.\n\n\n\n## Manufacturing confidence inputs\n\n- CAD uploaded: yes\n\n- CAD analysis status: none\n\n- CAD evidence used in rules: no\n\n- CAD Lite analysis: ok\n\n- Extrusion Lite analysis: ok\n\n- Extrusion likelihood: low (source=extrusion_lite)\n\n- Sheet metal likelihood: med (source=cad_lite)\n\n_Confidence inputs not provided._\n\n\n\n## Top priorities\n\n- [MEDIUM] Turning: L/D ratio unknown (upload STEP for slenderness check) (TURN1)\n\n\n\n## Findings (HIGH)\n\n- **Low volume + MIM (tooling ROI risk)** (MIM1) \u2014 MIM has high upfront tooling cost; unit cost only becomes favorable at production volumes.\n  - Recommendation: Consider CNC or AM for low volumes; MIM best for stable designs at production scale.\n\n## Findings (MEDIUM)\n\n- **Turning: L/D ratio unknown (upload STEP for slenderness check)** (TURN1) \u2014 Slenderness strongly affects deflection and chatter risk in turning; without geometry metrics this cannot be assessed reliably.\n  - Recommendation: Upload a STEP model or provide key dimensions; confirm whether tailstock/steady rest will be used for slender parts.\n- **Low volume + casting (tooling risk)** (CAST1) \u2014 Casting has significant tooling cost; economics favor production runs.\n  - Recommendation: Consider CNC or AM for low volumes; casting best at production scale.\n- **Low volume + forging (tooling risk)** (FORG1) \u2014 Forging has significant die cost; economics favor production runs.\n  - Recommendation: Consider CNC or AM for low volumes; forging best at production scale.\n\n## Findings (LOW)\n\n_None_\n\n## Action Checklist\n\n- [ ] Address HIGH and MEDIUM findings before release.\n- [ ] Apply recommended design changes for critical features.\n- [ ] Re-verify tolerances and interfaces after changes.\n\n## Assumptions\n\n- Inputs and part summary reflect current design intent.\n- Manufacturing process and material choices are as specified.\n\n## Usage (tokens & cost)\n\n_Usage not available._\n\n\n## LLM usage by node\n\n_Not available._\n\n\n## Agent confidence & limitations\n\n_Not available._\n", "trace": "Run started\nInputs validated\nProcess selection node entered\nprocess_selection: eligible_processes=['AM', 'CASTING', 'CNC', 'CNC_TURNING', 'EXTRUSION', 'FORGING', 'MIM', 'SHEET_METAL']\nprocess_selection: gated_out=[('INJECTION_MOLDING', 'polymer process'), ('THERMOFORMING', 'polymer process'), ('COMPRESSION_MOLDING', 'polymer process')]\nPSI: user_text_len=0 preview=\"\"\nprocess_selection: cad_lite status=ok t_est=6.9762 av_ratio=0.2867 t_over_min_dim=0.2325\nprocess_selection: sheet_metal_likelihood=med (source=cad_lite)\nprocess_selection: extrusion_likelihood=low (coeff_var=0.235114 axis=X)\nprocess_selection: am_likelihood=low (source=bins_only)\nprocess_selection: scorer_path=legacy_bins cad_status=none\nprocess_selection: bins_anchor applied selected=CNC_TURNING margin=2 top_was=CNC\nPSI: score_diff=0 (primary=CNC_TURNING=3, second=CNC_TURNING=3)\nPSI tie-break: prefer user-selected flexible process (CNC_TURNING) when score_diff <= 1 (compatible, no strong mismatch)\nPSI: final score_diff=0 (after tie-break, primary changed from CNC to CNC_TURNING)\nProcess selection computed: primary=CNC_TURNING user_selected=CNC_TURNING\nprocess_selection: cad_uploaded=y evidence_available=n\nrules: cad_uploaded=y cad_status=none evidence_keys=[]\nreport: process_recommendation present=True primary=CNC_TURNING", "error": null, "error_type": null, "state_has_error": false, "case_id": "cnc_turning1_bins_template"}}
{"case_id": "cnc_turning2_bins_template", "status": "pass", "result": {"primary": "CNC_TURNING", "secondary": ["CNC"], "eligible_processes": ["CNC", "CNC_TURNING", "AM", "SHEET_METAL", "CASTING", "FORGING", "EXTRUSION", "MIM"], "gated_out": ["COMPRESSION_MOLDING", "INJECTION_MOLDING", "THERMOFORMING"], "cad_lite_status": "failed", "extrusion_lite_status": "failed", "extrusion_likelihood_level": "none", "sheet_metal_likelihood_level": "low", "sheet_metal_likelihood_source": "none", "findings": [{"rule_id": "TURN1", "severity": "MEDIUM", "process": null, "title": "Turning: L/D ratio unknown (upload STEP for slenderness chec"}, {"rule_id": "CAST1", "severity": "MEDIUM", "process": "CASTING", "title": "Low volume + casting (tooling risk)"}, {"rule_id": "FORG1", "severity": "MEDIUM", "process": "FORGING", "title": "Low volume + forging (tooling risk)"}, {"rule_id": "MIM1", "severity": "HIGH", "process": "MIM", "title": "Low volume + MIM (tooling ROI risk)"}], "top_priorities": ["TURN1"], "duration_ms": 101.01, "report": "# CNC Design Review + DFM Report\n\n## Input summary\n\n- Manufacturing process: CNC_TURNING\n\n- Material: Steel\n- Production volume: Small batch\n- Load type: Static\n- Tolerance criticality: Medium\n\n- Part size: Medium\n- Min internal radius: Medium\n- Min wall thickness: Medium\n- Hole depth class: None\n- Pocket aspect class: OK\n- Feature variety: Low\n- Accessibility risk: Low\n- Has clamping faces: True\n\n\n## Process recommendation\n\n- Primary: **CNC_TURNING**\n\n- Secondary: CNC\n\n- Less suitable (given current inputs): CASTING, FORGING, MIM\n\n- Not applicable (hard gated): INJECTION_MOLDING (polymer process), THERMOFORMING (polymer process), COMPRESSION_MOLDING (polymer process)\n\n- Tradeoffs:\n\n  - Tooling lead time vs unit cost: IM/Sheet metal need tooling; CNC/AM suit low volume.\n\n  - Tolerance and finish: Define critical interfaces; plan post-machining or inspection where needed.\n\n  - Risk drivers: Warpage (IM/AM), supports (AM), setups (CNC/Sheet metal) affect feasibility.\n\n  - Volume sensitivity: IM and sheet metal favor production runs; CNC/AM suit proto and small batch.\n\n  - Documentation: 2D drawing and scale confirmation improve tolerance and process selection.\n\n\n\n## Manufacturing confidence inputs\n\n- CAD uploaded: yes\n\n- CAD analysis status: none\n\n- CAD evidence used in rules: no\n\n- CAD Lite analysis: failed\n\n- Extrusion Lite analysis: failed\n\n- Extrusion likelihood: none (source=none)\n\n- Sheet metal likelihood: low (source=none)\n\n_Confidence inputs not provided._\n\n\n\n## Top priorities\n\n- [MEDIUM] Turning: L/D ratio unknown (upload STEP for slenderness check) (TURN1)\n\n\n\n## Findings (HIGH)\n\n- **Low volume + MIM (tooling ROI risk)** (MIM1) \u2014 MIM has high upfront tooling cost; unit cost only becomes favorable at production volumes.\n  - Recommendation: Consider CNC or AM for low volumes; MIM best for stable designs at production scale.\n\n## Findings (MEDIUM)\n\n- **Turning: L/D ratio unknown (upload STEP for slenderness check)** (TURN1) \u2014 Slenderness strongly affects deflection and chatter risk in turning; without geometry metrics this cannot be assessed reliably.\n  - Recommendation: Upload a STEP model or provide key dimensions; confirm whether tailstock/steady rest will be used for slender parts.\n- **Low volume + casting (tooling risk)** (CAST1) \u2014 Casting has significant tooling cost; economics favor production runs.\n  - Recommendation: Consider CNC or AM for low volumes; casting best at production scale.\n- **Low volume + forging (tooling risk)** (FORG1) \u2014 Forging has significant die cost; economics favor production runs.\n  - Recommendation: Consider CNC or AM for low volumes; forging best at production scale.\n\n## Findings (LOW)\n\n_None_\n\n## Action Checklist\n\n- [ ] Address HIGH and MEDIUM findings before release.\n- [ ] Apply recommended design changes for critical features.\n- [ ] Re-verify tolerances and interfaces after changes.\n\n## Assumptions\n\n- Inputs and part summary reflect current design intent.\n- Manufacturing process and material choices are as specified.\n\n## Usage (tokens & cost)\n\n_Usage not available._\n\n\n## LLM usage by node\n\n_Not available._\n\n\n## Agent confidence & limitations\n\n_Not available._\n", "trace": "Run started\nInputs validated\nProcess selection node entered\nprocess_selection: eligible_processes=['AM', 'CASTING', 'CNC', 'CNC_TURNING', 'EXTRUSION', 'FORGING', 'MIM', 'SHEET_METAL']\nprocess_selection: gated_out=[('INJECTION_MOLDING', 'polymer process'), ('THERMOFORMING', 'polymer process'), ('COMPRESSION_MOLDING', 'polymer process')]\nPSI: user_text_len=0 preview=\"\"\nprocess_selection: cad_lite status=failed\nprocess_selection: sheet_metal_likelihood=low (source=none)\nprocess_selection: extrusion_likelihood=none (coeff_var=? axis=?)\nprocess_selection: am_likelihood=low (source=bins_only)\nprocess_selection: scorer_path=legacy_bins cad_status=none\nprocess_selection: bins_anchor applied selected=CNC_TURNING margin=2 top_was=CNC\nPSI: score_diff=0 (primary=CNC_TURNING=3, second=CNC_TURNING=3)\nPSI tie-break: prefer user-selected flexible process (CNC_TURNING) when score_diff <= 1 (compatible, no strong mismatch)\nPSI: final score_diff=0 (after tie-break, primary changed from CNC to CNC_TURNING)\nProcess selection computed: primary=CNC_TURNING user_selected=CNC_TURNING\nprocess_selection: cad_uploaded=y evidence_available=n\nrules: cad_uploaded=y cad_status=none evidence_keys=[]\nreport: process_recommendation present=True primary=CNC_TURNING", "error": null, "error_type": null, "state_has_error": false, "case_id": "cnc_turning2_bins_template"}}
{"case_id": "cnc_turning3_bins_template", "status": "pass", "result": {"primary": "CNC_TURNING", "secondary": ["CNC"], "eligible_processes": ["CNC", "CNC_TURNING", "AM", "SHEET_METAL", "CASTING", "FORGING", "EXTRUSION", "MIM"], "gated_out": ["COMPRESSION_MOLDING", "INJECTION_MOLDING", "THERMOFORMING"], "cad_lite_status": "failed", "extrusion_lite_status": "failed", "extrusion_likelihood_level": "none", "sheet_metal_likelihood_level": "low", "sheet_metal_likelihood_source": "none", "findings": [{"rule_id": "TURN1", "severity": "MEDIUM", "process": null, "title": "Turning: L/D ratio unknown (upload STEP for slenderness chec"}, {"rule_id": "CAST1", "severity": "MEDIUM", "process": "CASTING", "title": "Low volume + casting (tooling risk)"}, {"rule_id": "FORG1", "severity": "MEDIUM", "process": "FORGING", "title": "Low volume + forging (tooling risk)"}, {"rule_id": "MIM1", "severity": "HIGH", "process": "MIM", "title": "Low volume + MIM (tooling ROI risk)"}], "top_priorities": ["TURN1"], "duration_ms": 102.92, "report": "# CNC Design Review + DFM Report\n\n## Input summary\n\n- Manufacturing process: CNC_TURNING\n\n- Material: Steel\n- Production volume: Small batch\n- Load type: Static\n- Tolerance criticality: Medium\n\n- Part size: Medium\n- Min internal radius: Medium\n- Min wall thickness: Medium\n- Hole depth class: None\n- Pocket aspect class: OK\n- Feature variety: Low\n- Accessibility risk: Low\n- Has clamping faces: True\n\n\n## Process recommendation\n\n- Primary: **CNC_TURNING**\n\n- Secondary: CNC\n\n- Less suitable (given current inputs): CASTING, FORGING, MIM\n\n- Not applicable (hard gated): INJECTION_MOLDING (polymer process), THERMOFORMING (polymer process), COMPRESSION_MOLDING (polymer process)\n\n- Tradeoffs:\n\n  - Tooling lead time vs unit cost: IM/Sheet metal need tooling; CNC/AM suit low volume.\n\n  - Tolerance and finish: Define critical interfaces; plan post-machining or inspection where needed.\n\n  - Risk drivers: Warpage (IM/AM), supports (AM), setups (CNC/Sheet metal) affect feasibility.\n\n  - Volume sensitivity: IM and sheet metal favor production runs; CNC/AM suit proto and small batch.\n\n  - Documentation: 2D drawing and scale confirmation improve tolerance and process selection.\n\n\n\n## Manufacturing confidence inputs\n\n- CAD uploaded: yes\n\n- CAD analysis status: none\n\n- CAD evidence used in rules: no\n\n- CAD Lite analysis: failed\n\n- Extrusion Lite analysis: failed\n\n- Extrusion likelihood: none (source=none)\n\n- Sheet metal likelihood: low (source=none)\n\n_Confidence inputs not provided._\n\n\n\n## Top priorities\n\n- [MEDIUM] Turning: L/D ratio unknown (upload STEP for slenderness check) (TURN1)\n\n\n\n## Findings (HIGH)\n\n- **Low volume + MIM (tooling ROI risk)** (MIM1) \u2014 MIM has high upfront tooling cost; unit cost only becomes favorable at production volumes.\n  - Recommendation: Consider CNC or AM for low volumes; MIM best for stable designs at production scale.\n\n## Findings (MEDIUM)\n\n- **Turning: L/D ratio unknown (upload STEP for slenderness check)** (TURN1) \u2014 Slenderness strongly affects deflection and chatter risk in turning; without geometry metrics this cannot be assessed reliably.\n  - Recommendation: Upload a STEP model or provide key dimensions; confirm whether tailstock/steady rest will be used for slender parts.\n- **Low volume + casting (tooling risk)** (CAST1) \u2014 Casting has significant tooling cost; economics favor production runs.\n  - Recommendation: Consider CNC or AM for low volumes; casting best at production scale.\n- **Low volume + forging (tooling risk)** (FORG1) \u2014 Forging has significant die cost; economics favor production runs.\n  - Recommendation: Consider CNC or AM for low volumes; forging best at production scale.\n\n## Findings (LOW)\n\n_None_\n\n## Action Checklist\n\n- [ ] Address HIGH and MEDIUM findings before release.\n- [ ] Apply recommended design changes for critical features.\n- [ ] Re-verify tolerances and interfaces after changes.\n\n## Assumptions\n\n- Inputs and part summary reflect current design intent.\n- Manufacturing process and material choices are as specified.\n\n## Usage (tokens & cost)\n\n_Usage not available._\n\n\n## LLM usage by node\n\n_Not available._\n\n\n## Agent confidence & limitations\n\n_Not available._\n", "trace": "Run started\nInputs validated\nProcess selection node entered\nprocess_selection: eligible_processes=['AM', 'CASTING', 'CNC', 'CNC_TURNING', 'EXTRUSION', 'FORGING', 'MIM', 'SHEET_METAL']\nprocess_selection: gated_out=[('INJECTION_MOLDING', 'polymer process'), ('THERMOFORMING', 'polymer process'), ('COMPRESSION_MOLDING', 'polymer process')]\nPSI: user_text_len=0 preview=\"\"\nprocess_selection: cad_lite status=failed\nprocess_selection: sheet_metal_likelihood=low (source=none)\nprocess_selection: extrusion_likelihood=none (coeff_var=? axis=?)\nprocess_selection: am_likelihood=low (source=bins_only)\nprocess_selection: scorer_path=legacy_bins cad_status=none\nprocess_selection: bins_anchor applied selected=CNC_TURNING margin=2 top_was=CNC\nPSI: score_diff=0 (primary=CNC_TURNING=3, second=CNC_TURNING=3)\nPSI tie-break: prefer user-selected flexible process (CNC_TURNING) when score_diff <= 1 (compatible, no strong mismatch)\nPSI: final score_diff=0 (after tie-break, primary changed from CNC to CNC_TURNING)\nProcess selection computed: primary=CNC_TURNING user_selected=CNC_TURNING\nprocess_selection: cad_uploaded=y evidence_available=n\nrules: cad_uploaded=y cad_status=none evidence_keys=[]\nreport: process_recommendation present=True primary=CNC_TURNING", "error": null, "error_type": null, "state_has_error": false, "case_id": "cnc_turning3_bins_template"}}
{"case_id": "extrusion1_bins_template", "status": "pass", "result": {"primary": "EXTRUSION", "secondary": [], "eligible_processes": ["CNC", "CNC_TURNING", "AM", "SHEET_METAL", "CASTING", "FORGING", "EXTRUSION", "MIM"], "gated_out": ["COMPRESSION_MOLDING", "INJECTION_MOLDING", "THERMOFORMING"], "cad_lite_status": "ok", "extrusion_lite_status": "ok", "extrusion_likelihood_level": "high", "sheet_metal_likelihood_level": "med", "sheet_metal_likelihood_source": "cad_lite", "findings": [], "top_priorities": [], "duration_ms": 93.75, "report": "# CNC Design Review + DFM Report\n\n## Input summary\n\n- Manufacturing process: EXTRUSION\n\n- Material: Aluminum\n- Production volume: Production\n- Load type: Static\n- Tolerance criticality: Medium\n\n- Part size: Medium\n- Min internal radius: Medium\n- Min wall thickness: Medium\n- Hole depth class: None\n- Pocket aspect class: OK\n- Feature variety: Low\n- Accessibility risk: Low\n- Has clamping faces: True\n\n\n## Process recommendation\n\n- Primary: **EXTRUSION**\n\n- Secondary: None\n\n- Less suitable (given current inputs): AM, CASTING, FORGING, MIM\n\n- Not applicable (hard gated): INJECTION_MOLDING (polymer process), THERMOFORMING (polymer process), COMPRESSION_MOLDING (polymer process)\n\n- Tradeoffs:\n\n  - Tooling lead time vs unit cost: IM/Sheet metal need tooling; CNC/AM suit low volume.\n\n  - Tolerance and finish: Define critical interfaces; plan post-machining or inspection where needed.\n\n  - Risk drivers: Warpage (IM/AM), supports (AM), setups (CNC/Sheet metal) affect feasibility.\n\n  - Volume sensitivity: IM and sheet metal favor production runs; CNC/AM suit proto and small batch.\n\n  - Documentation: 2D drawing and scale confirmation improve tolerance and process selection.\n\n\n\n## Manufacturing confidence inputs\n\n- CAD uploaded: yes\n\n- CAD analysis status: none\n\n- CAD evidence used in rules: no\n\n- CAD Lite analysis: ok\n\n- Extrusion Lite analysis: ok\n\n- Extrusion likelihood: high (source=extrusion_lite)\n\n- Sheet metal likelihood: med (source=cad_lite)\n\n_Confidence inputs not provided._\n\n\n\n## Top priorities\n\n_None_\n\n\n\n\n## Findings (HIGH)\n\n_None_\n\n## Findings (MEDIUM)\n\n_None_\n\n## Findings (LOW)\n\n_None_\n\n## Action Checklist\n\n- [ ] No blocking issues; optional improvements may apply.\n- [ ] Review LOW findings for incremental improvements.\n- [ ] Confirm part meets functional requirements.\n\n## Assumptions\n\n- Inputs and part summary reflect current design intent.\n- Manufacturing process and material choices are as specified.\n\n## Usage (tokens & cost)\n\n_Usage not available._\n\n\n## LLM usage by node\n\n_Not available._\n\n\n## Agent confidence & limitations\n\n_Not available._\n", "trace": "Run started\nInputs validated\nProcess selection node entered\nprocess_selection: eligible_processes=['AM', 'CASTING', 'CNC', 'CNC_TURNING', 'EXTRUSION', 'FORGING', 'MIM', 'SHEET_METAL']\nprocess_selection: gated_out=[('INJECTION_MOLDING', 'polymer process'), ('THERMOFORMING', 'polymer process'), ('COMPRESSION_MOLDING', 'polymer process')]\nPSI: user_text_len=0 preview=\"\"\nprocess_selection: cad_lite status=ok t_est=2.8352 av_ratio=0.7054 t_over_min_dim=0.189\nprocess_selection: sheet_metal_likelihood=med (source=cad_lite)\nprocess_selection: extrusion_likelihood=high (coeff_var=0.0 axis=Y)\nprocess_selection: am_likelihood=low (source=bins_only)\nprocess_selection: bins_boost EXTRUSION high +5; bins_penalize MIM -6\nprocess_selection: bins_guard MIM cap for Aluminum\nprocess_selection: scorer_path=legacy_bins cad_status=none\nPSI: score_diff=3 (primary=EXTRUSION=6, second=SHEET_METAL=3)\nProcess selection computed: primary=EXTRUSION user_selected=EXTRUSION\nprocess_selection: cad_uploaded=y evidence_available=n\nruleset_used=extrusion\nrules: cad_uploaded=y cad_status=none evidence_keys=[]\nreport: process_recommendation present=True primary=EXTRUSION", "error": null, "error_type": null, "state_has_error": false, "case_id": "extrusion1_bins_template"}}
{"case_id": "extrusion2_bins_template", "status": "pass", "result": {"primary": "EXTRUSION", "secondary": ["SHEET_METAL", "CNC"], "eligible_processes": ["CNC", "CNC_TURNING", "AM", "SHEET_METAL", "CASTING", "FORGING", "EXTRUSION", "MIM"], "gated_out": ["COMPRESSION_MOLDING", "INJECTION_MOLDING", "THERMOFORMING"], "cad_lite_status": "failed", "extrusion_lite_status": "failed", "extrusion_likelihood_level": "none", "sheet_metal_likelihood_level": "med", "sheet_metal_likelihood_source": "bins_only", "findings": [{"rule_id": "EXTR2", "severity": "HIGH", "process": null, "title": "Non-uniform wall thickness (distortion/warpage risk)"}], "top_priorities": ["EXTR2"], "duration_ms": 208.53, "report": "# CNC Design Review + DFM Report\n\n## Input summary\n\n- Manufacturing process: EXTRUSION\n\n- Material: Aluminum\n- Production volume: Production\n- Load type: Static\n- Tolerance criticality: Medium\n\n- Part size: Medium\n- Min internal radius: Medium\n- Min wall thickness: Thin\n- Hole depth class: None\n- Pocket aspect class: OK\n- Feature variety: Low\n- Accessibility risk: Low\n- Has clamping faces: True\n\n\n## Process recommendation\n\n- Primary: **EXTRUSION**\n\n- Secondary: SHEET_METAL, CNC\n\n- Less suitable (given current inputs): AM, CASTING, FORGING, MIM\n\n- Not applicable (hard gated): INJECTION_MOLDING (polymer process), THERMOFORMING (polymer process), COMPRESSION_MOLDING (polymer process)\n\n- Tradeoffs:\n\n  - Tooling lead time vs unit cost: IM/Sheet metal need tooling; CNC/AM suit low volume.\n\n  - Tolerance and finish: Define critical interfaces; plan post-machining or inspection where needed.\n\n  - Risk drivers: Warpage (IM/AM), supports (AM), setups (CNC/Sheet metal) affect feasibility.\n\n  - Volume sensitivity: IM and sheet metal favor production runs; CNC/AM suit proto and small batch.\n\n  - Documentation: 2D drawing and scale confirmation improve tolerance and process selection.\n\n\n\n## Manufacturing confidence inputs\n\n- CAD uploaded: yes\n\n- CAD analysis status: none\n\n- CAD evidence used in rules: no\n\n- CAD Lite analysis: failed\n\n- Extrusion Lite analysis: failed\n\n- Extrusion likelihood: none (source=none)\n\n- Sheet metal likelihood: med (source=bins_only)\n\n_Confidence inputs not provided._\n\n\n\n## Top priorities\n\n- [HIGH] Non-uniform wall thickness (distortion/warpage risk) (EXTR2)\n\n\n\n## Findings (HIGH)\n\n- **Non-uniform wall thickness (distortion/warpage risk)** (EXTR2) \u2014 Non-uniform thickness leads to uneven cooling, residual stress, and warping in extrusion.\n  - Recommendation: Aim for adjacent wall thickness ratio < 2:1; use smooth transitions; avoid thin flanges.\n\n## Findings (MEDIUM)\n\n_None_\n\n## Findings (LOW)\n\n_None_\n\n## Action Checklist\n\n- [ ] Address HIGH and MEDIUM findings before release.\n- [ ] Apply recommended design changes for critical features.\n- [ ] Re-verify tolerances and interfaces after changes.\n\n## Assumptions\n\n- Inputs and part summary reflect current design intent.\n- Manufacturing process and material choices are as specified.\n\n## Usage (tokens & cost)\n\n_Usage not available._\n\n\n## LLM usage by node\n\n_Not available._\n\n\n## Agent confidence & limitations\n\n_Not available._\n", "trace": "Run started\nInputs validated\nProcess selection node entered\nprocess_selection: eligible_processes=['AM', 'CASTING', 'CNC', 'CNC_TURNING', 'EXTRUSION', 'FORGING', 'MIM', 'SHEET_METAL']\nprocess_selection: gated_out=[('INJECTION_MOLDING', 'polymer process'), ('THERMOFORMING', 'polymer process'), ('COMPRESSION_MOLDING', 'polymer process')]\nPSI: user_text_len=0 preview=\"\"\nprocess_selection: cad_lite status=failed\nprocess_selection: sheet_metal_likelihood=med (source=bins_only)\nprocess_selection: extrusion_likelihood=none (coeff_var=? axis=?)\nprocess_selection: am_likelihood=low (source=bins_only)\nprocess_selection: bins_boost EXTRUSION fallback (thin+Al) +5; SM -2; MIM -4\nprocess_selection: bins_guard MIM cap for Aluminum\nprocess_selection: scorer_path=legacy_bins cad_status=none\nPSI: score_diff=0 (primary=EXTRUSION=6, second=SHEET_METAL=6)\nProcess selection computed: primary=EXTRUSION user_selected=EXTRUSION\nprocess_selection: cad_uploaded=y evidence_available=n\nRule triggered: Non-uniform wall thickness (distortion/warpage risk) \u2192 HIGH severity\nruleset_used=extrusion\nrules: cad_uploaded=y cad_status=none evidence_keys=[]\nreport: process_recommendation present=True primary=EXTRUSION", "error": null, "error_type": null, "state_has_error": false, "case_id": "extrusion2_bins_template"}}
{"case_id": "extrusion3_bins_template", "status": "pass", "result": {"primary": "EXTRUSION", "secondary": ["SHEET_METAL", "CNC"], "eligible_processes": ["CNC", "CNC_TURNING", "AM", "SHEET_METAL", "CASTING", "FORGING", "EXTRUSION", "MIM"], "gated_out": ["COMPRESSION_MOLDING", "INJECTION_MOLDING", "THERMOFORMING"], "cad_lite_status": "failed", "extrusion_lite_status": "failed", "extrusion_likelihood_level": "none", "sheet_metal_likelihood_level": "med", "sheet_metal_likelihood_source": "bins_only", "findings": [{"rule_id": "EXTR2", "severity": "HIGH", "process": null, "title": "Non-uniform wall thickness (distortion/warpage risk)"}], "top_priorities": ["EXTR2"], "duration_ms": 91.76, "report": "# CNC Design Review + DFM Report\n\n## Input summary\n\n- Manufacturing process: EXTRUSION\n\n- Material: Aluminum\n- Production volume: Production\n- Load type: Static\n- Tolerance criticality: Medium\n\n- Part size: Medium\n- Min internal radius: Medium\n- Min wall thickness: Thin\n- Hole depth class: None\n- Pocket aspect class: OK\n- Feature variety: Low\n- Accessibility risk: Low\n- Has clamping faces: True\n\n\n## Process recommendation\n\n- Primary: **EXTRUSION**\n\n- Secondary: SHEET_METAL, CNC\n\n- Less suitable (given current inputs): AM, CASTING, FORGING, MIM\n\n- Not applicable (hard gated): INJECTION_MOLDING (polymer process), THERMOFORMING (polymer process), COMPRESSION_MOLDING (polymer process)\n\n- Tradeoffs:\n\n  - Tooling lead time vs unit cost: IM/Sheet metal need tooling; CNC/AM suit low volume.\n\n  - Tolerance and finish: Define critical interfaces; plan post-machining or inspection where needed.\n\n  - Risk drivers: Warpage (IM/AM), supports (AM), setups (CNC/Sheet metal) affect feasibility.\n\n  - Volume sensitivity: IM and sheet metal favor production runs; CNC/AM suit proto and small batch.\n\n  - Documentation: 2D drawing and scale confirmation improve tolerance and process selection.\n\n\n\n## Manufacturing confidence inputs\n\n- CAD uploaded: yes\n\n- CAD analysis status: none\n\n- CAD evidence used in rules: no\n\n- CAD Lite analysis: failed\n\n- Extrusion Lite analysis: failed\n\n- Extrusion likelihood: none (source=none)\n\n- Sheet metal likelihood: med (source=bins_only)\n\n_Confidence inputs not provided._\n\n\n\n## Top priorities\n\n- [HIGH] Non-uniform wall thickness (distortion/warpage risk) (EXTR2)\n\n\n\n## Findings (HIGH)\n\n- **Non-uniform wall thickness (distortion/warpage risk)** (EXTR2) \u2014 Non-uniform thickness leads to uneven cooling, residual stress, and warping in extrusion.\n  - Recommendation: Aim for adjacent wall thickness ratio < 2:1; use smooth transitions; avoid thin flanges.\n\n## Findings (MEDIUM)\n\n_None_\n\n## Findings (LOW)\n\n_None_\n\n## Action Checklist\n\n- [ ] Address HIGH and MEDIUM findings before release.\n- [ ] Apply recommended design changes for critical features.\n- [ ] Re-verify tolerances and interfaces after changes.\n\n## Assumptions\n\n- Inputs and part summary reflect current design intent.\n- Manufacturing process and material choices are as specified.\n\n## Usage (tokens & cost)\n\n_Usage not available._\n\n\n## LLM usage by node\n\n_Not available._\n\n\n## Agent confidence & limitations\n\n_Not available._\n", "trace": "Run started\nInputs validated\nProcess selection node entered\nprocess_selection: eligible_processes=['AM', 'CASTING', 'CNC', 'CNC_TURNING', 'EXTRUSION', 'FORGING', 'MIM', 'SHEET_METAL']\nprocess_selection: gated_out=[('INJECTION_MOLDING', 'polymer process'), ('THERMOFORMING', 'polymer process'), ('COMPRESSION_MOLDING', 'polymer process')]\nPSI: user_text_len=0 preview=\"\"\nprocess_selection: cad_lite status=failed\nprocess_selection: sheet_metal_likelihood=med (source=bins_only)\nprocess_selection: extrusion_likelihood=none (coeff_var=? axis=?)\nprocess_selection: am_likelihood=low (source=bins_only)\nprocess_selection: bins_boost EXTRUSION fallback (thin+Al) +5; SM -2; MIM -4\nprocess_selection: bins_guard MIM cap for Aluminum\nprocess_selection: scorer_path=legacy_bins cad_status=none\nPSI: score_diff=0 (primary=EXTRUSION=6, second=SHEET_METAL=6)\nProcess selection computed: primary=EXTRUSION user_selected=EXTRUSION\nprocess_selection: cad_uploaded=y evidence_available=n\nRule triggered: Non-uniform wall thickness (distortion/warpage risk) \u2192 HIGH severity\nruleset_used=extrusion\nrules: cad_uploaded=y cad_status=none evidence_keys=[]\nreport: process_recommendation present=True primary=EXTRUSION", "error": null, "error_type": null, "state_has_error": false, "case_id": "extrusion3_bins_template"}}
{"case_id": "im1_bins_template", "status": "pass", "result": {"primary": "INJECTION_MOLDING", "secondary": [], "eligible_processes": ["CNC", "CNC_TURNING", "AM", "SHEET_METAL", "INJECTION_MOLDING", "EXTRUSION", "THERMOFORMING", "COMPRESSION_MOLDING"], "gated_out": ["CASTING", "FORGING", "MIM"], "cad_lite_status": "failed", "extrusion_lite_status": "failed", "extrusion_likelihood_level": "none", "sheet_metal_likelihood_level": "low", "sheet_metal_likelihood_source": "none", "findings": [], "top_priorities": [], "duration_ms": 94.43, "report": "# CNC Design Review + DFM Report\n\n## Input summary\n\n- Manufacturing process: INJECTION_MOLDING\n\n- Material: Plastic\n- Production volume: Production\n- Load type: Static\n- Tolerance criticality: Medium\n\n- Part size: Medium\n- Min internal radius: Medium\n- Min wall thickness: Medium\n- Hole depth class: None\n- Pocket aspect class: OK\n- Feature variety: Low\n- Accessibility risk: Low\n- Has clamping faces: True\n\n\n## Process recommendation\n\n- Primary: **INJECTION_MOLDING**\n\n- Secondary: None\n\n- Less suitable (given current inputs): CNC, AM, SHEET_METAL, EXTRUSION\n\n- Not applicable (hard gated): CASTING (metal process), FORGING (metal process), MIM (metal process)\n\n- Primary rationale:\n\n  - Production volume favors IM economics\n\n- Tradeoffs:\n\n  - Tooling lead time vs unit cost: IM/Sheet metal need tooling; CNC/AM suit low volume.\n\n  - Tolerance and finish: Define critical interfaces; plan post-machining or inspection where needed.\n\n  - Risk drivers: Warpage (IM/AM), supports (AM), setups (CNC/Sheet metal) affect feasibility.\n\n  - Volume sensitivity: IM and sheet metal favor production runs; CNC/AM suit proto and small batch.\n\n  - Documentation: 2D drawing and scale confirmation improve tolerance and process selection.\n\n\n\n## Manufacturing confidence inputs\n\n- CAD uploaded: yes\n\n- CAD analysis status: none\n\n- CAD evidence used in rules: no\n\n- CAD Lite analysis: failed\n\n- Extrusion Lite analysis: failed\n\n- Extrusion likelihood: none (source=none)\n\n- Sheet metal likelihood: low (source=none)\n\n_Confidence inputs not provided._\n\n\n\n## Top priorities\n\n_None_\n\n\n\n\n## Findings (HIGH)\n\n_None_\n\n## Findings (MEDIUM)\n\n_None_\n\n## Findings (LOW)\n\n_None_\n\n## Action Checklist\n\n- [ ] Review IM design guidelines: draft angles, wall thickness, ribs/bosses.\n- [ ] Plan tooling ROI analysis for production volume.\n- [ ] Consider gate/vent/cooling design early in tooling discussion.\n- [ ] Validate resin selection for application requirements.\n\n## Assumptions\n\n- Injection molding process intent is confirmed.\n- Tooling exists or will be quoted based on design.\n- Resin grade selection is TBD or as specified.\n- Draft angles and wall thickness uniformity not validated without CAD review.\n\n## Usage (tokens & cost)\n\n_Usage not available._\n\n\n## LLM usage by node\n\n_Not available._\n\n\n## Agent confidence & limitations\n\n_Not available._\n", "trace": "Run started\nInputs validated\nProcess selection node entered\nprocess_selection: eligible_processes=['AM', 'CNC', 'CNC_TURNING', 'COMPRESSION_MOLDING', 'EXTRUSION', 'INJECTION_MOLDING', 'SHEET_METAL', 'THERMOFORMING']\nprocess_selection: gated_out=[('CASTING', 'metal process'), ('FORGING', 'metal process'), ('MIM', 'metal process')]\nPSI: user_text_len=0 preview=\"\"\nprocess_selection: cad_lite status=failed\nprocess_selection: sheet_metal_likelihood=low (source=none)\nprocess_selection: extrusion_likelihood=none (coeff_var=? axis=?)\nprocess_selection: am_likelihood=low (source=bins_only)\nprocess_selection: scorer_path=legacy_bins cad_status=none\nPSI: score_diff=5 (primary=INJECTION_MOLDING=10, second=THERMOFORMING=5)\nProcess selection computed: primary=INJECTION_MOLDING user_selected=INJECTION_MOLDING\nprocess_selection: cad_uploaded=y evidence_available=n\nrules: cad_uploaded=y cad_status=none evidence_keys=[]\nreport: process_recommendation present=True primary=INJECTION_MOLDING", "error": null, "error_type": null, "state_has_error": false, "case_id": "im1_bins_template"}}
{"case_id": "sm1_bins_template", "status": "pass", "result": {"primary": "SHEET_METAL", "secondary": ["CNC"], "eligible_processes": ["CNC", "CNC_TURNING", "AM", "SHEET_METAL", "CASTING", "FORGING", "EXTRUSION", "MIM"], "gated_out": ["COMPRESSION_MOLDING", "INJECTION_MOLDING", "THERMOFORMING"], "cad_lite_status": "ok", "extrusion_lite_status": "ok", "extrusion_likelihood_level": "low", "sheet_metal_likelihood_level": "high", "sheet_metal_likelihood_source": "cad_lite", "findings": [{"rule_id": "CAST1", "severity": "MEDIUM", "process": "CASTING", "title": "Low volume + casting (tooling risk)"}, {"rule_id": "FORG1", "severity": "MEDIUM", "process": "FORGING", "title": "Low volume + forging (tooling risk)"}, {"rule_id": "MIM1", "severity": "HIGH", "process": "MIM", "title": "Low volume + MIM (tooling ROI risk)"}], "top_priorities": [], "duration_ms": 112.61, "report": "# CNC Design Review + DFM Report\n\n## Input summary\n\n- Manufacturing process: SHEET_METAL\n\n- Material: Steel\n- Production volume: Small batch\n- Load type: Static\n- Tolerance criticality: Medium\n\n- Part size: Medium\n- Min internal radius: Medium\n- Min wall thickness: Medium\n- Hole depth class: None\n- Pocket aspect class: OK\n- Feature variety: Low\n- Accessibility risk: Low\n- Has clamping faces: True\n\n\n## Process recommendation\n\n- Primary: **SHEET_METAL**\n\n- Secondary: CNC\n\n- Less suitable (given current inputs): AM, CASTING, FORGING, EXTRUSION, MIM\n\n- Not applicable (hard gated): INJECTION_MOLDING (polymer process), THERMOFORMING (polymer process), COMPRESSION_MOLDING (polymer process)\n\n- Tradeoffs:\n\n  - Tooling lead time vs unit cost: IM/Sheet metal need tooling; CNC/AM suit low volume.\n\n  - Tolerance and finish: Define critical interfaces; plan post-machining or inspection where needed.\n\n  - Risk drivers: Warpage (IM/AM), supports (AM), setups (CNC/Sheet metal) affect feasibility.\n\n  - Volume sensitivity: IM and sheet metal favor production runs; CNC/AM suit proto and small batch.\n\n  - Documentation: 2D drawing and scale confirmation improve tolerance and process selection.\n\n\n\n## Manufacturing confidence inputs\n\n- CAD uploaded: yes\n\n- CAD analysis status: none\n\n- CAD evidence used in rules: no\n\n- CAD Lite analysis: ok\n\n- Extrusion Lite analysis: ok\n\n- Extrusion likelihood: low (source=extrusion_lite)\n\n- Sheet metal likelihood: high (source=cad_lite)\n\n_Confidence inputs not provided._\n\n\n\n## Top priorities\n\n_None_\n\n\n\n## Findings (HIGH)\n\n- **Low volume + MIM (tooling ROI risk)** (MIM1) \u2014 MIM has high upfront tooling cost; unit cost only becomes favorable at production volumes.\n  - Recommendation: Consider CNC or AM for low volumes; MIM best for stable designs at production scale.\n\n## Findings (MEDIUM)\n\n- **Low volume + casting (tooling risk)** (CAST1) \u2014 Casting has significant tooling cost; economics favor production runs.\n  - Recommendation: Consider CNC or AM for low volumes; casting best at production scale.\n- **Low volume + forging (tooling risk)** (FORG1) \u2014 Forging has significant die cost; economics favor production runs.\n  - Recommendation: Consider CNC or AM for low volumes; forging best at production scale.\n\n## Findings (LOW)\n\n_None_\n\n## Action Checklist\n\n- [ ] Address HIGH and MEDIUM findings before release.\n- [ ] Apply recommended design changes for critical features.\n- [ ] Re-verify tolerances and interfaces after changes.\n\n## Assumptions\n\n- Inputs and part summary reflect current design intent.\n- Manufacturing process and material choices are as specified.\n\n## Usage (tokens & cost)\n\n_Usage not available._\n\n\n## LLM usage by node\n\n_Not available._\n\n\n## Agent confidence & limitations\n\n_Not available._\n", "trace": "Run started\nInputs validated\nProcess selection node entered\nprocess_selection: eligible_processes=['AM', 'CASTING', 'CNC', 'CNC_TURNING', 'EXTRUSION', 'FORGING', 'MIM', 'SHEET_METAL']\nprocess_selection: gated_out=[('INJECTION_MOLDING', 'polymer process'), ('THERMOFORMING', 'polymer process'), ('COMPRESSION_MOLDING', 'polymer process')]\nPSI: user_text_len=0 preview=\"\"\nprocess_selection: cad_lite status=ok t_est=1.4457 av_ratio=1.3834 t_over_min_dim=0.0195\nprocess_selection: sheet_metal_likelihood=high (source=cad_lite)\nprocess_selection: extrusion_likelihood=low (coeff_var=0.287858 axis=X)\nprocess_selection: am_likelihood=low (source=bins_only)\nprocess_selection: scorer_path=legacy_bins cad_status=none\nPSI: score_diff=3 (primary=SHEET_METAL=6, second=CNC=3)\nProcess selection computed: primary=SHEET_METAL user_selected=SHEET_METAL\nprocess_selection: cad_uploaded=y evidence_available=n\nrules: cad_uploaded=y cad_status=none evidence_keys=[]\nreport: process_recommendation present=True primary=SHEET_METAL", "error": null, "error_type": null, "state_has_error": false, "case_id": "sm1_bins_template"}}
{"case_id": "sm2_bins_template", "status": "pass", "result": {"primary": "SHEET_METAL", "secondary": [], "eligible_processes": ["CNC", "CNC_TURNING", "AM", "SHEET_METAL", "CASTING", "FORGING", "EXTRUSION", "MIM"], "gated_out": ["COMPRESSION_MOLDING", "INJECTION_MOLDING", "THERMOFORMING"], "cad_lite_status": "failed", "extrusion_lite_status": "failed", "extrusion_likelihood_level": "none", "sheet_metal_likelihood_level": "med", "sheet_metal_likelihood_source": "bins_only", "findings": [{"rule_id": "CAST1", "severity": "MEDIUM", "process": "CASTING", "title": "Low volume + casting (tooling risk)"}, {"rule_id": "FORG1", "severity": "MEDIUM", "process": "FORGING", "title": "Low volume + forging (tooling risk)"}, {"rule_id": "MIM1", "severity": "HIGH", "process": "MIM", "title": "Low volume + MIM (tooling ROI risk)"}], "top_priorities": [], "duration_ms": 91.6, "report": "# CNC Design Review + DFM Report\n\n## Input summary\n\n- Manufacturing process: SHEET_METAL\n\n- Material: Steel\n- Production volume: Small batch\n- Load type: Static\n- Tolerance criticality: Medium\n\n- Part size: Medium\n- Min internal radius: Medium\n- Min wall thickness: Thin\n- Hole depth class: None\n- Pocket aspect class: OK\n- Feature variety: Low\n- Accessibility risk: Low\n- Has clamping faces: True\n\n\n## Process recommendation\n\n- Primary: **SHEET_METAL**\n\n- Secondary: None\n\n- Less suitable (given current inputs): AM, CASTING, FORGING, EXTRUSION, MIM\n\n- Not applicable (hard gated): INJECTION_MOLDING (polymer process), THERMOFORMING (polymer process), COMPRESSION_MOLDING (polymer process)\n\n- Tradeoffs:\n\n  - Tooling lead time vs unit cost: IM/Sheet metal need tooling; CNC/AM suit low volume.\n\n  - Tolerance and finish: Define critical interfaces; plan post-machining or inspection where needed.\n\n  - Risk drivers: Warpage (IM/AM), supports (AM), setups (CNC/Sheet metal) affect feasibility.\n\n  - Volume sensitivity: IM and sheet metal favor production runs; CNC/AM suit proto and small batch.\n\n  - Documentation: 2D drawing and scale confirmation improve tolerance and process selection.\n\n\n\n## Manufacturing confidence inputs\n\n- CAD uploaded: yes\n\n- CAD analysis status: none\n\n- CAD evidence used in rules: no\n\n- CAD Lite analysis: failed\n\n- Extrusion Lite analysis: failed\n\n- Extrusion likelihood: none (source=none)\n\n- Sheet metal likelihood: med (source=bins_only)\n\n_Confidence inputs not provided._\n\n\n\n## Top priorities\n\n_None_\n\n\n\n## Findings (HIGH)\n\n- **Low volume + MIM (tooling ROI risk)** (MIM1) \u2014 MIM has high upfront tooling cost; unit cost only becomes favorable at production volumes.\n  - Recommendation: Consider CNC or AM for low volumes; MIM best for stable designs at production scale.\n\n## Findings (MEDIUM)\n\n- **Low volume + casting (tooling risk)** (CAST1) \u2014 Casting has significant tooling cost; economics favor production runs.\n  - Recommendation: Consider CNC or AM for low volumes; casting best at production scale.\n- **Low volume + forging (tooling risk)** (FORG1) \u2014 Forging has significant die cost; economics favor production runs.\n  - Recommendation: Consider CNC or AM for low volumes; forging best at production scale.\n\n## Findings (LOW)\n\n_None_\n\n## Action Checklist\n\n- [ ] Address HIGH and MEDIUM findings before release.\n- [ ] Apply recommended design changes for critical features.\n- [ ] Re-verify tolerances and interfaces after changes.\n\n## Assumptions\n\n- Inputs and part summary reflect current design intent.\n- Manufacturing process and material choices are as specified.\n\n## Usage (tokens & cost)\n\n_Usage not available._\n\n\n## LLM usage by node\n\n_Not available._\n\n\n## Agent confidence & limitations\n\n_Not available._\n", "trace": "Run started\nInputs validated\nProcess selection node entered\nprocess_selection: eligible_processes=['AM', 'CASTING', 'CNC', 'CNC_TURNING', 'EXTRUSION', 'FORGING', 'MIM', 'SHEET_METAL']\nprocess_selection: gated_out=[('INJECTION_MOLDING', 'polymer process'), ('THERMOFORMING', 'polymer process'), ('COMPRESSION_MOLDING', 'polymer process')]\nPSI: user_text_len=0 preview=\"\"\nprocess_selection: cad_lite status=failed\nprocess_selection: sheet_metal_likelihood=med (source=bins_only)\nprocess_selection: extrusion_likelihood=none (coeff_var=? axis=?)\nprocess_selection: am_likelihood=low (source=bins_only)\nprocess_selection: bins_boost SHEET_METAL thin+metal +4\nprocess_selection: scorer_path=legacy_bins cad_status=none\nPSI: score_diff=8 (primary=SHEET_METAL=12, second=CNC=4)\nProcess selection computed: primary=SHEET_METAL user_selected=SHEET_METAL\nprocess_selection: cad_uploaded=y evidence_available=n\nrules: cad_uploaded=y cad_status=none evidence_keys=[]\nreport: process_recommendation present=True primary=SHEET_METAL", "error": null, "error_type": null, "state_has_error": false, "case_id": "sm2_bins_template"}}
{"case_id": "sm3_bins_template", "status": "pass", "result": {"primary": "SHEET_METAL", "secondary": ["CNC"], "eligible_processes": ["CNC", "CNC_TURNING", "AM", "SHEET_METAL", "CASTING", "FORGING", "EXTRUSION", "MIM"], "gated_out": ["COMPRESSION_MOLDING", "INJECTION_MOLDING", "THERMOFORMING"], "cad_lite_status": "ok", "extrusion_lite_status": "ok", "extrusion_likelihood_level": "low", "sheet_metal_likelihood_level": "high", "sheet_metal_likelihood_source": "cad_lite", "findings": [{"rule_id": "CAST1", "severity": "MEDIUM", "process": "CASTING", "title": "Low volume + casting (tooling risk)"}, {"rule_id": "FORG1", "severity": "MEDIUM", "process": "FORGING", "title": "Low volume + forging (tooling risk)"}, {"rule_id": "MIM1", "severity": "HIGH", "process": "MIM", "title": "Low volume + MIM (tooling ROI risk)"}], "top_priorities": [], "duration_ms": 130.82, "report": "# CNC Design Review + DFM Report\n\n## Input summary\n\n- Manufacturing process: SHEET_METAL\n\n- Material: Steel\n- Production volume: Small batch\n- Load type: Static\n- Tolerance criticality: Medium\n\n- Part size: Medium\n- Min internal radius: Medium\n- Min wall thickness: Medium\n- Hole depth class: None\n- Pocket aspect class: OK\n- Feature variety: Low\n- Accessibility risk: Low\n- Has clamping faces: True\n\n\n## Process recommendation\n\n- Primary: **SHEET_METAL**\n\n- Secondary: CNC\n\n- Less suitable (given current inputs): AM, CASTING, FORGING, EXTRUSION, MIM\n\n- Not applicable (hard gated): INJECTION_MOLDING (polymer process), THERMOFORMING (polymer process), COMPRESSION_MOLDING (polymer process)\n\n- Tradeoffs:\n\n  - Tooling lead time vs unit cost: IM/Sheet metal need tooling; CNC/AM suit low volume.\n\n  - Tolerance and finish: Define critical interfaces; plan post-machining or inspection where needed.\n\n  - Risk drivers: Warpage (IM/AM), supports (AM), setups (CNC/Sheet metal) affect feasibility.\n\n  - Volume sensitivity: IM and sheet metal favor production runs; CNC/AM suit proto and small batch.\n\n  - Documentation: 2D drawing and scale confirmation improve tolerance and process selection.\n\n\n\n## Manufacturing confidence inputs\n\n- CAD uploaded: yes\n\n- CAD analysis status: none\n\n- CAD evidence used in rules: no\n\n- CAD Lite analysis: ok\n\n- Extrusion Lite analysis: ok\n\n- Extrusion likelihood: low (source=extrusion_lite)\n\n- Sheet metal likelihood: high (source=cad_lite)\n\n_Confidence inputs not provided._\n\n\n\n## Top priorities\n\n_None_\n\n\n\n## Findings (HIGH)\n\n- **Low volume + MIM (tooling ROI risk)** (MIM1) \u2014 MIM has high upfront tooling cost; unit cost only becomes favorable at production volumes.\n  - Recommendation: Consider CNC or AM for low volumes; MIM best for stable designs at production scale.\n\n## Findings (MEDIUM)\n\n- **Low volume + casting (tooling risk)** (CAST1) \u2014 Casting has significant tooling cost; economics favor production runs.\n  - Recommendation: Consider CNC or AM for low volumes; casting best at production scale.\n- **Low volume + forging (tooling risk)** (FORG1) \u2014 Forging has significant die cost; economics favor production runs.\n  - Recommendation: Consider CNC or AM for low volumes; forging best at production scale.\n\n## Findings (LOW)\n\n_None_\n\n## Action Checklist\n\n- [ ] Address HIGH and MEDIUM findings before release.\n- [ ] Apply recommended design changes for critical features.\n- [ ] Re-verify tolerances and interfaces after changes.\n\n## Assumptions\n\n- Inputs and part summary reflect current design intent.\n- Manufacturing process and material choices are as specified.\n\n## Usage (tokens & cost)\n\n_Usage not available._\n\n\n## LLM usage by node\n\n_Not available._\n\n\n## Agent confidence & limitations\n\n_Not available._\n", "trace": "Run started\nInputs validated\nProcess selection node entered\nprocess_selection: eligible_processes=['AM', 'CASTING', 'CNC', 'CNC_TURNING', 'EXTRUSION', 'FORGING', 'MIM', 'SHEET_METAL']\nprocess_selection: gated_out=[('INJECTION_MOLDING', 'polymer process'), ('THERMOFORMING', 'polymer process'), ('COMPRESSION_MOLDING', 'polymer process')]\nPSI: user_text_len=0 preview=\"\"\nprocess_selection: cad_lite status=ok t_est=2.9112 av_ratio=0.687 t_over_min_dim=0.0178\nprocess_selection: sheet_metal_likelihood=high (source=cad_lite)\nprocess_selection: extrusion_likelihood=low (coeff_var=0.171319 axis=Z)\nprocess_selection: am_likelihood=low (source=bins_only)\nprocess_selection: scorer_path=legacy_bins cad_status=none\nPSI: score_diff=3 (primary=SHEET_METAL=6, second=CNC=3)\nProcess selection computed: primary=SHEET_METAL user_selected=SHEET_METAL\nprocess_selection: cad_uploaded=y evidence_available=n\nrules: cad_uploaded=y cad_status=none evidence_keys=[]\nreport: process_recommendation present=True primary=SHEET_METAL", "error": null, "error_type": null, "state_has_error": false, "case_id": "sm3_bins_template"}}
{"case_id": "sm4_bins_template", "status": "pass", "result": {"primary": "SHEET_METAL", "secondary": ["CNC"], "eligible_processes": ["CNC", "CNC_TURNING", "AM", "SHEET_METAL", "CASTING", "FORGING", "EXTRUSION", "MIM"], "gated_out": ["COMPRESSION_MOLDING", "INJECTION_MOLDING", "THERMOFORMING"], "cad_lite_status": "ok", "extrusion_lite_status": "ok", "extrusion_likelihood_level": "low", "sheet_metal_likelihood_level": "high", "sheet_metal_likelihood_source": "cad_lite", "findings": [{"rule_id": "CAST1", "severity": "MEDIUM", "process": "CASTING", "title": "Low volume + casting (tooling risk)"}, {"rule_id": "FORG1", "severity": "MEDIUM", "process": "FORGING", "title": "Low volume + forging (tooling risk)"}, {"rule_id": "MIM1", "severity": "HIGH", "process": "MIM", "title": "Low volume + MIM (tooling ROI risk)"}], "top_priorities": [], "duration_ms": 108.08, "report": "# CNC Design Review + DFM Report\n\n## Input summary\n\n- Manufacturing process: SHEET_METAL\n\n- Material: Steel\n- Production volume: Small batch\n- Load type: Static\n- Tolerance criticality: Medium\n\n- Part size: Medium\n- Min internal radius: Medium\n- Min wall thickness: Medium\n- Hole depth class: None\n- Pocket aspect class: OK\n- Feature variety: Low\n- Accessibility risk: Low\n- Has clamping faces: True\n\n\n## Process recommendation\n\n- Primary: **SHEET_METAL**\n\n- Secondary: CNC\n\n- Less suitable (given current inputs): AM, CASTING, FORGING, EXTRUSION, MIM\n\n- Not applicable (hard gated): INJECTION_MOLDING (polymer process), THERMOFORMING (polymer process), COMPRESSION_MOLDING (polymer process)\n\n- Tradeoffs:\n\n  - Tooling lead time vs unit cost: IM/Sheet metal need tooling; CNC/AM suit low volume.\n\n  - Tolerance and finish: Define critical interfaces; plan post-machining or inspection where needed.\n\n  - Risk drivers: Warpage (IM/AM), supports (AM), setups (CNC/Sheet metal) affect feasibility.\n\n  - Volume sensitivity: IM and sheet metal favor production runs; CNC/AM suit proto and small batch.\n\n  - Documentation: 2D drawing and scale confirmation improve tolerance and process selection.\n\n\n\n## Manufacturing confidence inputs\n\n- CAD uploaded: yes\n\n- CAD analysis status: none\n\n- CAD evidence used in rules: no\n\n- CAD Lite analysis: ok\n\n- Extrusion Lite analysis: ok\n\n- Extrusion likelihood: low (source=extrusion_lite)\n\n- Sheet metal likelihood: high (source=cad_lite)\n\n_Confidence inputs not provided._\n\n\n\n## Top priorities\n\n_None_\n\n\n\n## Findings (HIGH)\n\n- **Low volume + MIM (tooling ROI risk)** (MIM1) \u2014 MIM has high upfront tooling cost; unit cost only becomes favorable at production volumes.\n  - Recommendation: Consider CNC or AM for low volumes; MIM best for stable designs at production scale.\n\n## Findings (MEDIUM)\n\n- **Low volume + casting (tooling risk)** (CAST1) \u2014 Casting has significant tooling cost; economics favor production runs.\n  - Recommendation: Consider CNC or AM for low volumes; casting best at production scale.\n- **Low volume + forging (tooling risk)** (FORG1) \u2014 Forging has significant die cost; economics favor production runs.\n  - Recommendation: Consider CNC or AM for low volumes; forging best at production scale.\n\n## Findings (LOW)\n\n_None_\n\n## Action Checklist\n\n- [ ] Address HIGH and MEDIUM findings before release.\n- [ ] Apply recommended design changes for critical features.\n- [ ] Re-verify tolerances and interfaces after changes.\n\n## Assumptions\n\n- Inputs and part summary reflect current design intent.\n- Manufacturing process and material choices are as specified.\n\n## Usage (tokens & cost)\n\n_Usage not available._\n\n\n## LLM usage by node\n\n_Not available._\n\n\n## Agent confidence & limitations\n\n_Not available._\n", "trace": "Run started\nInputs validated\nProcess selection node entered\nprocess_selection: eligible_processes=['AM', 'CASTING', 'CNC', 'CNC_TURNING', 'EXTRUSION', 'FORGING', 'MIM', 'SHEET_METAL']\nprocess_selection: gated_out=[('INJECTION_MOLDING', 'polymer process'), ('THERMOFORMING', 'polymer process'), ('COMPRESSION_MOLDING', 'polymer process')]\nPSI: user_text_len=0 preview=\"\"\nprocess_selection: cad_lite status=ok t_est=1.1021 av_ratio=1.8147 t_over_min_dim=0.0367\nprocess_selection: sheet_metal_likelihood=high (source=cad_lite)\nprocess_selection: extrusion_likelihood=low (coeff_var=0.11134 axis=X)\nprocess_selection: am_likelihood=low (source=bins_only)\nprocess_selection: scorer_path=legacy_bins cad_status=none\nPSI: score_diff=3 (primary=SHEET_METAL=6, second=CNC=3)\nProcess selection computed: primary=SHEET_METAL user_selected=SHEET_METAL\nprocess_selection: cad_uploaded=y evidence_available=n\nrules: cad_uploaded=y cad_status=none evidence_keys=[]\nreport: process_recommendation present=True primary=SHEET_METAL", "error": null, "error_type": null, "state_has_error": false, "case_id": "sm4_bins_template"}}
{"case_id": "edge1_bins_template", "status": "pass", "result": {"primary": "CNC", "secondary": [], "eligible_processes": ["CNC", "CNC_TURNING", "AM", "SHEET_METAL", "CASTING", "FORGING", "EXTRUSION", "MIM"], "gated_out": ["COMPRESSION_MOLDING", "INJECTION_MOLDING", "THERMOFORMING"], "cad_lite_status": "failed", "extrusion_lite_status": "failed", "extrusion_likelihood_level": "none", "sheet_metal_likelihood_level": "low", "sheet_metal_likelihood_source": "none", "findings": [{"rule_id": "PASS1", "severity": "LOW", "process": null, "title": "Low feature variety (favorable for cycle time and tooling)"}, {"rule_id": "PASS2", "severity": "LOW", "process": null, "title": "Low accessibility risk (good tool access)"}, {"rule_id": "CAST1", "severity": "MEDIUM", "process": "CASTING", "title": "Low volume + casting (tooling risk)"}, {"rule_id": "FORG1", "severity": "MEDIUM", "process": "FORGING", "title": "Low volume + forging (tooling risk)"}, {"rule_id": "MIM1", "severity": "HIGH", "process": "MIM", "title": "Low volume + MIM (tooling ROI risk)"}], "top_priorities": ["PASS1", "PASS2"], "duration_ms": 94.06, "report": "# CNC Design Review + DFM Report\n\n## Input summary\n\n- Manufacturing process: CNC\n\n- Material: Steel\n- Production volume: Small batch\n- Load type: Static\n- Tolerance criticality: Medium\n\n- Part size: Medium\n- Min internal radius: Medium\n- Min wall thickness: Medium\n- Hole depth class: None\n- Pocket aspect class: OK\n- Feature variety: Low\n- Accessibility risk: Low\n- Has clamping faces: True\n\n\n## Process recommendation\n\n- Primary: **CNC**\n\n- Secondary: None\n\n- Less suitable (given current inputs): AM, SHEET_METAL, CASTING, FORGING, EXTRUSION, MIM\n\n- Not applicable (hard gated): INJECTION_MOLDING (polymer process), THERMOFORMING (polymer process), COMPRESSION_MOLDING (polymer process)\n\n- Tradeoffs:\n\n  - Tooling lead time vs unit cost: IM/Sheet metal need tooling; CNC/AM suit low volume.\n\n  - Tolerance and finish: Define critical interfaces; plan post-machining or inspection where needed.\n\n  - Risk drivers: Warpage (IM/AM), supports (AM), setups (CNC/Sheet metal) affect feasibility.\n\n  - Volume sensitivity: IM and sheet metal favor production runs; CNC/AM suit proto and small batch.\n\n  - Documentation: 2D drawing and scale confirmation improve tolerance and process selection.\n\n\n\n## Manufacturing confidence inputs\n\n- CAD uploaded: yes\n\n- CAD analysis status: none\n\n- CAD evidence used in rules: no\n\n- CAD Lite analysis: failed\n\n- Extrusion Lite analysis: failed\n\n- Extrusion likelihood: none (source=none)\n\n- Sheet metal likelihood: low (source=none)\n\n_Confidence inputs not provided._\n\n\n\n## Top priorities\n\n- [LOW] Low feature variety (favorable for cycle time and tooling) (PASS1)\n\n- [LOW] Low accessibility risk (good tool access) (PASS2)\n\n\n\n## Findings (HIGH)\n\n- **Low volume + MIM (tooling ROI risk)** (MIM1) \u2014 MIM has high upfront tooling cost; unit cost only becomes favorable at production volumes.\n  - Recommendation: Consider CNC or AM for low volumes; MIM best for stable designs at production scale.\n\n## Findings (MEDIUM)\n\n- **Low volume + casting (tooling risk)** (CAST1) \u2014 Casting has significant tooling cost; economics favor production runs.\n  - Recommendation: Consider CNC or AM for low volumes; casting best at production scale.\n- **Low volume + forging (tooling risk)** (FORG1) \u2014 Forging has significant die cost; economics favor production runs.\n  - Recommendation: Consider CNC or AM for low volumes; forging best at production scale.\n\n## Findings (LOW)\n\n- **Low feature variety (favorable for cycle time and tooling)** (PASS1) \u2014 Low complexity reduces cycle time and tooling risk.\n  - Recommendation: No change needed.\n- **Low accessibility risk (good tool access)** (PASS2) \u2014 Good tool access reduces setup and machining risk.\n  - Recommendation: No change needed.\n\n## Action Checklist\n\n- [ ] Address HIGH and MEDIUM findings before release.\n- [ ] Apply recommended design changes for critical features.\n- [ ] Re-verify tolerances and interfaces after changes.\n\n## Assumptions\n\n- Inputs and part summary reflect current design intent.\n- Manufacturing process and material choices are as specified.\n\n## Usage (tokens & cost)\n\n_Usage not available._\n\n\n## LLM usage by node\n\n_Not available._\n\n\n## Agent confidence & limitations\n\n_Not available._\n", "trace": "Run started\nInputs validated\nProcess selection node entered\nprocess_selection: eligible_processes=['AM', 'CASTING', 'CNC', 'CNC_TURNING', 'EXTRUSION', 'FORGING', 'MIM', 'SHEET_METAL']\nprocess_selection: gated_out=[('INJECTION_MOLDING', 'polymer process'), ('THERMOFORMING', 'polymer process'), ('COMPRESSION_MOLDING', 'polymer process')]\nPSI: user_text_len=0 preview=\"\"\nprocess_selection: cad_lite status=failed\nprocess_selection: sheet_metal_likelihood=low (source=none)\nprocess_selection: extrusion_likelihood=none (coeff_var=? axis=?)\nprocess_selection: am_likelihood=low (source=bins_only)\nprocess_selection: scorer_path=legacy_bins cad_status=none\nPSI: score_diff=4 (primary=CNC=5, second=CNC_TURNING=1)\nProcess selection computed: primary=CNC user_selected=CNC\nprocess_selection: cad_uploaded=y evidence_available=n\nrules: cad_uploaded=y cad_status=none evidence_keys=[]\nreport: process_recommendation present=True primary=CNC", "error": null, "error_type": null, "state_has_error": false, "case_id": "edge1_bins_template"}}
{"case_id": "edge2_bins_template", "status": "pass", "result": {"primary": "CNC", "secondary": ["CNC_TURNING"], "eligible_processes": ["CNC", "CNC_TURNING", "AM", "SHEET_METAL", "CASTING", "FORGING", "EXTRUSION", "MIM"], "gated_out": ["COMPRESSION_MOLDING", "INJECTION_MOLDING", "THERMOFORMING"], "cad_lite_status": "ok", "extrusion_lite_status": "ok", "extrusion_likelihood_level": "low", "sheet_metal_likelihood_level": "med", "sheet_metal_likelihood_source": "cad_lite", "findings": [{"rule_id": "PASS1", "severity": "LOW", "process": null, "title": "Low feature variety (favorable for cycle time and tooling)"}, {"rule_id": "PASS2", "severity": "LOW", "process": null, "title": "Low accessibility risk (good tool access)"}], "top_priorities": ["PASS1", "PASS2"], "duration_ms": 92.26, "report": "# CNC Design Review + DFM Report\n\n## Input summary\n\n- Manufacturing process: CNC\n\n- Material: Aluminum\n- Production volume: Production\n- Load type: Static\n- Tolerance criticality: Medium\n\n- Part size: Medium\n- Min internal radius: Medium\n- Min wall thickness: Medium\n- Hole depth class: None\n- Pocket aspect class: OK\n- Feature variety: Low\n- Accessibility risk: Low\n- Has clamping faces: True\n\n\n## Process recommendation\n\n- Primary: **CNC**\n\n- Secondary: CNC_TURNING\n\n- Less suitable (given current inputs): AM\n\n- Not applicable (hard gated): INJECTION_MOLDING (polymer process), THERMOFORMING (polymer process), COMPRESSION_MOLDING (polymer process)\n\n- Tradeoffs:\n\n  - Tooling lead time vs unit cost: IM/Sheet metal need tooling; CNC/AM suit low volume.\n\n  - Tolerance and finish: Define critical interfaces; plan post-machining or inspection where needed.\n\n  - Risk drivers: Warpage (IM/AM), supports (AM), setups (CNC/Sheet metal) affect feasibility.\n\n  - Volume sensitivity: IM and sheet metal favor production runs; CNC/AM suit proto and small batch.\n\n  - Documentation: 2D drawing and scale confirmation improve tolerance and process selection.\n\n\n\n## Manufacturing confidence inputs\n\n- CAD uploaded: yes\n\n- CAD analysis status: none\n\n- CAD evidence used in rules: no\n\n- CAD Lite analysis: ok\n\n- Extrusion Lite analysis: ok\n\n- Extrusion likelihood: low (source=extrusion_lite)\n\n- Sheet metal likelihood: med (source=cad_lite)\n\n_Confidence inputs not provided._\n\n\n\n## Top priorities\n\n- [LOW] Low feature variety (favorable for cycle time and tooling) (PASS1)\n\n- [LOW] Low accessibility risk (good tool access) (PASS2)\n\n\n\n## Findings (HIGH)\n\n_None_\n\n## Findings (MEDIUM)\n\n_None_\n\n## Findings (LOW)\n\n- **Low feature variety (favorable for cycle time and tooling)** (PASS1) \u2014 Low complexity reduces cycle time and tooling risk.\n  - Recommendation: No change needed.\n- **Low accessibility risk (good tool access)** (PASS2) \u2014 Good tool access reduces setup and machining risk.\n  - Recommendation: No change needed.\n\n## Action Checklist\n\n- [ ] No blocking issues; optional improvements may apply.\n- [ ] Review LOW findings for incremental improvements.\n- [ ] Confirm part meets functional requirements.\n\n## Assumptions\n\n- Inputs and part summary reflect current design intent.\n- Manufacturing process and material choices are as specified.\n\n## Usage (tokens & cost)\n\n_Usage not available._\n\n\n## LLM usage by node\n\n_Not available._\n\n\n## Agent confidence & limitations\n\n_Not available._\n", "trace": "Run started\nInputs validated\nProcess selection node entered\nprocess_selection: eligible_processes=['AM', 'CASTING', 'CNC', 'CNC_TURNING', 'EXTRUSION', 'FORGING', 'MIM', 'SHEET_METAL']\nprocess_selection: gated_out=[('INJECTION_MOLDING', 'polymer process'), ('THERMOFORMING', 'polymer process'), ('COMPRESSION_MOLDING', 'polymer process')]\nPSI: user_text_len=0 preview=\"\"\nprocess_selection: cad_lite status=ok t_est=3.0477 av_ratio=0.6562 t_over_min_dim=0.2032\nprocess_selection: sheet_metal_likelihood=med (source=cad_lite)\nprocess_selection: extrusion_likelihood=low (coeff_var=0.352472 axis=X)\nprocess_selection: am_likelihood=low (source=bins_only)\nprocess_selection: bins_guard MIM cap for Aluminum\nprocess_selection: scorer_path=legacy_bins cad_status=none\nPSI: score_diff=0 (primary=CNC=3, second=SHEET_METAL=3)\nPSI tie-break: prefer user-selected flexible process (CNC) when score_diff <= 1 (compatible, no strong mismatch)\nProcess selection computed: primary=CNC user_selected=CNC\nprocess_selection: cad_uploaded=y evidence_available=n\nrules: cad_uploaded=y cad_status=none evidence_keys=[]\nreport: process_recommendation present=True primary=CNC", "error": null, "error_type": null, "state_has_error": false, "case_id": "edge2_bins_template"}}
{"case_id": "edge3_bins_template", "status": "pass", "result": {"primary": "CNC", "secondary": ["THERMOFORMING", "CNC_TURNING"], "eligible_processes": ["CNC", "CNC_TURNING", "AM", "SHEET_METAL", "INJECTION_MOLDING", "EXTRUSION", "THERMOFORMING", "COMPRESSION_MOLDING"], "gated_out": ["CASTING", "FORGING", "MIM"], "cad_lite_status": "failed", "extrusion_lite_status": "failed", "extrusion_likelihood_level": "none", "sheet_metal_likelihood_level": "low", "sheet_metal_likelihood_source": "none", "findings": [{"rule_id": "PASS1", "severity": "LOW", "process": null, "title": "Low feature variety (favorable for cycle time and tooling)"}, {"rule_id": "PASS2", "severity": "LOW", "process": null, "title": "Low accessibility risk (good tool access)"}, {"rule_id": "IM1", "severity": "HIGH", "process": "INJECTION_MOLDING", "title": "Low volume + injection molding (tooling ROI risk)"}], "top_priorities": ["PASS1", "PASS2"], "duration_ms": 112.98, "report": "# CNC Design Review + DFM Report\n\n## Input summary\n\n- Manufacturing process: CNC\n\n- Material: Plastic\n- Production volume: Small batch\n- Load type: Static\n- Tolerance criticality: Medium\n\n- Part size: Medium\n- Min internal radius: Medium\n- Min wall thickness: Medium\n- Hole depth class: None\n- Pocket aspect class: OK\n- Feature variety: Low\n- Accessibility risk: Low\n- Has clamping faces: True\n\n\n## Process recommendation\n\n- Primary: **CNC**\n\n- Secondary: THERMOFORMING, CNC_TURNING\n\n- Less suitable (given current inputs): None\n\n- Not applicable (hard gated): CASTING (metal process), FORGING (metal process), MIM (metal process)\n\n- Tradeoffs:\n\n  - Tooling lead time vs unit cost: IM/Sheet metal need tooling; CNC/AM suit low volume.\n\n  - Tolerance and finish: Define critical interfaces; plan post-machining or inspection where needed.\n\n  - Risk drivers: Warpage (IM/AM), supports (AM), setups (CNC/Sheet metal) affect feasibility.\n\n  - Volume sensitivity: IM and sheet metal favor production runs; CNC/AM suit proto and small batch.\n\n  - Documentation: 2D drawing and scale confirmation improve tolerance and process selection.\n\n\n\n## Manufacturing confidence inputs\n\n- CAD uploaded: yes\n\n- CAD analysis status: none\n\n- CAD evidence used in rules: no\n\n- CAD Lite analysis: failed\n\n- Extrusion Lite analysis: failed\n\n- Extrusion likelihood: none (source=none)\n\n- Sheet metal likelihood: low (source=none)\n\n_Confidence inputs not provided._\n\n\n\n## Top priorities\n\n- [LOW] Low feature variety (favorable for cycle time and tooling) (PASS1)\n\n- [LOW] Low accessibility risk (good tool access) (PASS2)\n\n\n\n## Findings (HIGH)\n\n- **Low volume + injection molding (tooling ROI risk)** (IM1) \u2014 Injection molding has high upfront tooling cost; unit cost only becomes favorable at high volumes.\n  - Recommendation: Consider alternative processes (CNC, AM) for low volumes; injection molding best for stable designs at production scale.\n\n## Findings (MEDIUM)\n\n_None_\n\n## Findings (LOW)\n\n- **Low feature variety (favorable for cycle time and tooling)** (PASS1) \u2014 Low complexity reduces cycle time and tooling risk.\n  - Recommendation: No change needed.\n- **Low accessibility risk (good tool access)** (PASS2) \u2014 Good tool access reduces setup and machining risk.\n  - Recommendation: No change needed.\n\n## Action Checklist\n\n- [ ] Address HIGH and MEDIUM findings before release.\n- [ ] Apply recommended design changes for critical features.\n- [ ] Re-verify tolerances and interfaces after changes.\n\n## Assumptions\n\n- Inputs and part summary reflect current design intent.\n- Manufacturing process and material choices are as specified.\n\n## Usage (tokens & cost)\n\n_Usage not available._\n\n\n## LLM usage by node\n\n_Not available._\n\n\n## Agent confidence & limitations\n\n_Not available._\n", "trace": "Run started\nInputs validated\nProcess selection node entered\nprocess_selection: eligible_processes=['AM', 'CNC', 'CNC_TURNING', 'COMPRESSION_MOLDING', 'EXTRUSION', 'INJECTION_MOLDING', 'SHEET_METAL', 'THERMOFORMING']\nprocess_selection: gated_out=[('CASTING', 'metal process'), ('FORGING', 'metal process'), ('MIM', 'metal process')]\nPSI: user_text_len=0 preview=\"\"\nprocess_selection: cad_lite status=failed\nprocess_selection: sheet_metal_likelihood=low (source=none)\nprocess_selection: extrusion_likelihood=none (coeff_var=? axis=?)\nprocess_selection: am_likelihood=low (source=bins_only)\nprocess_selection: scorer_path=legacy_bins cad_status=none\nprocess_selection: bins_anchor applied selected=CNC margin=2 top_was=THERMOFORMING\nPSI: score_diff=0 (primary=CNC=2, second=CNC=2)\nPSI tie-break: prefer user-selected flexible process (CNC) when score_diff <= 1 (compatible, no strong mismatch)\nPSI: final score_diff=0 (after tie-break, primary changed from THERMOFORMING to CNC)\nProcess selection computed: primary=CNC user_selected=CNC\nprocess_selection: cad_uploaded=y evidence_available=n\nrules: cad_uploaded=y cad_status=none evidence_keys=[]\nreport: process_recommendation present=True primary=CNC", "error": null, "error_type": null, "state_has_error": false, "case_id": "edge3_bins_template"}}
{"case_id": "edge4_bins_template", "status": "pass", "result": {"primary": "CNC", "secondary": ["MIM", "CNC_TURNING"], "eligible_processes": ["CNC", "CNC_TURNING", "AM", "SHEET_METAL", "CASTING", "FORGING", "EXTRUSION", "MIM"], "gated_out": ["COMPRESSION_MOLDING", "INJECTION_MOLDING", "THERMOFORMING"], "cad_lite_status": "failed", "extrusion_lite_status": "failed", "extrusion_likelihood_level": "none", "sheet_metal_likelihood_level": "low", "sheet_metal_likelihood_source": "none", "findings": [{"rule_id": "DFM10", "severity": "MEDIUM", "process": null, "title": "Steel + tight tolerances (machinability & inspection risk)"}], "top_priorities": ["DFM10"], "duration_ms": 114.67, "report": "# CNC Design Review + DFM Report\n\n## Input summary\n\n- Manufacturing process: CNC\n\n- Material: Steel\n- Production volume: Production\n- Load type: Dynamic\n- Tolerance criticality: High\n\n- Part size: Medium\n- Min internal radius: Medium\n- Min wall thickness: Medium\n- Hole depth class: None\n- Pocket aspect class: OK\n- Feature variety: Low\n- Accessibility risk: Low\n- Has clamping faces: True\n\n\n## Process recommendation\n\n- Primary: **CNC**\n\n- Secondary: MIM, CNC_TURNING\n\n- Less suitable (given current inputs): AM, SHEET_METAL\n\n- Not applicable (hard gated): INJECTION_MOLDING (polymer process), THERMOFORMING (polymer process), COMPRESSION_MOLDING (polymer process)\n\n- Secondary rationale:\n\n  - Production volume favors MIM economics\n\n- Tradeoffs:\n\n  - Tooling lead time vs unit cost: IM/Sheet metal need tooling; CNC/AM suit low volume.\n\n  - Tolerance and finish: Define critical interfaces; plan post-machining or inspection where needed.\n\n  - Risk drivers: Warpage (IM/AM), supports (AM), setups (CNC/Sheet metal) affect feasibility.\n\n  - Volume sensitivity: IM and sheet metal favor production runs; CNC/AM suit proto and small batch.\n\n  - Documentation: 2D drawing and scale confirmation improve tolerance and process selection.\n\n\n\n## Manufacturing confidence inputs\n\n- CAD uploaded: yes\n\n- CAD analysis status: none\n\n- CAD evidence used in rules: no\n\n- CAD Lite analysis: failed\n\n- Extrusion Lite analysis: failed\n\n- Extrusion likelihood: none (source=none)\n\n- Sheet metal likelihood: low (source=none)\n\n_Confidence inputs not provided._\n\n\n\n## Top priorities\n\n- [MEDIUM] Steel + tight tolerances (machinability & inspection risk) (DFM10)\n\n\n\n## Findings (HIGH)\n\n_None_\n\n## Findings (MEDIUM)\n\n- **Steel + tight tolerances (machinability & inspection risk)** (DFM10) \u2014 Harder-to-machine materials increase tool wear and make tight tolerances harder and costlier to hold reliably.\n  - Recommendation: Consider relaxing tolerances where possible; choose free-machining grades if allowed; plan inspection strategy.\n\n## Findings (LOW)\n\n_None_\n\n## Action Checklist\n\n- [ ] Address HIGH and MEDIUM findings before release.\n- [ ] Apply recommended design changes for critical features.\n- [ ] Re-verify tolerances and interfaces after changes.\n\n## Assumptions\n\n- Inputs and part summary reflect current design intent.\n- Manufacturing process and material choices are as specified.\n\n## Usage (tokens & cost)\n\n_Usage not available._\n\n\n## LLM usage by node\n\n_Not available._\n\n\n## Agent confidence & limitations\n\n_Not available._\n", "trace": "Run started\nInputs validated\nProcess selection node entered\nprocess_selection: eligible_processes=['AM', 'CASTING', 'CNC', 'CNC_TURNING', 'EXTRUSION', 'FORGING', 'MIM', 'SHEET_METAL']\nprocess_selection: gated_out=[('INJECTION_MOLDING', 'polymer process'), ('THERMOFORMING', 'polymer process'), ('COMPRESSION_MOLDING', 'polymer process')]\nPSI: user_text_len=0 preview=\"\"\nprocess_selection: cad_lite status=failed\nprocess_selection: sheet_metal_likelihood=low (source=none)\nprocess_selection: extrusion_likelihood=none (coeff_var=? axis=?)\nprocess_selection: am_likelihood=low (source=bins_only)\nprocess_selection: scorer_path=legacy_bins cad_status=none\nPSI: score_diff=0 (primary=CNC=4, second=MIM=4)\nPSI tie-break: prefer user-selected flexible process (CNC) when score_diff <= 1 (compatible, no strong mismatch)\nProcess selection computed: primary=CNC user_selected=CNC\nprocess_selection: cad_uploaded=y evidence_available=n\nrules: cad_uploaded=y cad_status=none evidence_keys=[]\nreport: process_recommendation present=True primary=CNC", "error": null, "error_type": null, "state_has_error": false, "case_id": "edge4_bins_template"}}
{"case_id": "edge5_bins_template", "status": "pass", "result": {"primary": "CNC", "secondary": ["AM"], "eligible_processes": ["CNC", "CNC_TURNING", "AM", "SHEET_METAL", "CASTING", "FORGING", "EXTRUSION", "MIM"], "gated_out": ["COMPRESSION_MOLDING", "INJECTION_MOLDING", "THERMOFORMING"], "cad_lite_status": "failed", "extrusion_lite_status": "failed", "extrusion_likelihood_level": "none", "sheet_metal_likelihood_level": "low", "sheet_metal_likelihood_source": "none", "findings": [{"rule_id": "PASS1", "severity": "LOW", "process": null, "title": "Low feature variety (favorable for cycle time and tooling)"}, {"rule_id": "PASS2", "severity": "LOW", "process": null, "title": "Low accessibility risk (good tool access)"}, {"rule_id": "CAST1", "severity": "MEDIUM", "process": "CASTING", "title": "Low volume + casting (tooling risk)"}, {"rule_id": "FORG1", "severity": "MEDIUM", "process": "FORGING", "title": "Low volume + forging (tooling risk)"}, {"rule_id": "MIM1", "severity": "HIGH", "process": "MIM", "title": "Low volume + MIM (tooling ROI risk)"}], "top_priorities": ["PASS1", "PASS2"], "duration_ms": 130.47, "report": "# CNC Design Review + DFM Report\n\n## Input summary\n\n- Manufacturing process: CNC\n\n- Material: Aluminum\n- Production volume: Proto\n- Load type: Static\n- Tolerance criticality: Low\n\n- Part size: Medium\n- Min internal radius: Medium\n- Min wall thickness: Medium\n- Hole depth class: None\n- Pocket aspect class: OK\n- Feature variety: Low\n- Accessibility risk: Low\n- Has clamping faces: True\n\n\n## Process recommendation\n\n- Primary: **CNC**\n\n- Secondary: AM\n\n- Less suitable (given current inputs): SHEET_METAL, CASTING, FORGING, EXTRUSION, MIM\n\n- Not applicable (hard gated): INJECTION_MOLDING (polymer process), THERMOFORMING (polymer process), COMPRESSION_MOLDING (polymer process)\n\n- Tradeoffs:\n\n  - Tooling lead time vs unit cost: IM/Sheet metal need tooling; CNC/AM suit low volume.\n\n  - Tolerance and finish: Define critical interfaces; plan post-machining or inspection where needed.\n\n  - Risk drivers: Warpage (IM/AM), supports (AM), setups (CNC/Sheet metal) affect feasibility.\n\n  - Volume sensitivity: IM and sheet metal favor production runs; CNC/AM suit proto and small batch.\n\n  - Documentation: 2D drawing and scale confirmation improve tolerance and process selection.\n\n\n\n## Manufacturing confidence inputs\n\n- CAD uploaded: yes\n\n- CAD analysis status: none\n\n- CAD evidence used in rules: no\n\n- CAD Lite analysis: failed\n\n- Extrusion Lite analysis: failed\n\n- Extrusion likelihood: none (source=none)\n\n- Sheet metal likelihood: low (source=none)\n\n_Confidence inputs not provided._\n\n\n\n## Top priorities\n\n- [LOW] Low feature variety (favorable for cycle time and tooling) (PASS1)\n\n- [LOW] Low accessibility risk (good tool access) (PASS2)\n\n\n\n## Findings (HIGH)\n\n- **Low volume + MIM (tooling ROI risk)** (MIM1) \u2014 MIM has high upfront tooling cost; unit cost only becomes favorable at production volumes.\n  - Recommendation: Consider CNC or AM for low volumes; MIM best for stable designs at production scale.\n\n## Findings (MEDIUM)\n\n- **Low volume + casting (tooling risk)** (CAST1) \u2014 Casting has significant tooling cost; economics favor production runs.\n  - Recommendation: Consider CNC or AM for low volumes; casting best at production scale.\n- **Low volume + forging (tooling risk)** (FORG1) \u2014 Forging has significant die cost; economics favor production runs.\n  - Recommendation: Consider CNC or AM for low volumes; forging best at production scale.\n\n## Findings (LOW)\n\n- **Low feature variety (favorable for cycle time and tooling)** (PASS1) \u2014 Low complexity reduces cycle time and tooling risk.\n  - Recommendation: No change needed.\n- **Low accessibility risk (good tool access)** (PASS2) \u2014 Good tool access reduces setup and machining risk.\n  - Recommendation: No change needed.\n\n## Action Checklist\n\n- [ ] Address HIGH and MEDIUM findings before release.\n- [ ] Apply recommended design changes for critical features.\n- [ ] Re-verify tolerances and interfaces after changes.\n\n## Assumptions\n\n- Inputs and part summary reflect current design intent.\n- Manufacturing process and material choices are as specified.\n\n## Usage (tokens & cost)\n\n_Usage not available._\n\n\n## LLM usage by node\n\n_Not available._\n\n\n## Agent confidence & limitations\n\n_Not available._\n", "trace": "Run started\nInputs validated\nProcess selection node entered\nprocess_selection: eligible_processes=['AM', 'CASTING', 'CNC', 'CNC_TURNING', 'EXTRUSION', 'FORGING', 'MIM', 'SHEET_METAL']\nprocess_selection: gated_out=[('INJECTION_MOLDING', 'polymer process'), ('THERMOFORMING', 'polymer process'), ('COMPRESSION_MOLDING', 'polymer process')]\nPSI: user_text_len=0 preview=\"\"\nprocess_selection: cad_lite status=failed\nprocess_selection: sheet_metal_likelihood=low (source=none)\nprocess_selection: extrusion_likelihood=none (coeff_var=? axis=?)\nprocess_selection: am_likelihood=low (source=bins_only)\nprocess_selection: bins_guard MIM cap for Aluminum\nprocess_selection: scorer_path=legacy_bins cad_status=none\nPSI: score_diff=3 (primary=CNC=5, second=AM=2)\nProcess selection computed: primary=CNC user_selected=CNC\nprocess_selection: cad_uploaded=y evidence_available=n\nrules: cad_uploaded=y cad_status=none evidence_keys=[]\nreport: process_recommendation present=True primary=CNC", "error": null, "error_type": null, "state_has_error": false, "case_id": "edge5_bins_template"}}
