{"case_id": "im1_bins_plastic_high", "status": "fail", "result": {"primary": "INJECTION_MOLDING", "secondary": [], "eligible_processes": ["CNC", "CNC_TURNING", "AM", "SHEET_METAL", "INJECTION_MOLDING", "EXTRUSION", "THERMOFORMING", "COMPRESSION_MOLDING"], "gated_out": ["CASTING", "FORGING", "MIM"], "cad_lite_status": "failed", "sheet_metal_likelihood_level": "low", "sheet_metal_likelihood_source": "none", "findings": [{"rule_id": "PASS1", "severity": "LOW", "process": null, "title": "Low feature variety (favorable for cycle time and tooling)"}, {"rule_id": "PASS2", "severity": "LOW", "process": null, "title": "Low accessibility risk (good tool access)"}, {"rule_id": "PSI1", "severity": "MEDIUM", "process": null, "title": "Selected process differs from recommended process"}], "top_priorities": ["PSI1", "PASS1", "PASS2"], "duration_ms": 217.93, "report": "# CNC Design Review + DFM Report\n\n## Input summary\n\n- Manufacturing process: CNC\n\n- Material: Plastic\n- Production volume: Production\n- Load type: Static\n- Tolerance criticality: Medium\n\n- Part size: Medium\n- Min internal radius: Medium\n- Min wall thickness: Medium\n- Hole depth class: None\n- Pocket aspect class: OK\n- Feature variety: Low\n- Accessibility risk: Low\n- Has clamping faces: True\n\n\n## Process recommendation\n\n- Primary: **INJECTION_MOLDING**\n\n- Secondary: None\n\n- Less suitable (given current inputs): AM, SHEET_METAL, EXTRUSION\n\n- Not applicable (hard gated): CASTING (metal process), FORGING (metal process), MIM (metal process)\n\n- Primary rationale:\n\n  - Production volume favors IM economics\n\n- Tradeoffs:\n\n  - Tooling lead time vs unit cost: IM/Sheet metal need tooling; CNC/AM suit low volume.\n\n  - Tolerance and finish: Define critical interfaces; plan post-machining or inspection where needed.\n\n  - Risk drivers: Warpage (IM/AM), supports (AM), setups (CNC/Sheet metal) affect feasibility.\n\n  - Volume sensitivity: IM and sheet metal favor production runs; CNC/AM suit proto and small batch.\n\n  - Documentation: 2D drawing and scale confirmation improve tolerance and process selection.\n\n\n\n## Manufacturing confidence inputs\n\n- CAD uploaded: yes\n\n- CAD analysis status: none\n\n- CAD evidence used in rules: no\n\n- CAD Lite analysis: failed\n\n- Sheet metal likelihood: low (source=none)\n\n_Confidence inputs not provided._\n\n\n\n## Top priorities\n\n- [MEDIUM] Selected process differs from recommended process (PSI1)\n\n- [LOW] Low feature variety (favorable for cycle time and tooling) (PASS1)\n\n- [LOW] Low accessibility risk (good tool access) (PASS2)\n\n\n\n## Findings (HIGH)\n\n_None_\n\n## Findings (MEDIUM)\n\n- **Selected process differs from recommended process** (PSI1) \u2014 Process selection intelligence recommends INJECTION_MOLDING (score advantage: 12 points) over selected CNC. This may indicate suboptimal process choice for material, volume, or geometry.\n  - Recommendation: Consider INJECTION_MOLDING as alternatives. Evaluate tradeoffs: tooling lead time vs unit cost, tolerance/finish requirements, and volume sensitivity.\n\n## Findings (LOW)\n\n- **Low feature variety (favorable for cycle time and tooling)** (PASS1) \u2014 Low complexity reduces cycle time and tooling risk.\n  - Recommendation: No change needed.\n- **Low accessibility risk (good tool access)** (PASS2) \u2014 Good tool access reduces setup and machining risk.\n  - Recommendation: No change needed.\n\n## Action Checklist\n\n- [ ] Address HIGH and MEDIUM findings before release.\n- [ ] Apply recommended design changes for critical features.\n- [ ] Re-verify tolerances and interfaces after changes.\n\n## Assumptions\n\n- Inputs and part summary reflect current design intent.\n- Manufacturing process and material choices are as specified.\n\n## Usage (tokens & cost)\n\n_Usage not available._\n\n\n## LLM usage by node\n\n_Not available._\n\n\n## Agent confidence & limitations\n\n_Not available._\n", "trace": "Run started\nInputs validated\nProcess selection node entered\nprocess_selection: eligible_processes=['AM', 'CNC', 'CNC_TURNING', 'COMPRESSION_MOLDING', 'EXTRUSION', 'INJECTION_MOLDING', 'SHEET_METAL', 'THERMOFORMING']\nprocess_selection: gated_out=[('CASTING', 'metal process'), ('FORGING', 'metal process'), ('MIM', 'metal process')]\nPSI: user_text_len=0 preview=\"\"\nprocess_selection: cad_lite status=failed\nprocess_selection: sheet_metal_likelihood=low (source=none)\nprocess_selection: scorer_path=legacy_bins cad_status=none\nPSI: score_diff=5 (primary=INJECTION_MOLDING=10, second=THERMOFORMING=5)\nProcess selection computed: primary=INJECTION_MOLDING user_selected=CNC\nprocess_selection: cad_uploaded=y evidence_available=n\nProcess selection mismatch: user_selected=CNC but primary=INJECTION_MOLDING\nProcess selection warning added: selected=CNC, recommended=INJECTION_MOLDING\nrules: cad_uploaded=y cad_status=none evidence_keys=[]\nreport: process_recommendation present=True primary=INJECTION_MOLDING", "error": null, "error_type": null, "state_has_error": false, "case_id": "im1_bins_plastic_high"}}
